Number,StartMilliseconds,EndMilliseconds,Text
1,25483,26817,Let me tell you something.
2,26985,30446,The SCLC has direct Communist ties.
3,30613,33282,"Even great men can be corrupted,
can't they?"
4,33450,36994,"Communism is not a political party.
It is a disease."
5,37162,39788,"It corrupts the soul,
turning even the gentlest of men..."
6,39956,43167,"into vicious, evil tyrants."
7,43334,46754,"What we are seeing is a pervasive contempt
for law and order."
8,46921,48005,Crime rates are soaring.
9,48173,50883,"There's widespread,
open defiance of our authority..."
10,51051,53552,"and, mark my words,
if this goes unchecked..."
11,53720,58307,"it will once again plunge our nation
into the depths of anarchy."
12,58475,61310,"It all starts out peacefully,
doesn't it, Mr. Irwin?"
13,61478,63020,You have to live with the fact...
14,63188,66106,"that you could've helped prevent
the bombings and the violence."
15,66274,68817,"I'm more interested in what this says
about your FBI."
16,68985,71361,"I have worked too long and hard
to just sit back..."
17,71529,75324,"and watch the bad guys capture
the spotlight again, haven't I?"
18,75492,77201,The funny thing about notoriety...
19,77368,81830,"especially the kind that needs adoration,
fame for fame's sake..."
20,81998,84249,"if unchecked, it inevitably leads to villainy."
21,84417,87669,"I suggest you look at what this squabble
is really about..."
22,87837,91673,"before you destroy the reputation
of the thing we both know you love most."
23,106356,108982,"Sir, the writer's here from Crime Records..."
24,109150,110192,the PR Department.
25,110360,113362,"Set him up with a typewriter
in my outer office."
26,113530,116990,"Miss Gandy, it's time this generation
learn my side of the story."
27,117158,119201,"- Right away.
- Thank you."
28,120745,123080,"In 1919, Agent Smith..."
29,123248,125707,"my first boss here
at the Department of Justice..."
30,125875,128919,was Attorney General A. Mitchell Palmer.
31,129087,130254,He was a Quaker.
32,130421,135384,"He didn't believe in war, but he understood
the necessity of strength and resolve."
33,135552,137386,Believe what you will from historians...
34,137554,141473,"most write from a present perspective,
forgetting context."
35,141641,144726,Mitchell Palmer was a hero.
36,177093,178527,Are you all right?
37,179095,181180,"- Are you all right?
- Yes. I think. Yes."
38,199115,202284,It's all right. Come here.
39,202452,205954,"- It's all right, it's all right.
- No, it's okay."
40,206122,208916,Are you okay? It's okay.
41,212837,214755,Are you okay?
42,239781,242991,"You see, Palmer fought the radicals,
just as I have."
43,243159,247621,"And just as I have, he was targeted.
He wasn't alone."
44,247789,252668,"Across the country that night,
eight bombs exploded, all at 11 p.m."
45,252835,254336,Two United States senators...
46,254504,257005,"four cabinet members,
a Supreme Court justice..."
47,257173,259299,"John D. Rockefeller, J.P. Morgan..."
48,260009,263345,"all of them targeted
by Bolshevik Communists."
49,263513,265681,"Yeah, it shook the whole thing."
50,269686,272562,"It was clear to me the radical's bomb
went off too soon..."
51,272730,275524,leaving only his blood in the street.
52,275692,280320,"But the inspectors used buckets
to clean up the mess instead of collecting it."
53,280488,283865,"They discarded his gun
instead of preserving its prints."
54,284033,286201,"But you see,
this wasn't clumsy police work."
55,286369,289496,"In those times, it was normal procedure."
56,289664,292958,"This may be the end of days
for this country, Dwight."
57,297380,301550,"It was 1919,
before anyone respected criminal science..."
58,301718,304720,"before federal powers,
before the FBI."
59,305555,310475,"It was that night my eyes were opened.
That very night."
60,311227,312769,"Is he a neighbor, sir?"
61,313271,315188,No. He works in my office.
62,317358,321903,"""There will have to be murder.
We will kill because it is necessary."
63,322071,325866,"We will destroy to rid the world
of your tyrannical institutions."""
64,334250,336710,"You were at Attorney General
Palmer's home that night?"
65,336878,339463,"Well, let's leave that
to the reader's imagination."
66,339672,343550,"You see, it's important we give
our protagonist a bit of mystery."
67,343760,346720,"I could allude to a young man
who matches your description."
68,346888,348347,The best of both worlds.
69,348514,350724,Where did you get your law degree?
70,350892,353060,George Washington. I grew up here.
71,353227,355520,"I had a mom to take care of,
so I stayed close."
72,355688,357939,I received an English degree there also.
73,358775,362944,"Then I don't need to tell you that
what determines a man's legacy..."
74,363112,365405,is often what isn't seen.
75,365698,367991,What's critical at this moment is...
76,368201,372454,"that we re-clarify the difference
between villain and hero."
77,373956,376625,How do you think that compares with today?
78,377627,380420,"I'm not sure, sir.
I'd like to hear more."
79,380588,382589,I could come back tomorrow.
80,383299,386593,Fine. But the pages stay here.
81,386761,388095,"Of course, sir."
82,389972,391139,Agent Smith.
83,391307,392391,"Thank you, sir."
84,400650,402776,Never a good idea to talk too loud.
85,409325,410617,"Good morning, John."
86,410785,413870,"Mr. Palmer has asked that you attend
the emergency meeting today."
87,414038,415580,"Miss Gladwell, please remember..."
88,416916,418417,it's Mr. Hoover.
89,418584,420502,Two o'clock.
90,420670,424339,"Don't be too early this time.
It's as rude as being tardy."
91,425174,428760,"And who is this lovely addition
to the secretarial pool?"
92,431806,433849,"Helen, introduce yourself."
93,434100,435142,Oh.
94,435309,438145,"Pleased to meet you, Mr. Hoover.
I'm Helen Gandy."
95,438312,441356,"Pleased to meet you.
Welcome to the Department of Justice."
96,442859,445444,"You can notify Mr. Palmer
that I will attend."
97,446195,447654,Of course.
98,450366,453410,"He's always a charmer.
I wouldn't take anything very seriously."
99,462712,464504,"Jeremy, I need your help."
100,464672,466339,"I need, uh-- uh, help."
101,466507,467966,I need your help.
102,486194,487360,"Good evening, Mother."
103,491073,492240,Edgar.
104,494076,496912,Madame Marcia held court this morning.
105,497538,500248,Her premonition: I should buy a dress.
106,501250,503752,She says your father will die soon.
107,504670,509591,"And when he does, you will rise to be
the most powerful man in the country."
108,513471,515764,"Your brother's a good man, Edgar..."
109,515932,519434,"but you will restore
our family to greatness."
110,522730,523772,Edgar?
111,523940,526441,Edgar? Am I boring you?
112,526609,529277,"I'm listening, Mother.
You fired the maid."
113,530112,532322,"I told her when she was through,
she could quit."
114,532490,536952,"I'm not paying for her impudence.
The whole Negro race is in open revolt."
115,537119,539287,"- I could open an investigation.
- Gotten too comfortable."
116,539455,542415,"Did you hear what I said?
I said I could open an investigation."
117,542583,543708,Say what you mean.
118,544293,548255,"Mr. Palmer called me into a meeting today.
The war against the Bolsheviks has begun."
119,548422,551633,"He's insisted that I lead
a new anti-radical division."
120,551801,553301,Did you leap like a dog?
121,554011,557138,"I told him this is the greatest threat
our nation has ever faced..."
122,557306,561142,"and I cannot take the job
unless I feel certain I can be effective."
123,561310,563770,Well done. But you'll take it.
124,563938,565814,"Three thousand a year, Mother."
125,565982,568984,"I've got to get new clothes.
You can't look like that anymore."
126,571237,574781,"I have 40 names of suspected radicals
already in only four hours."
127,574949,576825,"I should have 10,000
by end of the month."
128,576993,581788,"And I have my own staff, trusted agents."
129,581956,584499,"Edgar, are you smoking?"
130,585293,588670,"- Doesn't come naturally, Mother.
- Listen to the doctor."
131,588838,592299,"With this new burden,
your nerves could get the better of you."
132,596012,597971,You don't want to end up like your father.
133,598139,600682,"Go and try one now.
You can put your father in his room."
134,600850,602350,I have to get ready for dinner.
135,604687,606438,Are you abandoning me tonight?
136,607648,610025,"It's with a typist.
She's very organized."
137,611402,612444,Is it a date?
138,612612,614654,I think so. I think so.
139,614822,619200,"I'm gonna show her my old card catalog system
at the Library of Congress."
140,619452,621244,Romance her.
141,622038,623622,Wear a blue tie.
142,624582,626958,You look so handsome in your blue tie.
143,637720,638720,Look at the ceiling.
144,638888,640388,It's incredible.
145,644727,647520,I've never been here before.
146,654987,656363,I helped organize it.
147,656530,659074,"See, every item is assigned
its own index card..."
148,659241,660992,with its own unique code...
149,661160,665121,"indicating the title, author,
location, and topic."
150,665289,669668,"What used to take days to locate
now only takes a matter of minutes."
151,669835,673171,"Go on. Give me an author or a topic.
Anything."
152,674173,675215,Indiscretion.
153,675383,676591,What era?
154,676842,677884,Present day.
155,678052,680512,Good. Time me.
156,715506,717066,Almost there.
157,722179,724806,"How do you know I didn't mean
political indiscretion?"
158,725683,728268,"Well, if you'd like,
I can start all over again."
159,728436,729602,This will do.
160,729770,731479,How long did I take?
161,731647,733815,"One minute, 10 seconds."
162,733983,737610,"Now imagine if every citizen in this country
were uniquely identifiable..."
163,737778,741990,"by their own card and number,
say, the pattern on their fingers."
164,742992,747036,"Imagine how quickly we could find them
if they committed a crime."
165,747496,749330,"It's all very impressive, John."
166,750666,754919,"Well, would you like to stay here
or would you like to go somewhere else?"
167,755796,757213,It's up to you.
168,761886,762927,Mr. Hoover.
169,765514,768016,"I'm not sure where you think
this is headed."
170,768601,770185,"Right, of course."
171,772688,773980,Miss Gandy.
172,776734,779027,"I know we've only known each other
a brief time..."
173,779195,781529,"but you would make
the finest of companions."
174,781697,785158,"Your strength, your character, your education."
175,785326,787285,Are you poking fun at me?
176,787953,790789,"No. No, no, no.
No, no, of course not."
177,791749,794209,"Then please, Mr. Hoover, stand up."
178,798130,801716,I'd appreciate it if you wouldn't share this...
179,801884,804886,"with any of the other women
in the typing pool."
180,805054,806554,"No, of course not."
181,806722,809224,All right. May I ask what-- what....
182,810142,813728,"What particular flaw
you seem to find in my character?"
183,814438,816397,No. We just met.
184,816565,817732,"Right, of course."
185,817900,820902,"But I believe that I am a fast
and accurate judge of character."
186,821070,823404,"We've gone out three times,
but I don't need more."
187,823572,827033,"Most people do, but I don't.
I see people right off for what they are."
188,827201,830578,"And please, call me Edgar.
It's what my mother uses."
189,830746,832664,"- Edgar?
- Yes?"
190,832832,835083,Can you keep a secret?
191,835876,838753,Yes. Of course. You have my word.
192,840422,844926,"I'm not interested in getting married.
My work comes first."
193,848889,854435,"Then perhaps you would consider a position
as my personal secretary."
194,860401,861442,Yes.
195,862444,863778,Shall we?
196,864697,866155,The book.
197,866323,867949,Right.
198,869618,870910,After you.
199,871287,875623,"I helped organize that library
just as I did this Bureau."
200,875791,878126,And many said we didn't need either.
201,878294,881588,"You see, innovators aren't often celebrated."
202,882131,883798,Not at first.
203,892808,896728,Miss Gandy.
204,898939,901649,"The nitwit Kennedy child
rang his baby buzzer again."
205,901817,903401,Perhaps he'd like a fresh diaper.
206,903569,905945,"Should I find out what
the Attorney General needs?"
207,906113,909824,"No, I want the completed transcripts
of the Los Angeles recordings."
208,909992,912827,"When I receive those,
then we'll answer his buzzer."
209,912995,914746,Very good.
210,915205,917665,"Edgar, Agent Smith is back."
211,917833,920919,"He, uh, has some questions
about the Palmer Raids."
212,921086,923338,Should I tell him to go?
213,924506,926674,"Helen, do you like him?"
214,926842,929177,I don't have an opinion of him yet.
215,931472,933932,"Well, I like him. I trust him."
216,934934,937852,"- I'll set him up in your outer office.
- No. No, no, no."
217,938020,940313,Bring him a desk in here.
218,942775,945652,"But in 1920,
how could I protect us from anyone?"
219,945819,948738,"Before I moved to this office,
we were powerless."
220,948906,951658,"We had few federal laws,
no right to carry firearms..."
221,951825,953993,and Congress liked it that way.
222,954161,958414,"Criminals ran free, but there was no law
against keeping track of them..."
223,958582,960750,so I made a decision on my own.
224,960918,963461,"I compiled note cards
and over five thousand names..."
225,963629,965880,and called the one department in Washington...
226,966048,968716,"that still held a small piece
of untested power."
227,968884,972553,"Was that the Department of Labor?
The power to deport, sir?"
228,972721,975264,"But only to deport those
who checked two boxes."
229,975432,980269,"They had to be foreign citizens
and they had to be working to harm our country."
230,980437,982188,And they cooperated with you?
231,982356,983982,Of course not.
232,984149,988319,"No one freely shares power in Washington, D.C.,
Agent Smith."
233,988487,991239,"There is no law under which
you can issue a warrant..."
234,991407,993241,for the arrest of an alien...
235,993409,996077,"when I have certified that
he is subject to deportation?"
236,996245,998997,"Without any evidence, Mr. Attorney General, no."
237,999164,1001749,"- There exists a due process of law.
- Due process of law?"
238,1003168,1005712,"- What about the threat?
- There might be a threat--"
239,1005879,1007005,Might be?
240,1007172,1009882,Fine. There is a threat to our country.
241,1010050,1013469,"But with no proof of a crime,
there's no cause for deportation."
242,1013637,1015596,We'll see about that.
243,1015764,1017598,You'll be hearing from me.
244,1019435,1021936,But one of their heads was a Mr. Caminetti.
245,1022104,1026858,"He was weary of our Justice Department,
but he hated one person even more."
246,1027026,1030194,I am a revolutionist by nature...
247,1030362,1031446,and as such...
248,1031613,1035783,"I claim the right to rebel
and resist invasion..."
249,1035951,1039454,"by all means, force included."
250,1039621,1042915,"Emma Goldman. She was the hero
of the radical movement."
251,1043083,1047587,"If I could hand Caminetti Emma Goldman,
he would deport her without a thought."
252,1047755,1050089,But she was a citizen.
253,1053635,1054969,"Would you like to stop, sir?"
254,1059058,1060558,No.
255,1060726,1064228,"I know it's hard for you to imagine today,
but there was a time..."
256,1064396,1069358,"when the average American feared
for their safety and survival, Agent Smith."
257,1069902,1074864,"In Chicago, a coal strike started by communist labor
shut off all the power."
258,1075032,1076324,Riots followed.
259,1076492,1079160,"And on Armistice Day in Centralia, Washington..."
260,1079328,1082830,"veterans fresh back from the war
were murdered by radicals."
261,1084208,1087752,The red revolution had arrived on our soil.
262,1094426,1096511,"No, no. We can't take them down
one by one."
263,1096678,1100556,"They'll go underground and we'll have a bomb
inside every senator's mailbox."
264,1100724,1103851,"We need to have a simultaneous raid,
hitting all of them at once."
265,1104019,1106145,"- Who are ""they""?
- You're here to find out."
266,1106313,1110066,"Now listen, I want a card
on every radical person in this country."
267,1110234,1111984,"Against the wall, gentlemen."
268,1112152,1115321,"I wanna know who, where they're from,
what group, what they say."
269,1115489,1117073,Who have already committed crimes?
270,1117241,1121786,"I care more whether they intend to.
Against the wall, gentlemen, thank you."
271,1121954,1124705,"- How many are on our team?
- Only you four for now."
272,1124873,1126666,I'll have locks installed.
273,1126834,1129544,"No, Miss Gandy.
That would bring too much attention."
274,1129711,1131712,Nothing is to be alphabetically ordered.
275,1131880,1134799,"I want the cards to be broken down
into subjects and categories."
276,1134967,1137385,"Now, this system should be easy enough
if explained."
277,1137553,1140513,"If not, finding information
should prove impossible."
278,1142307,1145393,"And trust no one,
not even our fellow agents."
279,1145561,1148062,"Half our colleagues
are on both sides of the payroll."
280,1148564,1151524,"But the crimes we're investigating
aren't crimes, they're ideas."
281,1151692,1152984,"Well, if your idea--"
282,1153152,1155319,"Against the wall, gentlemen. Thank you."
283,1155487,1159574,"If your idea is to come into our country
and plot the overthrow of our government..."
284,1159741,1161534,"then, yes, indeed, that is a crime."
285,1161702,1164162,Mrs. Goldman married a U.S. citizen.
286,1165080,1168583,"The man she married hasn't visited her once in prison,
yet this man..."
287,1168750,1171752,"the man she's lived with since her wedding,
he visits nightly."
288,1171920,1174964,"What happens when we raid this list of yours
and find nothing?"
289,1175132,1178467,"No guns, no bombs,
just innocent people deported."
290,1178635,1181762,"From every corner of this nation,
the American people..."
291,1181930,1185016,"have urged the Attorney General
to do something about this..."
292,1185184,1187351,"and return the United States
back to peace."
293,1187519,1190438,"Now, I'm happy to send your objections
to Mr. Palmer himself..."
294,1190606,1193691,"but, in the meantime,
expose Miss Goldman's sham marriage..."
295,1193859,1197111,and you will change that suit of yours.
296,1197279,1199363,"- Pardon me, John?
- Your suit, sir, your suit."
297,1199531,1200573,This isn't a saloon.
298,1200741,1203117,"Have respect for yourself,
but, more importantly..."
299,1203285,1204952,have respect for this department.
300,1205120,1206746,Miss Gandy?
301,1213712,1215463,"Miss Goldman, are you an anarchist?"
302,1215631,1217048,I decline to answer.
303,1217216,1219300,Do you deny that you are an anarchist?
304,1219468,1221469,I decline to answer.
305,1221637,1225223,"Do you believe in the overthrow
of the government of the United States?"
306,1225390,1226891,I refuse to answer.
307,1227059,1229560,"Do you advocate the assassination
of public officials?"
308,1229728,1232480,I refuse to answer.
309,1234775,1239820,"This alien has refused to answer questions
pertaining to the charges in the warrant..."
310,1239988,1243241,"notwithstanding the fact that
every opportunity was afforded her."
311,1243408,1245117,I recommend deportation.
312,1247621,1250998,"And just like that,
we had our precedent."
313,1253001,1257505,"Edgar, should I arrange our travel to Paterson
on Valentine's Day?"
314,1258173,1260675,"Yes, of course, Miss Gandy."
315,1265180,1269475,"I took the train to Paterson,
New Jersey, on February 14th."
316,1269643,1271894,If I could catch these radicals red-handed...
317,1272062,1275731,"then the Labor Department would have
to put them all on boats back home."
318,1275899,1278442,"So agents of the Bureau,
alongside local police..."
319,1278610,1282405,"began raiding gathering places
of known communist radicals..."
320,1282864,1285199,all across this country.
321,1286868,1288661,These people are armed and violent.
322,1288829,1291539,They're prepared to kill to avoid capture.
323,1292624,1294166,Take one. Go on.
324,1294710,1297128,"- Are we allowed to use these, sir?
- These are gifts."
325,1297296,1300047,"There is no law that prevents us
from using our own weapons."
326,1300215,1302883,"Gentlemen, grab your guns."
327,1305721,1307388,"Gentlemen, quickly."
328,1311393,1312727,Let's move.
329,1324906,1326532,Police! This is a raid!
330,1336460,1339253,"He's going for the window, stop him!"
331,1371328,1372703,That's enough!
332,1392849,1395851,The leaflets matched exactly.
333,1396186,1398771,We'd solved the bombings.
334,1399022,1403401,"And, in the end,
we arrested nearly 4000 communist radicals..."
335,1403568,1405820,and deported over 500 of them.
336,1407155,1411617,"It was accomplished against great odds
and at great personal peril."
337,1414287,1419375,"They found the counterfeiting press,
five pistols, two automatics."
338,1419543,1423921,"And in Trenton, they found gunpowder,
copper, brass wire, and batteries."
339,1424089,1426340,"- A bomb factory.
- Yes."
340,1426508,1432847,"One hundred and twenty arrests in Detroit,
41 in Philadelphia, and 17 here so far."
341,1433014,1436142,"But everyone in the Bureau involved
lost their job, correct?"
342,1436309,1437685,Even Palmer himself?
343,1437853,1439979,"Some did, and there's the lesson."
344,1440147,1442648,"You see, the bombs stopped,
and peace came."
345,1442816,1445860,"The American people had forgotten
there ever was a threat."
346,1446027,1448863,"So when political adversaries
attacked Palmer..."
347,1449030,1451699,"for trying to protect this nation
from communism..."
348,1451867,1453701,our countrymen allowed it to happen.
349,1454661,1459582,"Because like today, they've forgotten
the bombs, the blood, the fear."
350,1459749,1462460,"But why Palmer and not you,
if you orchestrated the raids?"
351,1463920,1468340,"I was 24 years old, Agent Smith.
I was just following orders."
352,1468508,1469925,"I understand, sir."
353,1470093,1474346,"And if we hadn't, you may very well
have been born into a communist state..."
354,1474514,1477224,rather than the country you love today.
355,1477392,1479310,"- Am I right?
- Of course, sir."
356,1480687,1481729,Edgar?
357,1483148,1484190,Ignore him.
358,1484858,1485900,Edgar?
359,1486610,1489904,"I am in a meeting, Mr. Tolson.
I'll be out in a moment."
360,1490071,1493407,"Don't forget about your appointment
with the Attorney General, Edgar."
361,1493575,1498037,"Files are not yet completed, Mr. Tolson.
Please go away."
362,1498914,1500664,Thank you.
363,1502918,1507087,"Thank you, sir. I apologize.
I'll finish this chapter tonight."
364,1509049,1510925,"Very well, Agent Smith."
365,1520101,1523604,"In the Academy, do they tell the story
of how I got here?"
366,1523772,1526982,"Yes, sir. Uh, you were called into
the new Attorney General's office...."
367,1527150,1530277,"- Harlan Fiske Stone.
- Yes, sir, Attorney General Stone."
368,1530445,1533239,"He called you into his office
and told you to sit down, sir."
369,1533406,1535824,"Sir, there are over a dozen vacancies in Chicago."
370,1535992,1539036,"And with the robbery rates rising,
it would profit the Bureau..."
371,1539204,1541455,"to start filling vacancies
and make recoveries."
372,1541623,1546001,"I have files on potential suspects,
and with a congressional hearing--"
373,1546169,1550631,"Lower the treble, son.
You didn't call this meeting, I did. Sit down."
374,1551633,1552758,"Yes, sir."
375,1553635,1557846,"Everyone you've worked with here is gone.
And there's a reason for that."
376,1558014,1563143,"This Bureau is of exceedingly bad odor.
Would you agree?"
377,1564020,1565312,"Yes, sir."
378,1566106,1568399,"And, no offense,
you seem to have no social life."
379,1568567,1573821,"No wife, no girlfriend.
As far as I can tell, no pals at all."
380,1576533,1578075,"That is accurate, sir."
381,1578243,1582413,"And you're shamelessly distracted
by this hodgepodge fingerprinting affair."
382,1582581,1587501,"Sir, it wouldn't be hodgepodge
if we could centralize the prints here, I assure you."
383,1587669,1589837,It's a speculative science at best.
384,1591423,1592673,"Yes, sir."
385,1593258,1595009,And why do they call you Speed?
386,1596386,1597428,Who calls me that?
387,1597596,1600472,"They all do, behind your back, evidently."
388,1603184,1607187,"I gained a reputation for delivering groceries
when I was 10 years old."
389,1607355,1611108,"I was the fastest in the neighborhood.
It was just a nickname."
390,1611276,1613110,You sure it's not for the way you talk?
391,1615155,1616864,"Perhaps, sir."
392,1617824,1624204,"Young man, I want you to be acting
director of the Bureau of Investigation."
393,1627083,1631670,"I will take the job, Mr. Stone,
but only on certain conditions."
394,1633590,1635007,What are they?
395,1636259,1641013,"The Bureau must be divorced from politics
and not be a catchall for political hacks."
396,1641890,1645059,Recruits must be college-educated.
397,1645352,1648062,Appointments must be based on merit.
398,1648229,1652066,Promotions will be made on proven ability.
399,1652484,1656403,"And, well, the Bureau will be
responsible only to you, sir..."
400,1656571,1658072,the Attorney General.
401,1661034,1664912,"I wouldn't give you the job
under any other conditions."
402,1666706,1668874,That's all. Good day.
403,1671544,1672711,"Well, thank you, sir."
404,1672879,1676924,"I am determined to summarily dismiss
from this Bureau..."
405,1677092,1680844,"any employee whom I find indulging
in the use of intoxicants."
406,1681012,1684765,"It is my belief that when a man
becomes a part of this Bureau..."
407,1684933,1690104,"he must so conduct himself,
both officially and unofficially..."
408,1690271,1693774,"as to eliminate even
the slightest possibility of criticism..."
409,1693942,1695943,as to his conduct.
410,1698154,1700948,"- And what is your name, sir?
- Agent Williams, sir."
411,1701116,1703575,"- Pleasure to meet you, Agent Williams.
- You too, sir."
