Number,StartMilliseconds,EndMilliseconds,Text
805,3222052,3224887,"Is that all, Mr. Hoover?
I have a 2:30 p.m. class to teach."
806,3225055,3227139,"No, you don't.
Consider your pay doubled."
807,3227307,3232144,"You work for your country now, Mr. Osborne.
Congratulations."
808,3234731,3236148,Doctor!
809,3246576,3248160,Have you gotted the money?
810,3248995,3251580,"I can't bring the money
till I see the baby."
811,3257420,3259964,I promise you there's no police.
812,3260757,3262424,It's too dangerous.
813,3268598,3272184,Stop! Stop this now!
814,3274271,3275980,No one's gonna harm you.
815,3276147,3277898,"If they catch me, they will."
816,3278066,3280442,"No, they only want the child."
817,3280610,3283988,"They'll give me 30 years if I'm caught.
They could burn me."
818,3284155,3285614,No. No.
819,3285782,3286865,I didn't do it.
820,3287033,3288659,I'm only the messenger.
821,3291162,3292997,What if the baby is dead?
822,3294249,3295874,Would I burn if the baby is dead?
823,3297544,3300045,"Why would we be meeting
if the baby was dead?"
824,3300213,3303507,"Place another ad in the paper
when you have the money."
825,3309889,3314226,"So if a ransom had to be paid,
we needed those bills traced."
826,3314394,3318564,"We brought in the IRS, and, for his own good,
we had to force his hand."
827,3318732,3321567,"I thought gold notes were going
out of circulation, Mr. Irey."
828,3321735,3323068,That's our hope.
829,3323236,3325112,It'll make these bills more identifiable.
830,3325280,3327865,"I have no need for the money.
I just want my son."
831,3329409,3332369,"This isn't just about your son,
Mr. Lindbergh."
832,3332537,3336415,"If these kidnappers go free,
then no child in this country will be safe."
833,3336583,3341378,"That's why I've assembled a 26-man team,
headed by Special Agent Sisk here."
834,3341546,3345758,"And if they find out you're involved,
I may never see my son again."
835,3346551,3349470,"Mr. Lindbergh, sir,
we will not pursue a single lead..."
836,3349637,3351930,"until your child is safe
in his mother's arms."
837,3352098,3354850,"You have my word, sir."
838,3362942,3365944,"The kidnapping of Charles A. Lindbergh, Jr.,
was a tragedy..."
839,3366112,3368697,"not only to Colonel and Mrs. Lindbergh,
but to the nation."
840,3368865,3371950,"His abduction from his Hopewell home
was a challenge to America."
841,3372118,3374870,"This ladder, the only clue
to the kidnapping, was homemade."
842,3375038,3377956,"Let the developments in the Lindbergh case
start a new drive..."
843,3378124,3381001,"to wipe out the stain,
not only of that wanton kidnapping..."
844,3381169,3384088,but of all kidnapping and crimes.
845,3386800,3388217,"Hey, doctor!"
846,3389219,3392262,Give your word not to open for six hours.
847,3394474,3395599,Thank you.
848,3403775,3405943,"I talked him out of 20,000 dollars."
849,3406111,3409488,"I'd prefer him happy than save the money.
I don't want to upset him."
850,3410573,3411824,Where is the baby?
851,3411991,3414576,I promised not to open this for six hours.
852,3414744,3417329,"You gave your word, I did not."
853,3418832,3423293,"""The boy is on boat Nelly.
It is a small boat, 28 feet long."
854,3423461,3426505,"Two persons are on the boat.
They are innocent."
855,3426673,3431677,"You'll find the boat between Horseneck's Beach
and Gay Head near Elizabeth Island."""
856,3431845,3433846,"That's Nantucket, right?"
857,3437851,3439059,What was in the boat?
858,3439227,3440602,There was no boat.
859,3440770,3443439,"Lindbergh didn't trust us.
He wanted to do things his way."
860,3443606,3447192,"And who can blame him?
No one respected us at that time."
861,3447360,3449069,"Mr. Hoover, we've been calling."
862,3449237,3450863,Edgar.
863,3453450,3455659,"Time to go, Agent Garrison.
Right now."
864,3456536,3459705,The Attorney General has authorized your wiretaps.
865,3459873,3461707,"Very good, Miss Gandy."
866,3462542,3466712,"Edgar, are you sure about this?
Once you do this, Edgar, it's done."
867,3466880,3470674,"When I prove myself correct,
we will have saved this country another revolution."
868,3470842,3472509,"History will remember that, Clyde."
869,3472677,3473886,But if you are wrong...
870,3474053,3477389,"history will remember it
as an illegal move over a petty grudge."
871,3477557,3480517,"Do you consider our reputation petty,
Mr. Tolson?"
872,3480685,3483312,"- No, I--
- Then order the wires."
873,3484814,3488150,"- Can we discuss this over dinner?
- After you've ordered the wires."
874,3490445,3491987,"Yes, sir."
875,3504584,3506335,The director's on his way.
876,3530517,3531785,After you.
877,3553800,3555092,"Wait, please."
878,3561808,3564768,"- Harvey's Restaurant, sir?
- No, to the White House."
879,3575446,3577531,"We were in the midst
of a Great Depression..."
880,3577699,3580492,"and breaths away
from history's worst war."
881,3580660,3584496,"We needed more power to protect,
but, as with every new president..."
882,3584664,3589167,"this Bureau's future and my very job
was being drawn into question."
883,3589335,3592337,"- The president is ready to see you now.
- Alrighty."
884,3601180,3603473,"Come in. Have a seat, Mr. Hoover."
885,3606519,3609646,"It's the same dance each time.
They make me wait."
886,3609814,3614860,"They imagine I'm sweating,
that they're gonna show me who's boss, I play along."
887,3615028,3616653,Thank you.
888,3616821,3618697,And then did you show him the transcript?
889,3618865,3621825,"No. He didn't want to read it.
That was unique."
890,3621993,3624202,He wanted me to tell him about it.
891,3624370,3626079,"What, how you came across it?"
892,3626247,3630375,"No, I explained to him up front
we never expected to find Mrs. Roosevelt..."
893,3630543,3632961,in the bedroom of a known communist agitator...
894,3633129,3636548,"much less having what sounded like
an intimate moment."
895,3636716,3639718,"That I needed his advice
on how to proceed."
896,3639886,3642346,I wanted to let him know he had an ally.
897,3642513,3644514,"Before he had a chance
to ask you to resign."
898,3644682,3645932,Exactly.
899,3646100,3648894,"When I was finished,
he simply pushed the file aside..."
900,3649062,3653315,as if he was unconcerned with it.
901,3653483,3657361,"Clyde, the President of the United States is afraid."
902,3658488,3660072,"What, he's afraid of you?"
903,3660239,3664117,Of a potential invasion from abroad.
904,3664994,3667579,"We'll have two glasses
of your finest champagne."
905,3667747,3669206,"Of course, Mr. Hoover."
906,3671083,3672584,You're drinking now?
907,3672752,3674753,"We're celebrating, Clyde,
we're celebrating."
908,3675546,3678131,"You know I feel I could trust you
with anything, right?"
909,3678299,3679925,"Well, I'd like to think so."
910,3682303,3684971,The president signed a secret order...
911,3685139,3687432,granting me increased power of surveillance...
912,3687600,3692354,"secret surveillance of communists and radicals,
without warrant."
913,3693064,3694106,Is that legal?
914,3694273,3696692,"Sometimes you need
to bend the rules a little..."
915,3696859,3699277,"in order to keep your country safe, right?"
916,3699445,3703907,"And to make sure I hadn't heard it wrong,
I clarified this with Secretary of State Hull."
917,3704075,3708412,"And he said, and I quote,
""You go ahead and investigate those cocksuckers."""
918,3709664,3712708,"- Vulgar.
- Agreed."
919,3715128,3716712,Clyde...
920,3717463,3719464,I've been meaning to ask you something.
921,3720174,3721466,Feel free.
922,3722301,3725804,"I need someone who understands
what's at stake here..."
923,3725972,3727264,you understand?
924,3727432,3729975,Someone who I can trust...
925,3731144,3732978,an associate director of the Bureau.
926,3733146,3736606,"I know you've only been in your current position for,
what, 12 months now."
927,3736774,3738650,"Oh, almost 18 now, sir."
928,3738818,3741236,"You're missing my point, Clyde."
929,3741404,3743488,I want you to be my number-two man.
930,3746200,3749077,"I'm not much for the spotlight, Edgar."
931,3752498,3754374,"I need you, Clyde."
932,3754792,3756501,Do you understand? I need you.
933,3759672,3761631,On one condition.
934,3762258,3765260,"Good day or bad,
whether we agree or disagree..."
935,3765428,3769347,"we never miss a lunch
or a dinner together."
936,3770183,3772684,"Well, I would have it no other way."
937,3782195,3784488,"Hey, pull over."
938,3784655,3787949,"- Only a half a mile to Mount Rose.
- Can't wait."
939,3818064,3819064,Orville!
940,3832954,3837415,"In the end, the child's body
was found just within sight..."
941,3837583,3839668,of Mr. Lindbergh's home.
942,3841087,3842921,The body was blackened...
943,3843089,3846049,the left leg missing from the knee down.
944,3846676,3849594,There was a visible fracture on the skull.
945,3850096,3853265,"He'd suffered a violent blow to the head.
I told them months ago."
946,3853432,3857727,"He must've fallen on the way down,
with the baby in his arms."
947,3858771,3861231,"We are the sinners, Edgar."
948,3864193,3869114,"We tolerated lawlessness in the land
until it grew to diabolical proportions."
949,3870783,3873952,"The baby's blood is on all our hands, Edgar."
950,3875454,3877497,"On your hands, Edgar."
951,3883796,3885213,"Yes, Mother."
952,3898519,3900353,Six weeks after the kidnapping...
953,3900521,3902355,Congress passed the Lindbergh Law...
954,3902523,3905275,making kidnapping a federal offense.
955,3905443,3909321,"The right to make arrests followed
and the right to bear arms."
956,3909488,3913950,"So I continued collecting
the finest scientific minds in the country."
957,3916787,3920123,"He claims to be the world expert
on wood analysis."
958,3920541,3924419,"It's easy to be the expert if you're
the only person in the world with any interest."
959,3924587,3926922,"He does claim he can tell
as much from a cut of wood..."
960,3927089,3928557,as a doctor can from an autopsy.
961,3929425,3931843,"He has, um, social difficulties."
962,3932011,3934179,"He is mentally ill, isn't he?"
963,3934347,3937682,He's only as mad as you are. Sir.
964,3938517,3941269,"This was supposed to be temporary,
Mr. Hoover."
965,3941437,3943605,If you want your Sherlock Holmes playing time--
966,3943773,3946358,"Where do you suggest we go, sir, where?"
967,3946525,3948443,I suggest you take your case to Congress.
968,3948611,3949903,"Fine, sir. Have it your way."
969,3950071,3954991,"I'll tell people we could not solve the case
because we could not afford laboratories..."
970,3955159,3958078,"and the Attorney General
wouldn't allow us to use his lounge."
971,3958245,3961706,"Fine. Now get your science fair project
out of here."
972,3961874,3963625,"Yes, sir. Right away, sir."
973,3966212,3967295,"Gentlemen, keep working."
974,3967463,3970507,"Mr. Tolson, let's get the president on the phone."
975,3972885,3977722,"The depravations of vicious outlaws,
roving from state to state like packs of wolves..."
976,3977932,3980600,amounts to an actual armed invasion of America.
977,3980768,3984521,"We must outsmart and outwit the criminal,
foreign and domestic."
978,3984689,3988650,"They have chemists building bombs.
We need chemists tracing their efforts."
979,3988818,3991569,"We must have the most advanced
force in the world..."
980,3991737,3994155,"if we are to have
the safest nation on earth."
981,3994323,3997909,"And, please, gentlemen, let us not
for a moment lose sight of our goals:"
982,3998077,3999536,To protect the honest citizen...
983,3999704,4003581,"to teach the criminal that
regardless of his subterfuges..."
984,4003749,4006334,"his twisting, his squirming
and slimy wriggling..."
985,4006502,4009796,"he cannot escape the one
inexorable rule of law enforcement..."
986,4009964,4011923,that you can't get away with it.
987,4012091,4013758,Thank you.
988,4013926,4014926,"Thank you, Mr. Hoover."
989,4015094,4021016,"But your agency is already one of the most
well-funded in Washington, is it not?"
990,4021183,4022684,"Yes, that is true, sir..."
991,4022852,4026771,"but our car and bank robbery recoveries
totaled 6.5 million last year..."
992,4026939,4029399,"and our budget is only, well, two million."
993,4029567,4033111,"Unlike other departments in Washington,
we actually run a profit."
994,4035281,4037782,We cannot quantify the value of our successes...
995,4037950,4042037,"with the hoodlums Pretty Boy Floyd,
Baby Face Nelson, Machine Gun Kelly..."
996,4042204,4044330,and other hoodlums of that nature.
997,4044498,4050128,"Mr. Hoover, is it true that you spend
the Bureau's money on advertising?"
998,4051922,4056301,"We are not permitted to engage
in advertising of any kind, sir. No."
999,4056469,4060972,"But you take part, for instance,
in the making of radio shows and comic books."
1000,4061140,4063641,"I've listened to several
of these G-Men programs."
1001,4063809,4068063,"Your picture seems to be shown
in conjunction with them quite frequently."
1002,4069315,4073193,"We declined emphatically to lend
any form of endorsement..."
1003,4073360,4078073,"had nothing to do with their production,
furnished no advice, technical or otherwise."
1004,4078240,4081451,"Well, the very advertisement says
that broadcasts were..."
1005,4081619,4085830,"""true reflections,
as contained in the official records..."
1006,4085998,4089751,"based on actual cases from the files
of the Federal Bureau of Investigation..."
1007,4089919,4091961,"Saturday night at 8:00."""
1008,4093130,4095673,"Mr. Hoover, what are your exact qualifications..."
1009,4095841,4098343,"for your position of leadership
in this Bureau?"
1010,4098511,4099761,"My qualifications, sir?"
1011,4099929,4103807,"Nineteen years with the Department of Justice.
Nineteen."
1012,4103974,4105517,Twelve as director.
1013,4105684,4109312,"In all that time,
you ever make an arrest yourself?"
1014,4111023,4115443,"I have made investigations.
I administer several cases at once."
1015,4116612,4118029,"Well, that's not what I asked."
1016,4118197,4122867,"The comic books show you with a machine gun,
making arrests. Is that just fiction?"
1017,4129834,4132377,"I am responsible for thousands of arrests, sir."
1018,4133587,4136881,So you admit it is pure fiction.
1019,4137466,4142220,"In fact, it wasn't you who hunted down
and captured John Dillinger at all."
1020,4142513,4145140,"It was Agent Purvis.
Is that correct?"
1021,4146392,4150520,I was in charge of all of those investigations...
1022,4150855,4154899,"but, no, sir,
I have not personally made an arrest."
1023,4161240,4163241,"Any other questions, gentlemen?"
1024,4164243,4166369,Let's bring it to a vote.
1025,4169874,4171332,Put those away.
1026,4176422,4177839,"Well, that didn't go well."
1027,4178007,4180758,"We spend our lives working
and we get a political attack?"
1028,4180926,4184429,"What does he expect, crimes to go unsolved?
Why is he fighting me?"
1029,4184597,4186681,"I want you to start a file
on Senator McKellar."
1030,4186849,4188641,I want four agents on him at all times.
1031,4188809,4191769,"I want to know what's in his trash,
photograph him at dinner."
1032,4191937,4195607,"Don't get in the car.
You can walk back."
1033,4195774,4198276,"We have lunch.
We don't miss lunch, no matter what."
1034,4198444,4200278,You pulled away from me in there.
1035,4200446,4203781,"You perjured yourself, Edgar,
and the lie was an easily provable one."
1036,4203949,4205950,"There's no telling
how much worse it could've been."
1037,4206118,4209996,"Find Agent Purvis.
He is to be demoted immediately or, better yet, fired."
1038,4210164,4212832,"Firing the man who killed John Dillinger
would be a PR disaster."
1039,4213000,4215251,"Then he is to spend
the rest of his career behind a desk."
1040,4215419,4219339,"And if he'd like to keep that job,
he'd best stay out of the papers. Go."
1041,4229225,4232060,I don't know who I can trust anymore.
1042,4233896,4234979,Only you.
1043,4237483,4238942,"Only you, Mother."
1044,4239652,4243154,"You're all I have to keep me safe,
you understand that?"
1045,4244198,4246407,"Please, Mother,
let me take you to a doctor."
1046,4246575,4249619,"A simple examination isn't unholy, is it?"
1047,4251497,4252538,Mother.
1048,4254833,4255959,"Mother, please."
1049,4258837,4261172,"Faith, Edgar."
1050,4261840,4263258,Faith.
1051,4264843,4267637,Don't wilt like a little flower.
1052,4268347,4269722,Be strong.
1053,4270766,4272267,"Yes, Mother."
1054,4274645,4279607,I will.
1055,4284113,4288157,"If what Congress valued more
than wits and brains was muscle..."
1056,4288325,4291411,"if what they hungered for
was an armed American hero..."
1057,4291578,4295373,"then I was willing to risk my very life
and give them both."
1058,4295541,4296708,Move.
1059,4296875,4298167,Go.
1060,4298335,4299627,"Hold it, government agents!"
1061,4314518,4316686,The arrest is mine to make!
1062,4317396,4318396,Move.
1063,4318564,4321024,"Mr. Karpis, you are under arrest."
1064,4322234,4326029,"Mr. Hoover himself.
I'm gonna be famous."
1065,4326905,4328698,Put the handcuffs on him.
1066,4333662,4335705,"Don't move, Mr. Mahan."
1067,4336749,4338166,Blow it down.
1068,4341879,4342920,Move.
1069,4354725,4357101,"Mr. Brunette, you are under arrest."
1070,4357269,4361564,"Alvin Karpis said he couldn't be taken alive,
but we took him without firing a shot."
1071,4361732,4365568,"And let me tell you, he shook all over.
His voice, his hands, and his knees."
1072,4365736,4368780,"You arrested Harry Campbell in Toledo
and Brunette in Manhattan?"
1073,4368947,4370448,And William Mahan in California.
1074,4370657,4373159,"But let me clarify
without a shadow of a doubt..."
1075,4373327,4375912,"this was a ""we"" job, not an ""I"" job."
1076,4382711,4385463,"Edgar, look at this.
We made the Post Toasties box."
1077,4386465,4389801,"""Melvin Purvis,
the FBI agent that caught Dillinger."""
1078,4390511,4392303,"Write the cereal-maker.
Let them know--"
1079,4393222,4394640,"Oh. ""Junior G-Man."""
1080,4395808,4400978,"Tell them they ought to print any further boxes
to read ""former agent of the FBI."""
1081,4401647,4403564,"Sit down, Clyde.
I'm gonna read something."
1082,4407986,4409779,"""Only eight more days."
1083,4409947,4412990,"Funny how even the dearest face
will fade away in time."
1084,4413158,4414867,"Most clearly, I remember your eyes..."
1085,4415035,4419247,"with a sort of teasing smile in them,
and the feeling of that soft spot..."
1086,4419415,4423000,"just northeast of the corner of your mouth
against my lips."""
1087,4423168,4424585,What is it?
1088,4424753,4426379,It's a letter from Lorena Hickok...
1089,4426547,4430633,"the White House reporter
with the bad breath, to Mrs. Roosevelt."
1090,4431301,4434178,No. What are you gonna do with it?
1091,4434346,4436931,"Nothing. I accused her
of having an affair with a man..."
1092,4437099,4440017,"and Old Horse Face is having
an affair with Mrs. Bat Breath!"
1093,4441353,4442771,A woman! Can you believe it?
1094,4448193,4451362,"Oh, excuse me, Mr. Hoover.
They'd like to see you in the laboratory."
1095,4451530,4454782,"Yes, Miss Gandy. You tell them
I'll be there in one minute. Thank you."
1096,4455033,4456200,We'll get to this later.
1097,4456827,4461497,"Speaking of horses, Clyde,
I'm going to Del Mar this weekend."
1098,4462332,4464333,I was thinking of taking a quick vacation...
1099,4464501,4467670,"and, well, I thought
you'd like to join me."
1100,4467838,4470047,"Well, I've never been
to the horse races, Edgar."
1101,4470215,4471299,"Well, it's wonderful."
1102,4471467,4476721,"And between me and you, when I lose,
the track, they actually cover the losses."
1103,4476889,4480558,"- So, what happens if you win?
- They still pay."
1104,4480726,4481809,Then where's the thrill?
1105,4481977,4485855,"In the sun that falls on the stands,
the hotel rooms, the service..."
1106,4486023,4489400,"the restaurants, but, most of all, Clyde,
it's the company."
1107,4491069,4493154,"- Come with me.
- I'd love to."
1108,4493322,4496491,"Fantastic. I'll have Miss Gandy
make all the arrangements."
1109,4496658,4499911,"Well, I can't go now.
But maybe in a couple months after I've saved up."
1110,4500078,4503414,"- It's completely covered, Clyde.
- Edgar, I can't let you do that."
1111,4503582,4507835,"Listen, you've done so much for me, for this Bureau.
Consider it a thank you."
1112,4508003,4510171,I don't know that I'd feel comfortable.
1113,4511340,4514217,"Tell you what, Clyde:
I'll get a suite with adjoining rooms..."
1114,4514384,4517887,"rather than having us stay separate.
That'll be savings enough."
1115,4518347,4519388,Deal.
1116,4520182,4521933,"What do you have for me, Mr. Koehler?"
1117,4522100,4525436,"Well, as you can see,
there are several kinds of wood here."
1118,4525604,4529941,"Pine, birch, fir, and, if you look closely,
you will see--"
1119,4530108,4531275,"- Thank you.
- Mr. Tolson."
1120,4531443,4535112,"That each has its own internal markings,
rings and knots..."
1121,4535280,4539116,"and its own external markings
from the machinery used to mill the raw timber..."
1122,4539284,4542703,"and these that mark the tools
used to build the ladder."
1123,4542871,4546958,"The question is, how does this help us
identify the kidnappers, Mr. Koehler?"
1124,4547125,4548751,"I need more money, sir."
1125,4548919,4551420,"- More money, sir, for what?
- Postage."
1126,4551588,4554090,"I need to write every mill
on the East Coast..."
1127,4554258,4557635,"and see if their blades
match these marks."
1128,4559638,4562807,"I want a report from each mill
and a map tracking all leads."
1129,4562975,4566310,"By the time I get back from New York,
I want something to report."
1130,4566478,4567645,Good day.
1131,4576655,4578823,"Just like the communist radicals
before them..."
1132,4578991,4580491,the gangster fell from favor.
1133,4580659,4584829,"Now, finally, children dreamed
of joining the FBI."
1134,4593088,4595590,On your feet. On your feet.
1135,4599928,4600970,Yeah?
1136,4601763,4603931,"He's taking his shower.
Any message?"
1137,4604099,4606517,"There ain't any shower there, copper."
1138,4619698,4620865,Miss Temple!
1139,4621033,4624744,"Mr. Hoover, I was wondering
if you would join my police force."
1140,4624911,4626287,"Why, yes, Miss Temple."
1141,4626455,4630666,"If you agree to be an honorary G-Woman,
and give me one little kiss."
1142,4631501,4634045,"I don't know if your wife would approve,
Mr. Hoover."
1143,4635631,4637798,"But, you see,
I still live with my mother."
1144,4638884,4641469,Oh. Okay.
1145,4641637,4643888,"- Look this way!
- That's real spiffy."
1146,4644056,4646015,Nice smile. Thank you very much.
1147,4649311,4651228,"Excuse me, sir.
Can we get a statement?"
1148,4651396,4652980,How'd you like the picture?
1149,4655025,4656233,"This way, Mr. Hoover!"
1150,4656401,4657777,"After you, Mother."
1151,4670415,4672249,Should we go to the club?
1152,4672918,4675670,After we drop Mother off at the hotel.
1153,4695649,4698150,I have you at a table with Anita Colby.
1154,4699069,4702363,"Lela Rogers and her daughter Ginger
have asked if they can join."
1155,4702531,4704073,As long as it's near the front.
1156,4704241,4707284,"Miss Rogers, pleasure to meet you.
This must be your mother."
1157,4707452,4708452,Hello.
1158,4708620,4711580,"J. Edgar Hoover. This is Clyde Tolson.
Anita, good to see you."
1159,4720215,4722133,The bullet entered the back of the head...
1160,4722300,4724760,"and exited through the front
near his cheek."
1161,4724928,4728305,"The thing that most people don't realize
is that there is little blood."
1162,4728473,4732143,"The heat from the bullet
actually seals the wound as it enters..."
1163,4732310,4737106,"so the crime scene is far more peaceful
than is depicted in your moving pictures."
1164,4737274,4740651,"And little Lindy.
Did you see the child with your own eyes?"
1165,4741486,4743529,Those are details I wouldn't disclose...
1166,4743697,4746365,"with a refined group of women
such as yourselves."
1167,4746533,4752413,"I couldn't bear to make you shed a tear.
But I assure you this, we are on the case."
1168,4752581,4755666,"I saw the Lindberghs in Paris.
I hardly recognized them."
1169,4757002,4760171,"Only justice can bring reason
back to their lives."
1170,4760672,4765134,"But I might share one confidential clue with you,
if you swear to secrecy."
1171,4766720,4767845,Of course.
1172,4768013,4770473,"The gold notes from the ransom money
have surfaced."
1173,4770640,4772349,And can you guess where?
1174,4772517,4774018,"Tell us. Please, Mr. Hoover."
1175,4774186,4776395,"In the Bronx, on three occasions."
1176,4776563,4778439,And each one of the shop owners claim...
1177,4778607,4782860,"they received them from a man
with a pointed chin and a German accent."
1178,4785363,4788199,"Take my word for it, Mr. Hoover."
1179,4788366,4791202,"All the admiration in the world
can't fill the spot love goes."
1180,4792579,4794205,Or keep your bed warm.
1181,4796708,4798584,"I serve my country, Miss Colby."
1182,4798752,4801096,"The nation's admiration
is more than enough for me."
1183,4802464,4805216,But it likely makes for a cold bed.
1184,4806718,4810179,"Mr. Hoover, would it be out of the question
to bother you for a dance?"
1185,4810347,4812223,"Oh, uh, how do you mean?"
1186,4813475,4815309,"Well, simply a dance."
1187,4815602,4817311,"You do dance, don't you?"
1188,4817479,4820981,"Well, that is a skill that, um,
I haven't yet mastered."
1189,4821191,4824318,"And the night is getting long,
isn't it, Mr. Tolson? Mr. Tolson?"
1190,4824486,4827196,"No time like the present.
It's my favorite song, come on."
1191,4827364,4829865,"It's time we leave.
Uh, we have a great deal of work."
1192,4830033,4832243,"We-- We--
We have a great deal of work tomorrow..."
1193,4832410,4836163,"and I'm afraid we don't have time to dance.
We're very busy, aren't we?"
1194,4836331,4837623,Yes.
1195,4837791,4840084,And my sincere apologies. I--
1196,4840252,4842211,"Right now, Mr. Tolson.
Thank you very much."
