Number,StartMilliseconds,EndMilliseconds,Text
412,1705954,1707079,And your name?
413,1707247,1708789,"Agent Caffrey, sir."
414,1708957,1711291,"- Your assignment?
- I'm headed to Kansas City..."
415,1711459,1714253,"to aid in the search
for bank robber Frank Nash, sir."
416,1714721,1716505,"That is dangerous work,
and when you return..."
417,1716673,1719049,you will be rewarded for your service.
418,1723972,1727933,"You still fancy facial hair, Agent Stokes?"
419,1728184,1729786,The ladies appreciate it.
420,1730854,1734189,"And I suppose the ladies' opinions
are more important than the Bureau's?"
421,1734357,1735399,No.
422,1735567,1737067,Sir.
423,1737819,1740279,"Perhaps you are better suited
for the police force..."
424,1740447,1742740,than the Bureau of Investigations.
425,1743700,1746493,"I've been with the Department and the Bureau
for seven years."
426,1746661,1747745,Almost as long as you.
427,1748621,1749663,No.
428,1750206,1754501,"You were with the old Bureau seven years,
and that Bureau is now gone, sir."
429,1755462,1756837,And so are you.
430,1757005,1761133,"I quickly dismissed all agents
that did not fit my standards:"
431,1761301,1763927,"Education, physical fitness..."
432,1764095,1766013,"but, above all, loyalty."
433,1770643,1774188,"I've had two made.
Same cut, different pattern."
434,1776191,1779026,"And two suits for you.
They'll be delivered on Friday."
435,1779194,1780527,"Thank you, Mother."
436,1785116,1786533,It's platinum...
437,1787660,1791121,six diamonds and a star sapphire.
438,1794575,1796043,"It's absolutely beautiful, Mother."
439,1796211,1797461,Thank you.
440,1800215,1803467,"I've told the whole neighborhood
about you. They all know."
441,1804886,1807554,"No, I shouldn't,
I've been gaining weight, Mother."
442,1807722,1811809,"It's solid weight. There's nothing wrong
with solid weight on a man."
443,1813394,1815813,"- All right.
- I'm so incredibly proud of you, Edgar."
444,1822278,1824404,I'm starting an album for you.
445,1825406,1828575,"I'm gonna put everything in it.
This is just the beginning."
446,1828743,1835123,"""Johnny Hoover appointed acting director
of the Bureau of Investigations."""
447,1835291,1836750,Can you read that?
448,1841422,1843006,You proud of your uncle?
449,1859274,1860315,Gentlemen.
450,1864237,1866280,"I want to introduce you.
Come with me."
451,1869075,1870742,"Edgar, good to see you."
452,1870910,1872286,"Good to see you, Lawrence."
453,1872453,1874955,"I'd like to introduce you
to Mr. Clyde Tolson."
454,1875123,1877916,"Graduated from George Washington University tonight
with a law degree."
455,1879294,1880627,"Congratulations, Mr. Tolson."
456,1880795,1884798,"Thank you, Mr. Hoover. I believe you are
one of our most distinguished alumni."
457,1884966,1888635,"I did, yes. I, uh, do have a degree
from the school, yes."
458,1891097,1894558,"I was admiring your suit, Mr. Tolson.
You should take a lesson, Lawrence."
459,1894726,1897477,"Thank you, sir. It's a custom cut,
from Garfinkel's department store."
460,1901608,1903650,"Do you have a card, Mr. Tolson?"
461,1903818,1906236,"I do, yes, of course."
462,1907447,1908488,Here you go.
463,1908823,1910532,"Good to see you, Lawrence."
464,1911618,1912659,"Thank you, sir."
465,1917206,1920709,"""Well-educated, highly recommended,
willing to guarantee five years service."
466,1920877,1923545,"Has a family in New York and a new baby."""
467,1923713,1924755,No interview.
468,1925381,1927507,The family in New York or the baby?
469,1927675,1931470,"Miss Gandy, five years is not enough.
We need men willing to dedicate their lives."
470,1931638,1933138,How many is that so far?
471,1933306,1937560,That's 320 denied and 21 interviews.
472,1938728,1942856,"Did we receive an application
from a Mr. Tolson?"
473,1943024,1945192,Yes.
474,1947528,1951156,"Yes, his report states
he has confidence, poise..."
475,1951324,1953742,his diction is excellent.
476,1953910,1958413,"But although physically fitted for it,
might be displeased with rugged work."
477,1958581,1962876,"His only interest is to gain experience
that would benefit a private law practice."
478,1963044,1966630,"And he has no interest in being here
for any period of time..."
479,1966798,1969675,which would render employment speculative.
480,1972053,1974763,He did receive a letter of recommendation...
481,1974931,1978392,"from the executive assistant
of the Secretary of War."
482,1979060,1981019,"That's fantastic, Miss Gandy."
483,1981187,1988193,"Yes. It mentions here that Mr. Tolson
showed no particular interest in women."
484,1990738,1996076,"Then again, some of our best agents excel
because they have no family encumbrance."
485,1997245,2000414,"Yes, you're right.
Set up an interview."
486,2003543,2005544,"You know what the problem is, Miss Gandy?"
487,2005753,2008714,"These men, they don't--
They don't look up to me."
488,2008881,2010048,Of course they do.
489,2010216,2015137,"I don't mean figuratively.
I mean they don't look up to me."
490,2015304,2019266,"Well, if you could conduct the entire interview
from behind your desk..."
491,2019434,2024646,"instead of walking about the office,
I could correct that."
492,2024814,2026481,Indeed.
493,2028735,2032779,"Miss Gandy, suppose I had information
on someone in a position of power..."
494,2034115,2036324,harmful information.
495,2037118,2039703,"It goes against my nature
to destroy such information..."
496,2039871,2042873,"but I don't trust it
in the general files either."
497,2044959,2046626,Could I trust it with you?
498,2046794,2050881,If we were to create a confidential file?
499,2051799,2053508,"Of course, Edgar."
500,2055678,2056762,"Thank you, Miss Gandy."
501,2060892,2063101,Information is power.
502,2063269,2066229,It protected us from the communists in 1919...
503,2066397,2072034,"and since has been vigilantly collected,
organized, and maintained by our FBI."
504,2072737,2075489,Attorney General Kennedy's Office.
505,2079744,2084122,"Did you always have this fireplace
or did you have it put in?"
506,2084540,2085582,It was put in.
507,2085750,2088335,"What were you doing with wiretaps
in that house?"
508,2089545,2093507,"You asked that I pursue this
organized crime element, Mr. Kennedy..."
509,2093674,2096176,"and I did so, sir, with diligence."
510,2096844,2099137,"- Do you use the fireplace?
- Rarely."
511,2099305,2100847,Who else has heard the recording?
512,2101849,2105352,"I have filed the matter
personal and confidential."
513,2105686,2107646,I'm the only person with access to it.
514,2109232,2111900,"Mr. Hoover, I asked you to pursue a real threat."
515,2112068,2115695,"Instead, you've publicly denied
the existence of organized crime..."
516,2115863,2118198,and now this gross display of intimidation.
517,2118366,2122035,"Mr. Attorney General,
I was only following orders."
518,2122203,2124454,"We bugged the basement of a home
in Los Angeles..."
519,2124622,2127541,"that was a known gathering place
for lawbreakers."
520,2127708,2132129,"How was I to know that an East German communist
would be down there..."
521,2132296,2136049,"having sex with your brother,
the President of the United States?"
522,2137051,2140637,"Do not shoot the messenger, sir.
I am here to protect you both."
523,2140805,2142472,Remember that.
524,2145434,2147018,What do you want from me?
525,2150064,2152732,If this information were to go public...
526,2152900,2157737,"it would create widespread distrust
in your brother's leadership capabilities."
527,2158197,2161741,"And above all else, I hold the well-being
of our country paramount."
528,2161909,2164536,"So how may I help you, Mr. Hoover?"
529,2164704,2169583,"Well, if I am to pursue the elements
that you consider a threat..."
530,2169750,2173420,"I humbly request that you allow me
the same power and access..."
531,2173588,2176423,"to follow the groups that I see
as an immediate threat."
532,2176591,2178925,It's not 1920 anymore.
533,2180720,2182929,"You know who Stanley Levinson is, sir?"
534,2184390,2185724,A lawyer.
535,2186100,2190103,"A white, communist lawyer
organizing at the highest levels..."
536,2190271,2192022,including the SCLC.
537,2192190,2193940,"Now, their group is growing."
538,2194108,2196318,They are entirely self-serving...
539,2196527,2200113,"and their leadership is openly critical
of this department here."
540,2200281,2202032,Did you read the memos that I sent?
541,2202200,2204451,"No, no, I can't say that I have."
542,2206454,2208455,"It says right here, Mr. Kennedy."
543,2208623,2210290,They claim we are...
544,2210458,2213919,"""unable to get convictions in even
the worst, most heinous crimes..."""
545,2214086,2217214,"and that we have
""faltered under the pressure, complexities..."
546,2217381,2219674,"and responsibilities of our office,""
in print."
547,2219842,2223553,"- Right here in ""The Washington Post.""
- You can't bear a little criticism?"
548,2223721,2225972,"Well, it depends on what their aim is."
549,2226140,2228308,They are gaining considerable power.
550,2228476,2231353,"Their priorities are singularly focused
on their own issues."
551,2231520,2233730,They are trying to incite revolt.
552,2234649,2237484,"Frankly, they sound more critical
of your office than mine."
553,2238194,2241112,"There's a new face to communism, Edgar,
and this isn't it."
554,2243157,2245825,"Communism is a foreign threat now,
not domestic."
555,2248162,2251831,"Mr. Kennedy, before you were even born..."
556,2252833,2256294,"I heard that very same argument
from a Mr. Mitchell Palmer."
557,2257338,2259839,"Do you know what it took
to change his mind?"
558,2260174,2261174,A bomb.
559,2261842,2265428,"If he would have sat in his rocking chair
five more minutes in 1919..."
560,2265596,2269599,"we'd have been lucky enough
to find an intact index finger."
561,2269767,2273144,"Now, I do not want that to happen to you
or your brother, sir."
562,2274021,2277190,"There's no reason
we both can't get what we want."
563,2277358,2281695,"We can wage a war on two fronts, sir.
You understand?"
564,2283906,2286533,"You can go now, Mr. Hoover."
565,2289704,2290996,"Yes, sir."
566,2292123,2294541,Please leave the transcripts here with me.
567,2296752,2298003,"Yes, sir."
568,2303801,2306803,"Oh, and feel free and share them
with your brother."
569,2308889,2313310,"Oh, and let him know that I have
a copy of my own in safekeeping."
570,2331570,2332954,"Your 4:00 is here, sir."
571,2333122,2335540,"Thank you, Miss Gandy.
Send him right in, thank you."
572,2339879,2343214,"Please, have a seat, Mr. Tolson."
573,2343382,2347093,"- Mr. Hoover, thank you for this opportunity.
- Yes. Please."
574,2347261,2349596,"- Have a seat.
- Thank you, sir."
575,2349764,2353224,"There were several problems
with your application, Mr. Tolson..."
576,2353392,2356311,"not the least of which is the fact
that you did not show..."
577,2356479,2358730,the proper requirement to the Bureau...
578,2360441,2364069,"nor the proper dedication
to protecting the American people..."
579,2364236,2365278,and the American way.
580,2365446,2367864,May I remind you that this is not a platform...
581,2368032,2371451,"to a fatter paycheck in private practice,
Mr. Tolson?"
582,2375456,2378291,"Is there something the matter,
Mr. Tolson?"
583,2378459,2380460,"No, sir."
584,2380628,2383630,"Is exercise a requirement
for all agents, sir?"
585,2385883,2389803,"Yes. All our agents need to be
in top physical condition."
586,2389970,2394307,"We must outsmart and outmatch
the public enemy at every turn."
587,2394475,2396017,"Yes, of course."
588,2396185,2399479,"So, uh, what routine do you do, sir?"
589,2399647,2403108,"Push-ups, sit-ups, and squatting."
590,2404485,2405777,I see.
591,2405945,2407654,Would you like me to fix the curtain?
592,2408406,2409989,Or perhaps I could open a window.
593,2410157,2412617,"I always prefer a little bit of air
after exercise."
594,2412785,2414702,Don't you?
595,2415496,2416996,If it would please you.
596,2418124,2421126,"And, sir, where I may fall short
in terms of résumé..."
597,2422128,2425797,"I apparently far exceed
the rest in terms of honesty."
598,2426924,2428591,"I didn't lie to get this appointment, sir."
599,2428759,2431219,"Like the rest, yes,
I would like to start a practice..."
600,2431387,2437016,"but I could be persuaded otherwise
if the right opportunities were to arise."
601,2441564,2444107,"Fair enough, Mr. Tolson."
602,2446193,2447485,Fair enough.
603,2460291,2462292,These sleeves seem to be the correct length.
604,2462460,2464002,I found you two tie options.
605,2464170,2466379,This one is a bit more fashion-forward...
606,2466547,2469090,"but it would complement this suit
and cut and fabric."
607,2469258,2470800,"It's too loud, don't you think?"
608,2470968,2473678,"Too loud? Okay, which is why
I found this one, the backup."
609,2473846,2478558,"- It's a bit more directorial, a little bit more--
- It's a little bit more reserved, I agree."
610,2478726,2482729,"Let's keep this as a second option, please.
Thank you, Clyde."
611,2484732,2486733,Are you Mr. John Hoover?
612,2486901,2488193,I am. Is there a problem?
613,2488360,2492489,"It seems there's a Mr. John Hoover
whose credit has gone bad with us."
614,2492656,2494199,That would appear to be you.
615,2494366,2496993,"That is not me, sir, on my word."
616,2497161,2501956,"My mother calls me Edgar, my niece calls me J.E.,
and I sign John E., not John."
617,2502124,2505877,"Well, sir, if you're a friend of Mr. Tolson's..."
618,2506045,2509589,just choose one name and reapply.
619,2509757,2511591,All right.
620,2512218,2513551,Thank you very much.
621,2523896,2524938,"Morning, Miss Gandy."
622,2525648,2527649,What? You don't like it?
623,2529068,2532904,"Mr. Hoover, there's been a massacre in Kansas City."
624,2535032,2536074,One of our own?
625,2538744,2540620,Special Agent Caffrey?
626,2541330,2542372,Let him have it!
627,2543290,2546793,"By 1930, the communist threat
had been beaten back..."
628,2547378,2550630,"but the Depression had hit
and there was a new threat."
629,2550798,2553508,"The bank robber, the car thief,
and the kidnapper."
630,2553676,2558972,"But, unfortunately, as with communism,
America didn't react with scorn."
631,2559139,2562225,They gave the American gangster admiration.
632,2562393,2564894,"And the defiance by desperate,
armed criminals..."
633,2565062,2569190,"of the forces of society and civilization
can no longer be ignored."
634,2569358,2573236,"Bugs Moran and Al Capone
top the list of public enemies."
635,2573404,2576531,"Look around you.
They could be anywhere."
636,2576699,2581286,"May I remind you that the Bureau of Investigation
seeks to be your protector."
637,2581453,2584664,"It belongs to you. It is as close to you
as your nearest telephone."
638,2586041,2587500,And with your help....
639,2588294,2591462,"Warner Bros. presents
a Vitaphone production of:"
640,2591630,2593339,"""The Public Enemy."""
641,2594049,2597677,"James Cagney plays
public enemy number one."
642,2599013,2600013,"Why, you."
643,2602224,2604267,There you go with that wishing stuff again.
644,2604435,2606227,"Maybe you found someone
you like better."
645,2609189,2611524,Coming soon to your neighborhood theater.
646,2612818,2613860,Fantastic.
647,2614737,2619365,"That summer, a single crime opened the door
to set things right."
648,2620075,2622827,"Do you know what that was, Mr. Jones?"
649,2622995,2624329,"Sorry, sir, what was that?"
650,2624496,2627665,"Who is the most famous man
of the 20th Century thus far?"
651,2628834,2630209,"Joe McCarthy, sir?"
652,2631587,2634589,Mr. McCarthy was an opportunist...
653,2635090,2637175,"not a patriot, Mr. Jones."
654,2640888,2644724,"Who is the most famous man
of the 20th Century thus far?"
655,2645476,2647226,The most famous?
656,2647770,2649896,"Is that you, sir?"
657,2657404,2660740,"Well, I suppose his notoriety depends
on the field that he is in."
658,2660908,2664077,His field was in the clouds.
659,2665245,2667205,"Well, then Charles Lindbergh, sir."
660,2680511,2681552,Yes?
661,2681720,2684681,"Charles Lindbergh's baby
has been kidnapped from his home."
662,2684848,2688434,"Send officers from Trenton.
I'll be on the first train."
663,2693565,2694774,What is it?
664,2697778,2700738,"Charles Lindbergh--
Lindbergh's baby's been kidnapped."
665,2702616,2703700,You've got to find him.
666,2706078,2707954,He has to be brought home alive.
667,2709206,2710248,"Yes, Mother."
668,2713585,2715294,"Yes, Mother, I know."
669,2718215,2722927,"When we arrived at Mr. Lindbergh's home
that morning in 1932..."
670,2723095,2726431,"we began an investigation that would
forever change our Bureau."
671,2726598,2729892,"This morning we've heard from
the Pennsylvania Railroad, Will Rogers..."
672,2730060,2732979,"President Hoover,
Governor Roosevelt, Customs..."
673,2733147,2734897,"the U.S. Mail, and the Boy Scouts."
674,2735065,2736649,All of you. Get off of that dirt.
675,2736817,2739485,"You're trampling evidence.
Immediately! Get off!"
676,2739653,2742613,"There's nothing there. We checked.
No defined footprints."
677,2742781,2744991,"It appears he was wearing
fabric on his shoes."
678,2745159,2747827,"You don't think the size
could've held some value?"
679,2747995,2751330,"How did he get up there?
Are there marks on the window and wall as well?"
680,2751498,2753458,A ladder. We found it 100 yards away.
681,2753625,2755084,We moved it inside.
682,2755252,2756419,You moved it?
683,2756587,2758171,"Yes, for safekeeping."
684,2758338,2762341,"Congratulations, Mr. Schwarzkopf.
You have contaminated the crime scene."
685,2762509,2764594,"Now, get your boots off this property."
686,2764762,2767054,"And what right do you have to be here,
Mister, uh...?"
687,2767222,2769849,"J. Edgar Hoover,
director of the Bureau of Investigation."
688,2770017,2773019,"We've been sent by President Hoover
to ensure the investigation--"
689,2773187,2776272,"The president has authorized access
to all documents and evidence."
690,2776440,2780276,"Mr. Hoover, you're free to observe,
but New Jersey's not the president's domain."
691,2780444,2784030,"And where is Mr. Lindbergh?
I'd like to hear his opinion on the matter."
692,2784198,2786282,"- Mr. Lindbergh's around back.
- After you, sir."
693,2786450,2788117,He's been up all night.
694,2788285,2791329,Mr. Lindbergh himself came down to meet me.
695,2791497,2796542,"He shook my hand and expressed his
gratitude and faith in our young Bureau."
696,2797294,2799295,He fell five feet.
697,2799463,2800713,Who did?
698,2802841,2805218,"The kidnapper, with the child in his arms."
699,2806470,2808179,"That's speculation, Mr. Hoover."
700,2808347,2813017,"Mr. Lindbergh, sir, if the ladder had split
while the person was on their way up..."
701,2813185,2815978,"it would have collapsed.
You see, it was a miscalculation."
702,2816146,2820691,"It was meant to bear the weight of a man,
but not the weight of a man and child."
703,2820859,2821901,We have other theories.
704,2822903,2824028,Where's the ransom note?
705,2824988,2826197,Of course.
706,2827825,2830368,"And you are touching that
with your bare hands as well?"
707,2830536,2831577,We checked.
708,2831745,2835122,"There are none of those finger imprints
that you fancy so valuable."
709,2835290,2837083,"Please hand it over, Mr. Schwarzkopf."
710,2837251,2839919,That's Colonel Schwarzkopf.
711,2842381,2845216,"""Have 50,000 dollars ready,""
spelled R-E-D-Y."
712,2845384,2849011,"""We will inform you where,""
spelled W-E-R-E, ""to deliver the money""..."
713,2849179,2850513,spelled M-O-N-Y.
714,2850681,2854851,"""We warn you for making anything public
or for notify the police."
715,2855018,2859772,"Indication for all letters are signature,""
S-I-N-G, ""singnature."""
716,2860691,2862275,Three holes.
717,2863861,2865945,I want this letter and the ladder.
718,2866113,2868281,"No jurisdiction.
I've showed what you asked for."
719,2868448,2870867,"- It's time for you to go.
- Mr. Lindbergh, please...."
720,2871034,2874412,"Mr. Hoover, thank you. As you can see,
we have everything under control."
721,2874580,2876372,"Thank you, gentlemen."
722,2876540,2878624,"Thank you for your time, Mr. Lindbergh."
723,2880043,2881085,Clyde.
724,2889845,2892930,"Clyde, I'm afraid for his boy."
725,2893348,2895641,He trusts the local police more than us.
726,2895851,2897310,He thinks we're all fools.
727,2897477,2901397,"He'll go around them too.
He's going to bargain with the kidnappers."
728,2903567,2906611,"President Hoover called me
the morning the child was taken..."
729,2906778,2909947,"and asked me to do whatever was in my power
to solve this crime."
730,2910115,2913075,"But do you know what all the power
of the Bureau means..."
731,2913243,2918205,"without federal laws, without arms,
without the ability to make arrests?"
732,2918373,2920207,It means nothing.
733,2920375,2923961,"Mr. Chairman, I urge passage
of the Lindbergh Law..."
734,2924129,2926505,making kidnapping a federal offense.
735,2926673,2930676,"To immediately deliver all the fingerprints
in this country to my office..."
736,2930844,2933012,so that we may create a central file.
737,2933180,2936349,"To help arm our agents
so that they have a fighting chance..."
738,2936516,2940353,"against the submachine guns
of some of the most dangerous characters..."
739,2940520,2942480,in the history of American criminality.
740,2942648,2946067,"And I urge you to do this
in the name of Little Lindy."
741,2946234,2949528,"Because if he can be taken,
then what child is safe?"
742,2949696,2955451,"And if we cannot aid in his safe return,
then what use are we?"
743,2976716,2980142,Every fingerprint from the local authorities...
744,2980310,2984522,"across the country began flowing in.
Finally, we had a centralized system."
745,2984690,2986232,"What is it, Edgar?"
746,2987651,2990027,"The last of the fingerprints
came in from Chicago."
747,2992072,2997118,"You know our new president has scheduled
a meeting with me, Miss Gandy?"
748,2998578,3002748,"Do you know that there are talks
of reorganizing the Bureau?"
749,3003375,3005668,"Yes, I've heard similar whispers."
750,3007170,3008754,Have you?
751,3010966,3015094,"Miss Gandy, do you remember that file
we created on his wife?"
752,3015262,3016846,Mrs. Roosevelt?
753,3017014,3018597,Yes.
754,3018765,3020933,"Will you make a copy for me, please?"
755,3021768,3023602,"Yes, of course."
756,3025272,3027106,"Thank you, Miss Gandy."
757,3060766,3063934,Lindbergh hired criminals to find his son.
758,3064227,3066520,"Off the desk now, Agent Garrison,
follow me."
759,3066688,3067730,"Yes, sir."
760,3067898,3070983,"He even got an offer from Al Capone
to help pay the ransom money..."
761,3071151,3075071,"but, in the end, he employed an eccentric
by the name of John Condon..."
762,3075238,3079492,"who placed a newspaper ad to act
as a go-between with the kidnappers."
763,3079659,3082078,"Now, was Condon a criminal too?"
764,3082245,3085623,"He most certainly wasn't
an agent of the law, Mr. Garrison."
765,3085791,3087333,Why are you doing this?
766,3088460,3090920,So a mother may have her baby again.
767,3091546,3094673,"And you may know that the
American people are grateful..."
768,3094841,3097968,"for the honor bestowed upon them
by your pluck and daring."
769,3098136,3102515,"And how do we know the kidnapper is the same
that wrote the letters that you have?"
770,3103600,3107770,"The symbol, uh, matches
the original letter's symbol, doesn't it?"
771,3111691,3113484,"What is it, Mr. Lindbergh?"
772,3116696,3119698,In a moment of thoughtlessness...
773,3119866,3122034,I showed the symbol to some other men...
774,3122202,3125037,"and I'm not sure
that they were trustworthy."
775,3126373,3128165,I'm not sure anyone is trustworthy.
776,3130001,3131877,I will be having your letters analyzed...
777,3132045,3135381,"to make sure that they are
from the same author."
778,3136216,3139552,"And while Mr. Lindbergh
placed his faith in hoodlums..."
779,3139719,3143222,"we began cultivating the one thing
criminals couldn't fight..."
780,3143390,3145057,with all the guns in the world.
781,3145225,3149353,"Gentlemen, please leave this room.
Clear all these tables. Time to go, now."
782,3149521,3150688,"Where can we smoke, sir?"
783,3150856,3152439,Not my concern. Out of my sight.
784,3152607,3155734,"- Mr. Osborne, tell us what you need.
- Uh, bright lights, a microscope..."
785,3155902,3158404,"measuring instruments, magnifying glasses.
A, uh, projector."
786,3158572,3161532,"You have the full resources of the Bureau.
Don't be shy."
787,3161700,3163826,Paper samples from every regional manufacturer.
788,3163994,3167621,"Mr. Osborne, this is Mr. Tolson.
Supply Mr. Osborne whatever he needs..."
789,3167789,3171333,"to conclude without a doubt
that these letters came from the same author."
790,3174880,3177047,"Gentlemen, please. Thank you."
791,3179676,3182887,"- Should we tell the attorney general?
- So he can say no a third time?"
792,3183054,3186807,"- Just post a sign, like this one.
- What would you like it to say, ""keep out""?"
793,3186975,3189560,"""The Bureau of Investigations
Technical Laboratory."""
794,3189728,3193731,"Have it carved and nailed to the wall.
If he wants it gone, he'll have to tear it out."
795,3193899,3196901,"It's time we at least have one thing
the bad guys don't."
796,3197068,3198110,Decorating skills?
797,3198278,3199820,"Science, Clyde. Science."
798,3199988,3204116,"Uh, the ink is different,
but the handwriting is a match."
799,3204284,3209079,"Whoever Mr. Condon is corresponding with
is the person who wrote the original note."
800,3209247,3211207,Or Condon wrote all the notes himself.
801,3211374,3214001,"Lindbergh is planning on using Condon
to deliver the ransom."
802,3214169,3216629,"- May have already happened.
- Call the Internal Revenue Service."
803,3216796,3220633,"Get them to Lindbergh's home.
I insist that all those bills be marked."
804,3220800,3221884,"Yes, sir."
