Number,StartMilliseconds,EndMilliseconds,Text
979,4148240,4149241,Crisis?
980,4149360,4150361,He's a sickler.
981,4151120,4152724,He's got sickle cell anemia.
982,4153600,4155204,"- You didn't know that?
- No."
983,4155280,4157681,"Well, a sickler gets a cold or a chill."
984,4157760,4160604,"Anything that makes a normal person's
blood cell count go up,"
985,4160760,4162842,"any time the body gets ready
to fight something,"
986,4162920,4164285,"the red blood cells panic,"
987,4164360,4165964,and they take on a sickle shape.
988,4166040,4167610,Actually create a kind of a traffic jam
989,4167680,4169011,in the arteries.
990,4169080,4170570,The blood gets very thick.
991,4170680,4172250,"Suddenly, you're not getting any oxygen."
992,4172400,4173526,What are you doing for him?
993,4173920,4174921,"Well,"
994,4175160,4177527,"we're hydrating him,
giving him Demerol for the pain."
995,4177600,4178647,But he knew the drill.
996,4178720,4180484,"He got in here early enough,
so I don't think"
997,4180560,4182164,it'll go on for too long.
998,4182280,4183691,I'll be right out there if you need me.
999,4183760,4185125,"Thanks, doctor."
1000,4198080,4199570,Don't feel sorry for me.
1001,4200920,4201921,I don't.
1002,4205960,4207564,"How long I gotta be here for, man?"
1003,4207720,4209404,Depends how well you behave.
1004,4211320,4214403,"You know, my mom told me once
that I got special blood."
1005,4214520,4216045,That I can never catch malaria.
1006,4216720,4218643,That's how sickle cell got started.
1007,4218720,4220688,In Africa. As a defense against malaria.
1008,4221160,4222605,"Where is your mother, TJ?"
1009,4223800,4225245,Why aren't you a cop no more?
1010,4225320,4226321,You first.
1011,4230240,4233722,"I had a crisis one time.
I was about 11."
1012,4233800,4235450,"My mom took me to the hospital,"
1013,4235520,4238046,but never came back to check me out.
1014,4238120,4239724,"I guess she thought that
if she left me there"
1015,4239800,4242565,they'd put me with a really nice family.
1016,4242640,4243971,Little did she know.
1017,4244880,4249647,"I saw her in the street a few times
after that, but that was a while ago."
1018,4250680,4252170,She had some issues then.
1019,4253440,4254566,Your turn.
1020,4255720,4257609,I was off duty one day.
1021,4258760,4260762,I was in a bar in Washington Heights where
1022,4260840,4262524,cops didn't have to pay for their drinks.
1023,4262600,4263601,Wait a minute.
1024,4263920,4265809,Three kids held up the place.
1025,4267840,4271242,"On their way out,
they shot the bartender in the heart."
1026,4271320,4273288,"I chased them out into the street,"
1027,4274440,4277489,"and I shot two dead,
caught the other one in the thigh."
1028,4277640,4279210,"- I heard this already.
- No."
1029,4279400,4280526,You didn't.
1030,4282280,4283281,"You see,"
1031,4284040,4285041,one shot...
1032,4285520,4288046,"Well, the bullet took a bad hop."
1033,4308720,4310882,It hit a 7-year-old girl in the eye.
1034,4312040,4313405,Killed her instantly.
1035,4314160,4316208,"An inch higher and it
would have grazed her head."
1036,4316880,4318848,Left a nasty scar. That's all.
1037,4319200,4321202,"So wait, they quit your ass"
1038,4321280,4323282,after you took on three bangers by yourself?
1039,4324320,4327881,"They gave me a commendation.
I quit my own ass."
1040,4329400,4331323,I never met anybody that tight before.
1041,4331760,4332921,Tight?
1042,4333000,4334001,Brave.
1043,4335920,4337081,I wasn't brave.
1044,4339400,4340765,I was just drunk.
1045,4343920,4345524,Don't feel sorry for me.
1046,4348880,4350006,I don't.
1047,4356760,4358250,"Now, please."
1048,4399920,4401001,Watson?
1049,4418680,4419886,Watson?
1050,4452920,4454729,You don't know how lucky you are.
1051,4464560,4465561,Scudder.
1052,4482080,4483081,Hello?
1053,4488080,4489081,Kenny?
1054,4492960,4494086,Anybody home?
1055,4504920,4506126,And where've you been?
1056,4509640,4511529,"- Been trying to call you.
- Where's Kenny?"
1057,4511840,4513126,Whitestone.
1058,4513200,4514725,With a friend who says he's having
1059,4514800,4516689,the same kind of problem as Kenny had.
1060,4516920,4517921,The wife?
1061,4518600,4519601,Worse.
1062,4526840,4528410,I don't got that kind of money.
1063,4533680,4534841,You're the detective?
1064,4534920,4535967,Matt Scudder.
1065,4536280,4539807,"Hello. Dani, why don't you go outside
and keep an eye out."
1066,4539880,4541086,That's a good boy.
1067,4543120,4544884,Now I post guards.
1068,4545360,4549365,"The horse is stolen, so I lock the barn.
For what? Huh?"
1069,4549680,4552524,"What can they take from me now?
She's 14 years old."
1070,4552800,4554609,Fourteen.
1071,4554680,4556569,"This is Anna, the nurse."
1072,4558560,4561882,"They took her last night
and call us in the morning"
1073,4562800,4564529,and tell us not to call the police.
1074,4565480,4566891,"I remember Kenny calling the other day,"
1075,4566960,4569247,so I put two and two together.
1076,4569360,4572409,"Mr. Landau, listen,
you have to know that..."
1077,4572600,4573886,"I'm sorry, what's your daughter's name?"
1078,4574040,4576884,Ludmilla. But she calls herself Lucia.
1079,4577840,4579842,"You have to know
that the men who took Lucia"
1080,4579920,4583481,"have already killed at least two women,
including Kenny's wife."
1081,4584840,4586080,"As things stand,"
1082,4586160,4587400,they haven't got the slightest intention
1083,4587520,4589522,of releasing your daughter alive.
1084,4590520,4591806,"In fact,"
1085,4591880,4593962,"there's a strong possibility
that she's already dead."
1086,4594040,4595849,"- No...
- The police know about these two."
1087,4596040,4597610,"They know who they are,
they know what they're doing."
1088,4597680,4599011,"No, no, no police."
1089,4599520,4602444,"You have to help me.
Kenny said you would. I'll pay."
1090,4603160,4604491,I'll do whatever you ask.
1091,4605520,4606681,Please.
1092,4614880,4615927,Hello?
1093,4616000,4618080,"Okay, you know what happens next?"
1094,4618160,4620891,"Yes, I'm trying. I'm working on it."
1095,4620960,4623361,"Well, work harder, Yuri.
We want our money."
1096,4623480,4624811,"I just need some time, please."
1097,4624880,4625961,"I'll give you whatever you want,"
1098,4626040,4627565,"but please, the one thing I want"
1099,4627640,4629040,is to talk to my daughter. I just...
1100,4629080,4630127,She can't talk right now.
1101,4630200,4631920,"You gotta let me talk to her.
Just let me..."
1102,4632880,4634723,"If she's dead, you get nothing."
1103,4635280,4637203,And who the fuck are you?
1104,4637400,4640404,"I'm the best chance you've got
if you wanna get your money."
1105,4640800,4642882,"But the girl's gotta be alive
and all in one piece"
1106,4642960,4644962,for any kind of deal to happen.
1107,4645240,4647129,"Are you listening, motherfucker?"
1108,4648560,4650024,Fuck this shit.
1109,4653400,4655289,"I can't believe you
talked to him like that."
1110,4655360,4656566,He knows what he's doing.
1111,4656640,4658722,"The important thing right now
is to keep Lucia alive."
1112,4658920,4660331,That means these guys have to know
1113,4660400,4661686,that they can't get a nickel out of you
1114,4661800,4663325,until we first know that she's okay.
1115,4663400,4665448,"- But if you make them mad...
- They're already mad."
1116,4665520,4667284,"But you'll give them
an excuse to kill her."
1117,4667360,4668691,They don't need an excuse.
1118,4668760,4669960,They're gonna kill her anyway.
1119,4670600,4672967,"What they need is a reason
to keep her alive."
1120,4673600,4674886,How much cash have you got?
1121,4674960,4676320,"I got damn little right now, but..."
1122,4676800,4678165,Do these bastards want cocaine?
1123,4678240,4680129,"Because I got 15 kilos
10 minutes from here."
1124,4681600,4682726,I don't know.
1125,4682800,4685565,"Maybe I could get my hands
on a few hundred in counterfeit, but..."
1126,4685640,4687369,"I can't guarantee the quality,"
1127,4687440,4688566,and I'd have to return it.
1128,4688640,4690927,I got at least five hundred in cash.
1129,4692400,4693811,"Time comes, I'll go get it."
1130,4694280,4696009,Is there another line I can use?
1131,4696920,4698922,There's a phone in my daughter's room.
1132,4704840,4707047,Culpepper Investigations. Daunte speaking.
1133,4707120,4708121,Where the hell are you?
1134,4708520,4710010,"I'm in my office, man.
What's up?"
1135,4710240,4711446,Why'd you leave the hospital?
1136,4711840,4713729,I didn't want some Social Services person
1137,4713800,4715643,"to come haul my ass away
to a foster home."
1138,4715720,4716926,I need you to do me a favor
1139,4717000,4718729,and get me something out of my apartment.
1140,4718800,4719847,What's going on?
1141,4720120,4723647,"There's a box up in my closet.
I want you to get it for me."
1142,4723760,4725762,"The kid at the front desk
will let you up."
1143,4726120,4728521,Apartment 11G. Key's above the door.
1144,4728840,4732242,"A guy named Peter will meet you out front.
Give it to him."
1145,4732320,4734209,"And then go back to
whatever it is you're doing."
1146,4743360,4744361,Hello?
1147,4744600,4746762,"I understand we have
a new player in the game."
1148,4746840,4748683,I don't believe we've been introduced.
1149,4748960,4751611,"I'm a friend of Mr. Landau's.
My name is not important."
1150,4751680,4754889,"I'm assuming that Mr. Landau's
not dumb enough to speak to the police."
1151,4755000,4756001,He hasn't.
1152,4756120,4757121,Then who are you?
1153,4757520,4759602,"One likes to know
who's on the other side."
1154,4759680,4762411,"We're on the same side.
We both want this to happen."
1155,4762480,4764801,"Good. Then all you got to do
is follow instructions."
1156,4764880,4766325,No. It's not that simple.
1157,4766880,4769281,"Of course it is.
We tell you what to do"
1158,4769360,4770361,and you do it.
1159,4770480,4772000,If you ever want to see the girl again.
1160,4772200,4774407,"You have to convince me
she's alive in the first place."
1161,4774560,4775846,You have my word on that.
1162,4777680,4778727,That's funny.
1163,4778800,4779880,"What, it's not good enough?"
1164,4780000,4781889,"Let's just say you lost
a lot of credibility"
1165,4781960,4784691,"when you returned Mrs. Kristo
in poor condition."
1166,4785200,4787806,"There were special circumstances
regarding Mrs. Kristo."
1167,4787880,4789291,Her husband tried to haggle.
1168,4789360,4793160,"He sliced the price, and we in turn..."
1169,4794880,4797161,"Well, you can finish that thought
for yourself, can't you?"
1170,4797200,4799009,We're not going to argue the price.
1171,4799320,4800446,You'll pay the million?
1172,4800920,4802160,For the girl alive and well.
1173,4802880,4804530,I assure you she's both.
1174,4804720,4806529,Your assurance means shit to me.
1175,4806600,4808568,"Put her on the phone,
let her father talk to her."
1176,4808760,4811969,"Uh, I'm afraid I won't be able
to put her on the phone right now."
1177,4812040,4813565,Please deposit 25 cents...
1178,4813680,4815728,"Out of quarters?
Give me your number, I'll call you back."
1179,4829920,4830921,Yeah?
1180,4831040,4834044,"I'm afraid the girl cannot come to the phone.
That's out of the question."
1181,4834360,4837443,"How else can we reassure you
of her wellbeing?"
1182,4837560,4838641,Wait.
1183,4839200,4840880,Tell me something your daughter would know.
1184,4841600,4842601,The dog's name.
1185,4843080,4845208,"They could know that.
They've been following her."
1186,4845560,4848200,"They know your schedule.
They've probably seen her walking the dog."
1187,4848680,4851650,"Heard her call him by name.
Think of something else."
1188,4851840,4854366,Yes. We had a dog before this one.
1189,4854440,4856807,"A little black-and-white one.
He got hit by a car."
1190,4858480,4861643,"The dog's name. And the name
of the dog before this one."
1191,4862000,4864651,"Have her describe both of them.
Then call me back."
1192,4909640,4911847,"The 16 years we were married,"
1193,4912720,4915166,I don't remember her even having a cold.
1194,4916320,4920166,"Then one day she wakes up and says
she can't smell anything."
1195,4923520,4925090,You were a policeman?
1196,4925160,4926889,"Yeah, I was."
1197,4927440,4929408,You dealt with situations like this?
1198,4930600,4932762,"No, not like this."
1199,4932840,4935810,"Still, your gut must be telling you something?"
1200,4935880,4938451,"What is it telling you now?
Is she alive?"
1201,4945560,4946561,Yeah?
1202,4946640,4949166,"I'd still like to know
how you figure in all this."
1203,4949840,4951171,Tell me the dog's name.
1204,4951560,4953210,"Oh, well, let's see,"
1205,4954200,4956089,"what are the old standbys, huh?"
1206,4956560,4959848,Fido? Towser? King?
1207,4960160,4961969,"Rover, that's always a popular choice."
1208,4962440,4966126,"Hey, I know what it is.
How about Bingo?"
1209,4967080,4968081,"What about Spot, huh?"
1210,4968600,4971683,"""Run, Spot, run!""
It's not a bad name for a Rottweiler."
1211,4972880,4974211,The dog's name is Watson.
1212,4974440,4975646,Watson.
1213,4977560,4979369,And the other dog? The one before?
1214,4979640,4981449,"She couldn't tell me what breed
the other dog was."
1215,4981520,4983409,She was young when it died.
1216,4984080,4985809,"They had it put to sleep, she said."
1217,4985880,4988008,"It's a silly term for it,
don't you think?"
1218,4989040,4990121,"I mean, you're gonna kill something"
1219,4990200,4992640,"you ought to have the courage
to say that's what you're doing."
1220,4994600,4996011,You're not talking. You still there?
1221,4996080,4997081,I'm here.
1222,4997440,5000649,"I gather it was a mongrel.
So many of us are."
1223,5001120,5004203,"Now the name's a bit of a problem.
I may not have it right."
1224,5004280,5007090,"It's a Russian word.
How's your Russian, my friend?"
1225,5007560,5008561,Tell me.
1226,5010080,5012970,I may be saying this wrong. Balalaika.
1227,5013040,5014040,Balalaika.
1228,5015200,5018329,"The name of a musical instrument,
or so she tells me."
1229,5018880,5022123,"What do you say, pal?
Does it strike a chord?"
1230,5026280,5028567,"You got two hours to get
the money together."
1231,5039600,5040601,TJ?
1232,5084640,5086722,TJ? What are you doing here?
1233,5086800,5088131,Handing you this.
1234,5088520,5091285,"I told you to give it to Peter.
Not to come down here."
1235,5092160,5094208,"Matthew, that dude's all spun."
1236,5094280,5095920,There's no way I was gonna give it to him.
1237,5096480,5097527,Later.
1238,5101080,5102286,How much have we got?
1239,5102360,5103441,Hang on a sec.
1240,5103560,5104721,Keep it separate.
1241,5106280,5107964,Holy fucking shit.
1242,5109400,5112006,"This is TJ, my associate."
1243,5115040,5117611,Paper's good. Ink looks right.
1244,5118280,5120282,"Nice used bills.
This looks real enough."
1245,5120600,5122090,We'll repackage them slightly.
1246,5122440,5123487,"We'll use the back wrappers,"
1247,5123560,5125369,"but we'll take six bills
out of each stack"
1248,5125440,5126646,and replace them with real ones.
1249,5126720,5130202,"Three on top, three on the bottom.
What's this make the count?"
1250,5130520,5132727,I got at least 210 in fake stuff
1251,5132800,5134131,and Kenny brought another six.
1252,5134320,5135685,Puts us right about eight.
1253,5136480,5137766,That's good enough.
1254,5140160,5141969,We have to meet face-to-face.
1255,5142040,5144042,"You get an opportunity
to inspect the money,"
1256,5144760,5146728,"and we get to see
that the girl is all right."
1257,5146840,5148410,And then you people come down on us.
1258,5148480,5149970,You'll have the girl covered.
1259,5150400,5151526,A knife at her throat.
1260,5151600,5152601,If you want.
1261,5152680,5155081,"The edge of the blade tucked up
under her windpipe."
1262,5155160,5156161,Whatever.
1263,5156440,5158647,"Yeah, I don't like this face-to-face business."
1264,5158840,5160330,We'll set up 50 yards apart.
1265,5160880,5163531,"You'll be in place first.
You'll see us arrive."
1266,5163760,5166411,"You show the girl,
then I come over with the money."
1267,5166760,5168808,"- By yourself?
- Yes."
1268,5169000,5170001,Unarmed?
1269,5170080,5172321,"I'll have a suitcase full of money
in each hand,"
1270,5172400,5174323,a gun won't do me much good.
1271,5174920,5176251,Keep talking.
1272,5176800,5180771,"You check the money.
When you're satisfied, you let the girl go."
1273,5180920,5183002,Your man takes off with the cash.
1274,5183080,5185128,You and l wait until you feel good.
1275,5185920,5186921,Then we go home.
1276,5187960,5189200,You could grab me.
1277,5189440,5193525,"You'll have that knife you keep talking about,
a gun, too, if you want one."
1278,5194200,5195770,You'll see my face.
1279,5195840,5197365,Wear a mask.
1280,5197480,5199289,Cuts the visibility.
1281,5199960,5202691,"I already know what you look like, Ray."
1282,5205280,5206327,What do you know?
1283,5207960,5209803,"I know you're a genetic fuck-up,"
1284,5209880,5211882,"who, if I'd met on the street 10 years ago,"
1285,5212000,5213764,"I'd have thrown you out
of a fucking window."
1286,5213840,5215205,Careful.
1287,5215280,5217328,"It's been a busy year
for you and your boyfriend."
1288,5217480,5219209,"You know, I could cut
the little cunt's throat"
1289,5219280,5221567,"and send her back to Daddy
a chunk at a time."
1290,5221680,5223648,"- Then you're dead.
- Oh?"
1291,5224040,5225644,"Yeah, ""oh."""
1292,5225880,5226881,You want your money
1293,5226960,5228325,or you wanna be looking behind you
1294,5228400,5230209,for the rest of your worthless fucking life?
1295,5231320,5234324,"Do this deal and I'll sit on
what I know about you."
1296,5234680,5236569,"You can take your little
Bert and Ernie act"
1297,5236640,5238130,to the other side of the country.
1298,5238200,5240009,There's plenty of dope dealers in LA.
1299,5248240,5249321,Where do you want to do it?
1300,5250160,5251889,How about Green-Wood Cemetery?
1301,5253160,5254605,"Yeah, I think I know that place."
1302,5254680,5257729,"You should.
That's where you dumped Leila Andresen."
1303,5258280,5260408,"There are two entrances
on the Fifth Avenue side."
1304,5261120,5263202,Take the 35th Street entrance
1305,5263320,5265641,"and head south about 20 yards
inside the fence."
1306,5265960,5268964,"We'll enter at 25th
and approach you from there."
1307,5269560,5271847,"Say, uh, 10:30."
1308,5271920,5274207,"That gives you over an hour
to get there and set up."
1309,5274360,5277204,Leila. Was that her name?
1310,5277520,5279045,I would think you'd remember.
1311,5279160,5281640,"No, once they're in the van,
they're just body parts."
1312,5282800,5284006,10:30.
1313,5284080,5286208,"Oh, God, she was so scared..."
1314,5288560,5290244,Have you got a rifle?
1315,5290520,5291521,Dani.
1316,5291720,5292721,Is he a good shot?
1317,5293120,5296090,"During the day maybe.
Dani's a little nearsighted."
1318,5296160,5297730,Peter was in the army.
1319,5301560,5303483,"Yeah, it was a while ago. Yeah."
1320,5304680,5308571,"Give him the rifle. Keep Dani
and the other one here with your wife."
1321,5309280,5310884,I don't want to spook our friends.
1322,5335280,5337408,Who would like to read the 12 steps?
1323,5344680,5346967,"Hi, I'm Sarah and I'm an alcoholic."
1324,5347040,5348405,"Hi, Sarah."
1325,5349840,5351171,Step one.
1326,5352040,5354771,We admitted we were powerless over alcohol.
1327,5355440,5357363,That our lives had become unmanageable.
1328,5396760,5397807,What's the drill?
1329,5397920,5399331,Stay in the car. Lock the doors.
1330,5399400,5401243,Call 911 if anything goes down.
1331,5401320,5402321,This is such bull...
1332,5406480,5407481,Step two.
1333,5409480,5411369,Came to believe that a power greater
1334,5411440,5413966,than ourselves could restore us to sanity.
1335,5448200,5449611,That's far enough.
1336,5449680,5452206,"Come out where I can see you.
Show the girl."
1337,5452320,5454209,I have a knife to her throat.
1338,5455000,5456240,If my hand slips...
1339,5456320,5457731,Let's hope it doesn't.
1340,5458480,5459720,Is that our money?
1341,5465560,5466891,Step three.
1342,5467200,5469726,"Made a decision to turn
our will and our lives"
1343,5469800,5472406,"over to the care of God
as we understood him."
1344,5476120,5477451,"Now, let her go."
1345,5477520,5479329,We ought to just shoot this cocksucker.
1346,5479560,5481050,"Don't change the rules now, Ray."
1347,5487720,5488721,Let her go.
1348,5491240,5492651,Sweet Lucy.
1349,5494240,5495571,I hate to see you go.
1350,5499760,5503207,"Lucia, walk toward me.
Your father's just over here, Lucia."
1351,5509600,5510761,Step four.
1352,5511560,5512971,What's the matter with her hand?
1353,5513040,5514690,Nothing. She's right as rain.
1354,5514760,5518082,"Made a searching and fearless
moral inventory of ourselves."
1355,5524760,5526285,It was before you set the terms.
1356,5529440,5532887,"Go to your dad. Go to your dad, baby.
Atta girl."
1357,5539520,5541284,"Go on, get out of here."
1358,5545360,5547362,I liked her. She was nice.
1359,5553280,5555328,"What the fuck is the matter with you, man?"
1360,5555720,5557290,Why aren't you afraid?
1361,5557960,5559121,I don't know.
1362,5560640,5562961,"Maybe I don't care
if you shoot me or not."
1363,5563760,5566969,"Or maybe there's a high-powered rifle
pointed at your head."
1364,5575080,5576127,I could still kill you.
1365,5576200,5577247,I'm right here.
1366,5578760,5580569,"In some ways,
you'll be doing me a big favor."
1367,5582000,5584685,No. I think I'll just fade into the shadows.
1368,5586600,5587601,They fucked us.
1369,5587840,5588841,Shoot him.
1370,5590760,5591807,Step five.
1371,5591920,5594321,"Admitted to God, to ourselves,"
1372,5594680,5598401,"and to another human being
the exact nature of our wrongs."
1373,5611520,5612806,Step six.
1374,5613120,5615043,We are entirely ready to have God
1375,5615120,5617361,remove all these defects of character.
1376,5619520,5620681,Peter!
1377,5630280,5631725,Step seven.
1378,5632480,5635324,Humbly ask Him to remove our shortcomings.
1379,5643120,5644406,Step eight.
1380,5644520,5646409,Made a list of all persons we had harmed
1381,5646840,5649411,"and became willing
to make amends to them all."
1382,5667760,5668841,Don't move.
1383,5669200,5670884,"Kenny, I got to tell you..."
1384,5671400,5672447,It's okay.
1385,5672720,5673926,You gotta know.
1386,5675760,5676841,I loved...
1387,5676920,5678081,Step nine.
1388,5679360,5681442,Make direct amends to such people.
1389,5682600,5683601,I loved...
1390,5684920,5686251,"I love you, too, man."
1391,5691600,5694888,"...except when to do so
would injure them or others."
1392,5699960,5701121,Which way did they go?
1393,5707240,5708526,He shot me!
1394,5714360,5715486,TJ?
1395,5715640,5716641,"Oh, Christ."
1396,5717680,5719880,"He must have panicked
when he heard the shooting."
1397,5720120,5722566,"He can't be out in this rain.
We have to find him."
1398,5723120,5724485,"Well, he's got a phone, right?"
1399,5753200,5754201,Help!
1400,5755000,5756001,Albert!
1401,5772360,5773400,Shit!
1402,5776840,5777841,Hello?
1403,5779360,5780361,"Oh, fuck."
1404,5781880,5782881,TJ.
1405,5783000,5785128,"Scudder. I got in the van.
They don't know I'm here."
1406,5785200,5787487,Listen to me. Get out of there. Now.
1407,5787680,5789284,"It's cool. I'm in the garage
and they in the house."
1408,5789360,5790361,Which is where?
1409,5790520,5791726,Sit down.
1410,5793720,5795609,I've never been shot before.
1411,5796600,5798762,There's a first aid kit in the bathroom.
1412,5834400,5835845,"Hey, I don't see any numbers."
1413,5835920,5837046,Try next door.
1414,5838800,5841121,"697. Wait, no. 692."
1415,5841360,5843089,"Okay, now walk away from the house."
1416,5843800,5844881,Go to the corner.
1417,5846800,5848643,"- Is any of it real?
- Some."
1418,5861600,5863170,51st Street and Church Avenue.
1419,5863760,5865125,Borough Park.
1420,5865200,5866480,That's not even a mile from here.
1421,5867440,5868805,Stay put. You hear me?
1422,5869120,5870121,Pigs.
1423,5884080,5885127,"Hey, who's..."
1424,5889680,5891364,"Shit, shit, shit."
1425,5987720,5989802,You can have your money back.
1426,5989920,5991046,It's downstairs.
1427,5996200,5997565,Don't even think about it.
1428,6019560,6020607,You're the husband.
1429,6021400,6022401,So?
1430,6022720,6023720,I was just wondering.
1431,6023760,6025480,"Were you just going
to leave Ray down there?"
1432,6025600,6026601,No.
1433,6027520,6029841,I was going to get something to eat.
1434,6029960,6031849,I was going to clean up before I left.
1435,6032120,6034168,What were you going to do with him?
1436,6034240,6035401,Chop him up.
1437,6036160,6039004,"Wrap him. There are plenty of bags
in the cupboard."
1438,6039080,6041845,"And then what? Deliver him to somebody
in the trunk of a car?"
1439,6041960,6042961,No.
1440,6044120,6045451,That was just for you.
1441,6047640,6049483,"You have a choice to make, Kenny."
1442,6050240,6053005,"There's a lot of hard evidence
against this asshole."
1443,6053080,6055287,He's got his dead buddy in the basement.
1444,6055800,6057768,Not to mention the van in the garage.
1445,6057840,6061526,"It's gonna be full of fibers and blood traces
and God knows what else."
1446,6062800,6064802,"He ought to be looking
at three life sentences,"
1447,6065160,6068642,"plus an extra 20 or 30 years
tacked on as a bonus."
1448,6069320,6071482,What about the other choice?
1449,6072040,6073041,You with me?
1450,6077000,6078001,No.
1451,6079600,6081523,I could turn him in and sleep just fine.
1452,6081640,6083404,I don't think I could.
1453,6083480,6085448,That's why it has to be your decision.
1454,6088160,6090003,"Well, l guess I just made it."
1455,6092680,6094011,"Take it easy, Matt."
1456,6103000,6104001,Come on.
1457,6112400,6114971,You know I could help you with that hand.
1458,6117560,6118561,Could you?
1459,6188560,6191643,"Shelter's gonna be closed.
Wait for me back at my place."
1460,6191920,6193126,Where are you going?
