Number,StartMilliseconds,EndMilliseconds,Text
1,60680,62120,"You need some help, man."
2,62240,64004,"Oh, God."
3,64560,66050,I don't care.
4,66160,67525,You want to mess up your own shit.
5,68640,70529,"But you're going to mess up mine, too."
6,71920,73410,I need to know you got my back.
7,73640,75881,"Not that you're going to come falling
through the door behind me..."
8,75960,78201,Don't worry your pretty little spic head off.
9,82480,85484,Anyway. That was all I wanted to say.
10,85560,86561,Is that it?
11,90600,91681,Fuck you.
12,102440,103441,Scudder.
13,154200,155531,Remember us?
14,155600,158080,"Okay, get out. Both of you."
15,158160,159440,I told you last night that we...
16,179440,180530,"Oh, my God!"
17,182760,183830,Is everybody okay?
18,185000,186206,Get down!
19,186520,187681,Get behind me! Get down!
20,187760,188761,Move it!
21,188840,190000,"- Stay low!
- Duck inside!"
22,378080,379127,"Hey, Matt."
23,381240,382366,"It's me, Peter."
24,384320,385685,"You know, Peter Kristo..."
25,385760,387364,"Oh, Peter. Hi."
26,388960,390405,"Do I know you, Peter?"
27,391160,393686,"Yeah, I led a meeting a few weeks ago."
28,395120,396724,"You know, I'm a painter,"
29,397640,399051,got hooked on smack in art school...
30,399120,400120,"Oh, yeah."
31,400160,402083,"You're the guy did the
Jackson Pollock number"
32,402160,405084,"on the wall of the john
with the blood from your..."
33,405160,406605,"- Syringe.
- Yeah."
34,406760,408762,"- Yeah, that was me.
- I enjoyed your story."
35,408840,411320,Oh! Thanks. Appreciate it.
36,412520,414090,Do you mind?
37,414160,415605,"Sure, sit down."
38,418160,419600,"Can't smoke in here, honey."
39,420680,422409,"- Yeah.
- Something wrong, Peter?"
40,424920,428083,"It's my brother, you know?
He needs your help."
41,429000,430331,What kind of help?
42,432080,434447,"I think it would be better
if you came out to Clinton Hill,"
43,434520,436090,talked about it there with him.
44,436160,437525,Clinton Hill.
45,437600,441321,"Yeah, he'll pay for your cab
out there and back, and your time."
46,441400,443528,Whether you take it or not.
47,445880,448406,"Please, just hear what he got to say,
that's all I'm asking."
48,448480,450608,"When does your brother
want to have this chat?"
49,452360,454044,"Well, you know. Right now."
50,455040,456804,"That's what I was afraid
you were gonna say."
51,456880,458560,"- Here you go, Matt.
- Thanks, Jenny."
52,458640,459880,"Yeah, I'm sorry."
53,460600,461806,You're eating.
54,463080,464650,I'll come back.
55,466000,467684,"Yeah, if you're..."
56,483160,486767,"Jenny, would you keep this warm for me, please?
I'll be back."
57,496800,498609,"Half an hour, right there on the right."
58,501240,503561,"That's it. Yeah, it's a nice place, right?"
59,507240,508890,"All right, Mr. Matt. Go on up."
60,508960,510800,"Kenny don't like me smoking
in the house, so..."
61,514240,515605,"Hey, Kenny."
62,515920,518127,Mr. Scudder. Come in.
63,525280,526441,Can I get you something to drink?
64,526520,529330,"Not a ""drink"" drink,
I know you know Peter from AA,"
65,529880,531769,"but there's coffee made,
or I can offer you a soda."
66,531840,532887,I'm fine.
67,533160,535606,"So you're a private detective,
is that right?"
68,535720,537722,"- Unlicensed.
- What's that mean?"
69,538880,541326,"It means that sometimes
I do favors for people,"
70,541440,544125,"and sometimes, in return,
they give me gifts."
71,544560,548724,"Gifts. Uh, but you used to be a cop, right?"
72,549120,551122,"Yeah, I was with the 6th Precinct"
73,551200,552326,in the Village for a while.
74,552960,555611,"And before that,
I was over here with the 75th."
75,555680,557569,So why'd you quit?
76,557960,560201,"I didn't like the hours, Mr. Kristo."
77,560280,562442,"Nah, the corruption got to you, huh?"
78,562800,564245,Not really.
79,564320,567324,"It would have been hard
to support my family without it."
80,571000,572684,"So, what can I do for you?"
81,575320,576924,"Well, this was really my brother's idea,"
82,577000,579162,"you know, bringing you out here."
83,579840,581410,"You want, I can leave."
84,581480,582606,Someone's kidnapped my wife.
85,585560,586686,That's a federal matter.
86,586760,588285,They said not to call the cops.
87,588400,590528,"Naturally they would.
When did this happen?"
88,591600,593090,Yesterday.
89,593160,594685,You should be talking to the FBI.
90,594760,596524,"- I'm talking to you.
- Look, Mr. Kristo..."
91,596600,598329,"- Kenny.
- Kenny."
92,599000,602209,"If you're asking me to run a bag,
deliver money,"
93,602280,603566,that is not something I do.
94,603640,604846,I already paid them.
95,606200,607201,When?
96,607960,608961,Last night.
97,609440,610566,How much?
98,610640,611687,"$400,000."
99,614120,615531,And your wife? Where is she?
100,616280,617645,She's dead.
101,619880,621928,"I paid them, but they killed her anyway."
102,629120,630724,I see.
103,633040,634849,"- I'm sorry.
- I don't want you to be sorry."
104,634920,638129,"I want you to find the men who did this
and bring them to me."
105,638720,640802,"You say you paid them
the 400 the same day?"
106,640880,641881,That's right.
107,644760,648367,"You mind if I ask
what kind of business you're in, Kenny?"
108,649960,651086,Construction.
109,651720,653085,What exactly do you construct?
110,653160,654161,Houses.
111,656400,659961,"Then I guess Peter's standing outside
right now because he what?"
112,660760,662762,Doesn't like your building methods?
113,663920,666605,"Peter's not supposed to associate
with people like me."
114,666680,668762,People in my profession.
115,669040,671441,Since when is drug dealing a profession?
116,672280,674248,"I mean, that's the reason, isn't it?"
117,674600,676921,"I'm sitting here and not the cops?
You're a dealer."
118,677280,680011,"Properly speaking,
I'm more of a trafficker than a dealer."
119,680080,681809,You understand the distinction.
120,682840,685127,"I really don't give a shit
one way or the other."
121,686480,688289,But whoever it was took your wife
122,688360,690886,"didn't just pick your name
out of a hat."
123,691680,694331,"They must have had some idea
you had that kind of cash on hand."
124,694400,696448,"That's exactly what I
want you to find out."
125,696520,698170,Who did this?
126,698800,700290,"Now there's $20,000."
127,700360,702089,Consider it my gift to you.
128,702160,704686,"There's 20 more, you find
the two fucks who killed her."
129,707080,708844,So that you can kill them.
130,717840,720923,"I'm sorry, but I can't help you."
131,731960,734611,"Would've been nice,
you told me what your brother was."
132,734680,735920,"Yeah, you wouldn't a come."
133,736000,737445,That's right. I wouldn't have.
134,746560,748164,I stopped drinking that day.
135,750240,752242,Just wasn't as much fun after that.
136,753760,757367,"Well, I guess I'm just a..."
137,759520,762364,"Anyway, I'm eight years sober."
138,763720,765768,And I... Well...
139,768280,770203,That's all. Thanks.
140,788880,790041,Howie.
141,790640,791721,Hurt yourself?
142,791960,793962,Found it out back by the dumpster.
143,794040,796247,Mrs. Dolgren in 202
144,796320,798721,"left it there when Mr. D
stroked out last week."
145,801400,802561,Any messages?
146,810560,812244,I never told you her name.
147,816840,819571,"I don't want you to think
that I'm cruel"
148,820720,822245,or don't care.
149,827160,828685,I just can't say it.
150,833760,834841,What happened?
151,843960,844961,Hey
152,845080,846081,Hello?
153,848080,850686,"Carrie Anne, what's your game now?"
154,850760,851841,Hello?
155,851920,853604,"She never came home, right?"
156,855040,856041,Excuse me?
157,856280,857964,"We've got your wife, fucko."
158,864160,865366,Carrie?
159,871760,872966,Carrie?
160,875280,876725,"Baby, you up there?"
161,889040,890201,What is it you want?
162,890640,893769,"We want to help you get your wife back.
If you want her back, that is."
163,893840,895171,Of course I want her back.
164,895240,897049,"Good. Then stay by the phone,"
165,897160,902121,"don't call the police,
and we'll be in touch. Very soon."
166,902560,905006,"It was maybe 10 minutes
before they called again."
167,905080,907082,"How much does your wife weigh,
Mr. Kristo?"
168,908280,910328,"110, 120?
Somewhere in that neighborhood?"
169,910400,913165,"Something like 50 kilograms,
you might say?"
170,914480,918769,"Now 50 keys, at 20 a key,
run the numbers for me."
171,920760,922171,"Comes out to a million, doesn't it?"
172,923120,924167,What's your point?
173,924520,925646,My point?
174,926840,931004,"My point is that you'd pay a million for her
if she were product."
175,931680,934126,"If she was powder, Mr. Kristo."
176,934200,936248,"Isn't she worth as much to you
in flesh and blood?"
177,936440,938204,I can't pay what I don't have.
178,938920,940004,How much do you have?
179,943360,944361,Four hundred.
180,944520,945521,"Five.

181
00:15:45,680 --> 00:15:*****9
I'm not haggling.
I gave you the top figure right away."
181,947560,948561,It's 400.
182,948960,950041,"Oh, well."
183,950960,954806,"That's the best you can do.
Okay. Four hundred it is."
184,955240,958050,"Before I give you anything,
I want to make sure my wife is all right."
185,958280,960806,"Well, that's impossible.
I'm at a pay phone."
186,960920,963000,"How do I even know you've
got her in the first place?"
187,963040,964644,Are you familiar with her tits?
188,964720,965767,Excuse me?
189,965880,968326,"They're quite nice.
Would you recognize one of them?"
190,968560,971245,"That would be the easiest way.
I could cut one off."
191,972280,973645,The one with the cute little mole on it.
192,973720,975080,And I'll leave it on your doorstep.
193,975240,976520,Would that put your mind at rest?
194,976560,977686,"Jesus, don't say that."
195,977760,981401,"All right, then let's not talk
any more about proof, okay?"
196,982440,984727,Put the money in two hefty bags.
197,985440,987727,"Go to the corner of
Columbia and Commerce"
198,987880,990770,to the pay phone and wait for my call.
199,1000680,1001681,Hello.
200,1002040,1003087,Where's the money?
201,1003160,1005162,"In the back seat.
Two bags, like you said."
202,1005520,1009923,"Good. Now leave it.
Walk up Columbia to Richards Street."
203,1010760,1011761,And then what?
204,1012160,1014208,"Wait on the corner for five minutes,"
205,1014280,1017170,"then walk back,
get in your car and go home."
206,1018480,1019925,"Well, what about my wife?"
207,1020840,1022922,"She'll be in the car
waiting for you."
208,1030560,1031800,Carrie?
209,1035240,1036241,Fuck.
210,1046800,1048689,"And they run me around, then finally"
211,1048760,1051206,"they tell me she's at home,
waiting for me."
212,1051600,1053568,I go home and she's not there either.
213,1053680,1054886,Carrie!
214,1060480,1061891,The phone rings again.
215,1061960,1063121,"Fuck!

217
00:17:*****0 --> 00:17:48,481
Where is she?"
216,1068880,1070848,They send me over to Red Hook.
217,1072040,1075328,"Tell me she's in the trunk
of this abandoned car."
218,1116440,1119046,They taped this to the inside of the trunk
219,1120200,1123682,"with a note that said
""for your listening pleasure."""
220,1135760,1137410,That's my number.
221,1149960,1150961,It's okay.
222,1151720,1154326,Look at these. Look at these.
223,1155800,1158040,I touch them and the nipples get hard.
224,1160080,1162401,"You get hot even when you're scared,
don't you?"
225,1164920,1166285,And kiss me.
226,1167680,1171366,"Yeah. Come on,
let's take the tape off of her."
227,1173120,1175885,"Hey, Carrie Anne"
228,1176520,1177720,Can anybody...
229,1184840,1185841,Yes?
230,1188080,1189605,Where in Red Hook?
231,1218440,1219885,"She tipped me $2, which is twice"
232,1219960,1222327,"what anybody else tips,
if they even tip at all."
233,1222800,1223881,You mentioned a van.
234,1224040,1225280,Yeah. It was parked right there.
235,1226320,1227685,Two guys got out of it.
236,1227760,1230240,"I remember they checked her out
pretty good."
237,1230320,1232440,"They were both dressed the same,
some kind of uniform."
238,1235120,1236804,"They pulled out after Mrs. Kristo,"
239,1237360,1238646,cut off a Caddy.
240,1240440,1242249,"- You remember what the van looked like?
- Yeah."
241,1242840,1245571,"It was light blue.
It was definitely light blue."
242,1247320,1248526,I could tell she was a good cook.
243,1248640,1250369,Nothing frozen in her cart.
244,1250600,1252090,"She said she was making Kunafa,"
245,1252160,1254160,"so I sent her to the Lebanese place
down the block."
246,1254200,1256043,"Yeah, the van was parked across the street."
247,1256120,1257884,I thought they were making a delivery.
248,1257960,1259246,I don't remember a van.
249,1259360,1262045,"I do remember the pita maker,
Mrs. Youness, came in"
250,1262120,1265203,"and was all like,
""Oh, what happened? Are we okay?"""
251,1269200,1270929,She saw two men and a woman
252,1271040,1274726,"run across the street away from the store
and leap into a van."
253,1274800,1276962,"She thought they had
just robbed the store."
254,1277040,1278041,Two men?
255,1279880,1280927,Yeah.
256,1281000,1283571,"I think it had the name of a
TV repair place on the side."
257,1283640,1286246,"TWO initials, like B & R TV."
258,1287120,1288281,For sure. J & M Heating.
259,1289600,1290647,R & L Stereo.
260,1290720,1292563,B & A Appliance.
261,1364600,1366250,"TJ, I'd like a word with you."
262,1367160,1368571,"Now, please."
263,1373800,1375450,I know you've been sleeping here.
264,1375880,1376961,Shit.
265,1378360,1380806,I know because Mr. Keyser
266,1380880,1383645,"says you left a god-awful mess
in the men's room."
267,1385640,1388484,Not to mention the mess you've left here.
268,1390240,1391241,"TJ, you've got to..."
269,1391320,1394210,"He'll clean it up later, okay?"
270,1395000,1397207,Right now he's helping me with something.
271,1405680,1408524,"You get back issues of all
the New York papers on there?"
272,1409400,1410401,For what?
273,1411440,1412441,"Naw, I'm good."
274,1413200,1414406,Can see from right here.
275,1414960,1418089,"Not the first old white dude,
come in here,"
276,1418160,1419400,try to put a hand on me.
277,1420040,1421041,Okay.
278,1433360,1434521,Child of God.
279,1436920,1437921,What?
280,1438360,1441364,"The name. Gotteskind.
It means ""child of God."""
281,1441560,1442561,It's German.
282,1445960,1447564,"Except, clearly,"
283,1447640,1449449,God never looked out for Marie.
284,1462160,1465562,TJ? That short for something?
285,1466200,1468009,"Yeah, it's short for ""TJ."""
286,1471720,1472720,You 5-0?
287,1472760,1473761,Nope.
288,1473960,1475080,'Cause you've got that look.
289,1475360,1476361,I work private.
290,1477760,1480445,Yeah? Like Sam Spade?
291,1480560,1481891,"Yeah, just like him."
292,1482960,1486282,"What I'm saying is, I read about him.
And Marlowe, too."
293,1486440,1487726,All of those guys.
294,1487960,1489246,You spend that much time in here?
295,1489440,1492523,Some. Mostly when it rains.
296,1492600,1494120,"Just like the sound it makes, you know?"
297,1495400,1496401,Matt.
298,1497600,1498601,Short for Matthew.
299,1500640,1503564,"So why you looking at dead bitches, Matthew?"
300,1536360,1538522,"So these guys we're looking for,
they be like"
301,1538640,1540881,"real 730, or just, like, thugs?"
302,1541120,1542201,Like real what?
303,1542680,1546207,"730. It's the time they give out the meds
in a mental ward."
304,1547080,1548489,Right. 730.
305,1549200,1552044,Can that program go back another year?
306,1552120,1554487,"Listen to you. ""That program."""
307,1554960,1556644,Take you maybe a minute to figure out
308,1556720,1559166,how to work Yahoo all by yourself.
309,1559480,1560811,Why bother?
310,1560880,1563724,"From what I hear,
it's all going to shit in six months."
311,1563800,1564801,"Please, please, man."
312,1564880,1566564,I got way more important things to do
313,1566640,1569325,than worry about all that Y2K bullshit.
314,1571520,1572646,How ironical.
315,1573360,1574361,What's that?
316,1574640,1577166,Dumping an already dead body at a cemetery.
317,1577760,1579728,Tuesday. The body of Leila Andresen
318,1579800,1582770,"a 25-year-old Interior Design
major at Brooklyn College"
319,1582840,1585002,was found at Green-Wood Cemetery.
320,1585080,1588163,"Andresen had been missing two days
when Eduardo Solomon,"
321,1588640,1590802,"florist across the street from the cemetery,"
322,1590880,1592405,found what was later identified
323,1592480,1594209,as a portion of the victim's leg
324,1594360,1595930,in the dumpster behind his shop.
325,1596840,1599207,"That same day, more human remains were found"
326,1599280,1602011,"scattered about the cemetery
by a groundskeeper."
327,1603000,1605048,Witnesses say Andresen was last seen
328,1605120,1607248,"getting into a blue van
with three men."
329,1611160,1613527,"Andresen's fiancé, Reuben Quintana,"
330,1613600,1616444,"told police that he and Leila
were supposed to meet up for lunch."
331,1617600,1618806,But she never showed.
332,1619760,1620761,Good guess.
333,1621080,1622491,Thanks for your help.
334,1623040,1625088,"- What's this?
- What's what?"
335,1625880,1627370,"My time is valuable, man."
336,1627880,1629370,How valuable?
337,1633280,1634645,Ten bucks.
338,1637080,1638809,Here's $20. Take it easy.
339,1644240,1646686,I'm going to go get something to eat.
340,1651080,1652320,Want a hamburger or something?
341,1654240,1655401,I don't eat meat.
342,1657000,1659480,"Okay. Nice meeting you, TJ."
343,1662280,1665602,"What I'm saying is,
I don't care nothing about cows."
344,1666160,1668288,"I just care about
what I put inside my body."
345,1668400,1671768,"No meat, no soda, no Pringles,
none of that shit."
346,1672600,1675206,"But I was thinking about getting
a little eat on myself."
347,1675440,1678762,"All right. So we can both
get our eat ons together."
348,1679160,1680161,Come on.
349,1684840,1686080,"Come on, Watson."
350,1727040,1728246,Where do you sleep?
351,1728640,1730802,Those nights you can't hide in the library?
352,1732480,1733970,There's places to stay.
353,1735000,1736570,What happened to your parents?
354,1737480,1739164,You don't gotta feel sorry for me.
355,1739880,1740881,I don't.
356,1741480,1742481,Good.
357,1745480,1748324,"You could hire me, though.
Make me your partner."
358,1748400,1750243,I don't think so.
359,1750320,1752766,"Why? You don't think I got what it takes
to be a good detective?"
360,1752840,1755684,"I'm sure you do.
I'm just not the partner type."
361,1758360,1760840,"What does it take to be
a good detective anyway?"
362,1760920,1762081,A strong bladder.
363,1763040,1764041,Seriously.
364,1765400,1766845,I don't know what it takes.
365,1767680,1772607,"I don't know. Patience. Instincts.
Uh, blind luck, mostly."
366,1773520,1776649,"And a good name.
A good name is very important."
367,1776720,1780964,"One with real flavor like
Sam Spade or Philip Marlowe."
368,1781040,1783122,What's wrong with the name you got?
369,1783200,1784964,"I don't know, man."
370,1785040,1786849,Thinking something more like
371,1787680,1789091,Daunte Culpepper.
372,1789960,1791644,Quarterback for Minnesota?
373,1793440,1794771,"It's a good name for a detective,"
374,1794840,1797241,"but a lame-ass name for a guy
who plays football."
375,1798480,1800050,Daunte Culpepper.
376,1800920,1804641,Yeah. Daunte Culpepper. Private eye.
377,1805720,1807324,Now I like that name a lot.
378,1808160,1810322,"Sure you don't want a soda
or something, honey?"
379,1811480,1814051,"I know you just love to give
a young black man like myself"
380,1814120,1815610,one of your sperm-killer sodas.
381,1815680,1818081,"But no thank you, ma'am.
I'll just stick with the water."
382,1823240,1826289,"What? They only give sodas
to low-income people."
383,1826360,1828681,"With a bunch of chemicals in them
to sterilize you."
384,1828760,1830364,That's why I only drink water.
385,1830440,1832169,A gallon a day and stay hydrated.
386,1832840,1834001,You don't eat meat?
387,1834920,1836524,"Yeah. So what.
You got a problem with that?"
388,1836600,1839126,"Not at all.
My ex-wife, she was vegetarian."
389,1839480,1841403,So what happened? Why'd you split?
390,1841800,1842881,What was she? A clucker?
391,1843080,1844081,A what?
392,1844160,1845924,A clucker. Chickenhead.
393,1846000,1848128,"You know, those females that only like you"
394,1848240,1849446,if you give them nice things.
395,1849520,1851682,"If you ain't bling-blinging,
you ain't seeing shit."
396,1852040,1853280,Can't you speak English?
397,1853840,1855808,Hit a nerve. Sorry.
398,1856840,1858205,Wait a minute. What time is it?
399,1858840,1860330,"- Almost 10:00.
- Shit."
400,1860400,1863324,"I gotta get back to the shelter.
It closes at 10:00."
401,1863400,1864925,"Uh, thanks for the pancakes."
402,1947480,1948481,Jonas Loogan?
403,1949320,1950367,Yes?
404,1950440,1951726,You're the gardener here?
405,1953040,1954724,"I'm the groundskeeper.
Can I help you?"
406,1955160,1957128,"- I'm Matthew Scudder.
- Whoa!"
407,1957520,1960364,"That was fast.
Public affairs lady at the 77th"
408,1960440,1962488,"said it would be at least a week
before anyone got back to me."
409,1962840,1963841,Excuse me?
410,1964000,1965968,"I just really want the book
to have an authentic feel, you know?"
411,1966040,1967041,Book?
412,1967120,1969088,"That's why this ride along
is so important to me, you know?"
413,1969160,1970605,Spend some real time with real cops?
414,1975800,1976801,What do you want?
415,1976880,1979201,"I was hoping I could talk to you
about Leila Andresen."
416,1980200,1981201,Who?
417,1981520,1983329,The woman they found over here.
418,1984200,1986646,"Yeah, I don't know anything about that."
419,1986720,1988961,"Your boss tells me
you were here that day."
420,1989600,1991364,"- You spoke to Larry?
- Yeah."
421,1991560,1993927,"Great. 'Cause my boss is Gretchen, okay?"
422,1995040,1997008,"Oh, boy. I messed up."
423,1997840,2000241,"You're too smart for me, Jonas. Damn."
424,2001440,2002646,Think you can help me anyway?
425,2003280,2005089,"Already told everything I know
to the police."
426,2006120,2008441,"Eduardo. Guy who owns
the shop across the street,"
427,2008520,2010363,"says there were about 20 garbage bags
that were here."
428,2010440,2011441,That true?
429,2011520,2013443,"Eduardo was wrong.
There were only about 10."
430,2013520,2015807,"And most of those were on
the Fifth Avenue side."
431,2015880,2018167,"And there were four more
floating in the pond down there."
432,2018800,2020131,So you saw them?
433,2021160,2022650,I saw the pigeon first.
434,2023720,2025210,Keep a coop on my roof.
435,2026320,2027526,This was a Helmet.
436,2027600,2028647,It was alone.
437,2028720,2030484,"Which, if you know anything at all
about Helmets,"
438,2030560,2032369,is quite unusual for that breed.
439,2032440,2033851,It was sitting on one of the bags
440,2033920,2036321,trying to get at whatever was in there.
441,2036400,2037970,"I just fished them both out
after I was done"
442,2038040,2039326,with the mowing and threw them away.
443,2039400,2040640,You didn't open them?
444,2041640,2045167,"No. I figured it was all
just some waterlogged trash"
445,2045240,2048084,"that kids had thrown in there
the night before."
446,2048160,2049889,"They do that, you know?"
447,2049960,2052167,"Throw their rubbers and their empties
into the pond."
448,2053920,2055843,You see the cops across the street?
449,2055920,2057684,"Yeah, but I didn't make that connection"
450,2057760,2060240,"until Vince came running over
from the Fifth Avenue entrance."
451,2060320,2061731,Vince.
452,2061800,2063768,"Yeah, he's the other groundskeeper."
453,2063840,2065171,He's the one that found the bags over there.
454,2065400,2067448,"Is Vince around?
I'd like to talk to him."
455,2067560,2068561,He quit.
456,2069240,2070810,He opened one of the bags.
457,2075000,2077480,"You know, I was just starting
to forget about her."
458,2078160,2080845,Thank you so much for bringing that all back.
459,2080920,2082206,What's your book about?
460,2083400,2085084,Don't patronize me.
461,2175920,2177490,"Yo, Matt, what's the dealie, man?"
462,2177560,2178560,"Hello, TJ."
463,2178600,2179681,You know I been shadowing you.
464,2179760,2180841,No kidding.
465,2180920,2183491,"Alright. So, ""I followed subject back"
466,2183560,2185449,"""from dinner to a meeting at some church."""
467,2185920,2187285,"Used to drink some, huh?"
468,2189120,2192203,"""I then followed subject back to some
shitty-assed building on 45th"
469,2192280,2193611,"""where subject remained until..."""
470,2193680,2195250,"I know where I was, TJ."
471,2196880,2198689,"You made me at that flower shop, didn't you?"
472,2198800,2200643,I made you back at the subway.
473,2200760,2201886,Damn.
474,2201960,2203883,"This book I'm reading
says a foot tail is hard"
475,2203960,2206008,to do on account of they're so easy to spot.
476,2206080,2207127,That it is.
477,2207240,2208810,It says it's good to use three guys.
478,2208920,2210251,Two alternating behind and another guy
479,2210320,2211367,on the other side of the street.
480,2211440,2213090,Sure. If you have three guys.
481,2213960,2215405,You know you spend a lot of time
482,2215480,2217562,at churches and you use a lot of payphones.
483,2217640,2218971,So?
484,2219080,2220411,So you don't got no cell phone?
485,2220480,2221481,I don't like them.
486,2221560,2223483,"You don't like computers
and you don't like cell phones."
487,2223760,2226286,"Fucking Amish got more flavor
than you do, Matthew."
488,2227160,2228685,"You know, l watched you follow some dude,"
489,2228760,2230205,you didn't even try to hide or nothing.
490,2230280,2231805,He wasn't looking for me.
491,2231880,2234281,"Funny. Me following you
while you following some other guy."
492,2235160,2236491,It's real ironical.
493,2246840,2248171,"- TJ?
- Yeah?"
494,2248240,2249321,Stop following me.
495,2254160,2256447,Okay. No. No.
496,2258160,2259366,Reuben Quintana?
