Number,StartMilliseconds,EndMilliseconds,Text
1461,6193200,6194281,Just do as I say.
1462,6205400,6209246,"Step 10. Continue to take
personal inventory."
1463,6209360,6212125,"And when we were wrong,
promptly admitted it."
1464,6213120,6214121,Step 11.
1465,6214800,6216802,Sought through prayer and meditation
1466,6217320,6221006,"to improve our conscious contact with God
as we understand him."
1467,6221160,6223322,Praying only for the knowledge of his will
1468,6223400,6225971,"for us and the power
to carry that out."
1469,6227640,6232521,"Step 12. Having had a spiritual awakening
as the result of these steps,"
1470,6233160,6235891,we try to carry this message to alcoholics
1471,6236160,6239642,"and to practice these principles
in all our affairs."
1472,6272960,6274166,Kenny?
1473,6460000,6461001,"You know,"
1474,6463080,6464366,I just wanted to...
