Number,StartMilliseconds,EndMilliseconds,Text
497,2259440,2260480,I help you with something?
498,2260880,2262291,My name is Matt Scudder.
499,2262360,2264641,"I was wondering if I could talk to you
about your fiancée?"
500,2264680,2266682,"- Fiancée?
- Leila Andresen?"
501,2266920,2268070,"Oh, Leila."
502,2268640,2270244,"You know, I kind of have this other place
I have to be..."
503,2270480,2271561,I'll just be a minute.
504,2272520,2273681,"Yeah, okay."
505,2275520,2276521,"Yeah, come on in."
506,2278520,2280090,I get you something to drink?
507,2280160,2281571,"No, thank you."
508,2283240,2286369,"It must be nice, have the time to work out
in the middle of the day."
509,2286680,2288011,I'd rather be working.
510,2288200,2290680,Period. I'm an actor.
511,2291200,2293328,"Yeah, I thought you looked familiar."
512,2293400,2295209,Have I seen something you've been in?
513,2295320,2297049,Maybe. I did a Stetson commercial.
514,2297120,2298121,Few years back.
515,2298200,2299200,"Stetson, the hat?"
516,2299240,2300241,"No, the cologne."
517,2301260,2303206,Ran during the Stanley Cup Finals.
518,2303320,2304765,Missed that one.
519,2307040,2308883,"Leila went to Brooklyn College,
is that right?"
520,2309200,2310486,Studied decorating?
521,2310560,2311891,Interior design.
522,2312200,2313201,Right.
523,2314320,2317005,"You told the police
that it was three men took her."
524,2317080,2318081,"Yeah, that's right."
525,2318200,2319440,You're sure about that?
526,2319520,2321249,Yeah. I saw them.
527,2322000,2324480,I was at this coffee place on Prospect...
528,2324560,2326642,She used to meet me there sometimes.
529,2326760,2329923,"...when I see two guys jump out
of the van and grab her."
530,2332320,2333321,What'd they look like?
531,2333720,2335040,I couldn't really see their faces.
532,2335200,2337407,"But I could see a third guy
behind the wheel."
533,2339600,2340601,Move!
534,2341400,2343528,Hey! What the fuck are you doing?
535,2344000,2345240,That's the last time I saw her.
536,2346160,2347446,This is a nice place.
537,2347760,2349205,Lots of nice stuff.
538,2349360,2350725,Leila do the design?
539,2350920,2353207,"Yeah. You should see the bedroom, it's..."
540,2354720,2356404,"Wait, I... That didn't sound right."
541,2357400,2359368,"You don't deal, do you, Reuben?"
542,2359560,2361050,"- What?
- You heard me."
543,2361280,2362520,"You asking, am I a drug dealer?"
544,2362600,2364011,Unless you prefer trafficker.
545,2364680,2366125,Or maybe you wanna tell me you made
546,2366200,2368202,your money peddling cologne on ESPN.
547,2368280,2369281,I got a trust fund.
548,2370120,2372122,"- From your rich family up in the Bronx?
- Yeah."
549,2372360,2373930,My mom won a lawsuit a few years back.
550,2374040,2377647,"Hey, come on, Reuben,
not even the dog's dumb enough to buy that one."
551,2378880,2381611,"Look, I don't care
how you earn your living."
552,2381680,2384365,"But the guys who grabbed Leila?
They might have."
553,2384800,2385801,How do you mean?
554,2390040,2391041,How do you mean?
555,2391320,2392446,Thanks for your time.
556,2395320,2396651,Thank you.
557,2417280,2420284,Jonas? Did you forget your key again?
558,2453240,2455129,"What the hell is going on?
Cops showing up"
559,2455200,2456964,to my house asking about Leila.
560,2457240,2458651,Who the hell is this guy?
561,2508320,2510527,"""He carried her through the field,"
562,2511600,2514922,"""the dandelions and cattails
still wet with morning dew,"
563,2515680,2517205,"""and set her down by a stream,"
564,2517960,2519564,"""whispering through the strands"
565,2519640,2521529,"""of her fine yellow hair,"
566,2522080,2525050,"""'You're safe now. You're safe.""'"
567,2527280,2528441,Fuck.
568,2566480,2567641,Jonas.
569,2571480,2572481,You caught me.
570,2574800,2577406,"You gave the cops a different address,
didn't you?"
571,2577960,2580327,"That's why they never put you
across the street from Leila."
572,2582680,2584887,This is my mother's building.
573,2584960,2588203,"I live in Sunset Park,
but I'm not allowed to keep my birds there."
574,2588280,2590203,Even though there's room on the roof.
575,2592000,2593843,"Your mom home right now?
Maybe we could"
576,2593920,2595763,"go down and talk,
have a cup of coffee."
577,2597680,2599205,I can't let you leave here.
578,2600040,2601690,They'll kill me if I do.
579,2601760,2603046,"Who's ""they,"" Jonas?"
580,2603160,2604161,The other two.
581,2604720,2607724,"So what, you gonna stab me now
with that big fucking knife?"
582,2609840,2612491,"It's gonna bother me, too.
For a long time, I know it will."
583,2612720,2614006,How much is it gonna bother you
584,2614080,2616447,"I take that knife away
and stick it in your neck?"
585,2617520,2618567,Could you really do that?
586,2618880,2620291,"Yeah, I really could."
587,2620440,2621805,But I'd rather not.
588,2622840,2624046,How about instead we trade?
589,2626200,2627247,Okay.
590,2627320,2628321,Set it down.
591,2638320,2639765,What was it I said that gave me away?
592,2639920,2642446,"Everything. You're a weirdo, Jonas."
593,2642840,2645047,I never laid a hand on Leila.
594,2646600,2648920,"But the other two,
they're the ones you better worry about."
595,2649000,2650240,What other two?
596,2653960,2655121,Jonas.
597,2657480,2659050,What other two?
598,2666320,2667606,They're not human.
599,2670400,2671526,How'd you meet them?
600,2677080,2679401,There's this video store near my house.
601,2680280,2681880,"They've got this basement
where they keep"
602,2681920,2684924,some of the more specialized stuff.
603,2686400,2687925,Always came in together.
604,2689600,2692080,"You wouldn't really notice them
unless they spoke to you."
605,2692720,2695929,"One of them had a beard, or a goatee."
606,2696760,2699809,"The other one smiled a lot.
He did all the talking."
607,2700520,2701521,What about names?
608,2701960,2704964,"You don't exchange names
in a place like that."
609,2705560,2706641,Not real ones anyway.
610,2707280,2710887,"They loved that I worked in a cemetery.
Thought it was funny."
611,2710960,2711961,Wanted to buy me drinks.
612,2713560,2716040,"So we went to this bar
in the middle of the day."
613,2716120,2717884,Drank rum and Coke.
614,2717960,2720201,Talked about the different videos we liked.
615,2720320,2722402,"It was all one big laugh to them,"
616,2722480,2725051,"watching all the drug addicts
fuck each other."
617,2725120,2727441,"They were, like, obsessed
with that whole world."
618,2727640,2730007,"Dealers, addicts, different kinds of drugs."
619,2731960,2733450,They told me they worked with the DEA.
620,2733840,2734841,They were cops?
621,2735160,2736491,They wouldn't say for sure.
622,2737800,2739325,They said what they did was secret.
623,2741440,2743602,"But they had one of those
police radios, you know?"
624,2744320,2746209,One of those handheld units.
625,2746280,2749682,"And they had all these files on drug dealers
with DEA stamps on them."
626,2749880,2751769,Told me they worked on special assignments.
627,2752200,2753326,You told them about Reuben.
628,2753960,2755928,I told them about Leila.
629,2756640,2758529,About how I wanted to save her from Reuben.
630,2759280,2761567,"So we came up here.
We watched them for a while."
631,2763320,2765527,"They said they wanted to help her, too."
632,2766520,2768443,So you followed her?
633,2768520,2769800,You picked her up off the street.
634,2771520,2772521,Then what?
635,2772680,2775843,"We drove around with her.
We finally parked somewhere."
636,2776080,2777320,Near the water in Brooklyn.
637,2777720,2779722,"Said they wanted to make
their own video."
638,2780680,2782045,She was really scared.
639,2782240,2783366,They loved that.
640,2791320,2793209,You dirty little girl.
641,2796840,2798205,They kept talking to her.
642,2798560,2800210,Pick one. Which one's your favorite?
643,2800520,2802329,"Eeny, meeny, miney, moe."
644,2802400,2805449,"You pick the one that you want to keep,
and I'll take the other."
645,2805920,2809561,"One for you, one for me.
That's fair, isn't it?"
646,2810200,2812931,"Well, you better pick one,
or I'm going to take them both."
647,2813440,2816364,"Come on, what are you waiting for?
You trying to stall?"
648,2816440,2817601,You trying to make me mad?
649,2818040,2820202,Touch the one that you want to keep.
650,2820520,2821521,This one?
651,2821920,2822921,"Okay, good."
652,2823240,2824810,I think that's an excellent choice.
653,2824920,2828606,"Okay, that's ones yours,
and this one is mine."
654,2829240,2832084,A deal's a deal. No take backsies.
655,2837920,2839524,"But then two days later,"
656,2839600,2841120,"I think they thought it would be funny,"
657,2841200,2844090,"I show up for work
and there's garbage bags everywhere."
658,2845120,2847122,They knew I'd never say anything.
659,2847240,2849242,"Where was this video place
you met these two?"
660,2849440,2850726,It moves around a lot.
661,2850920,2852365,Might still be there. Who knows?
662,2852440,2853441,How do I get in?
663,2853800,2854926,It helps if they know you.
664,2855280,2856566,What if you come with me?
665,2861640,2863688,Can I feed my birds first?
666,2881840,2882921,Ray.
667,2883480,2884845,What was that?
668,2886920,2888410,That was his name.
669,2888480,2890960,"Which one? The quiet one, or the..."
670,2896800,2897926,Jesus.
671,2905280,2908921,"I was off-duty one day
in this bar in Washington Heights"
672,2909000,2911321,"where cops didn't have
to pay for their drinks."
673,2912480,2915131,"And a couple of guys came in
to rob the place."
674,2916160,2918891,"I chased them into the street,
shot two dead,"
675,2919880,2922008,got a third one in the leg.
676,2922680,2924284,He'll never walk right again.
677,2926280,2928601,Yeah. I quit drinking that day.
678,2930840,2934401,It just wasn't as much fun after that.
679,2998920,3001764,People are afraid of all the wrong things.
680,3031120,3032406,I'll be right back.
681,3089520,3092000,"I wonder if he'd pay
as much for the nurse?"
682,3093800,3095848,"We made a mistake.
Come on, let's go."
683,3102320,3103321,"Wait, wait."
684,3154960,3156962,They work for the fucking DEA?
685,3157040,3160123,"Probably not for very long
and almost certainly not as agents."
686,3160240,3161240,Then what were they?
687,3161280,3162327,I don't know.
688,3162400,3164289,"Maybe they were used
as confidential informants"
689,3164360,3165885,"or maybe they were office staff.

692
00:52:45,960 --> 00:52:*****5
Whatever they were, they couldn't have"
690,3167600,3169329,gone very far or lasted very long.
691,3169400,3172165,"- Why not?
- Because they're insane."
692,3172240,3174163,"They managed to get their hands
on some files."
693,3174240,3175605,One of which had my name on it.
694,3175880,3177644,"And if my name's on a DEA file,"
695,3177720,3178926,"that means I'm being looked at, right?"
696,3179080,3180650,Or you were at one time.
697,3181880,3183962,"You know a lot of people,
do what you do?"
698,3185080,3188766,"It's not like we have a union or anything,
but I know a few. Why?"
699,3188880,3191451,"I want you to call them
and tell them what happened to Carrie."
700,3191560,3192527,Tell them you've hired a...
701,3192600,3194170,Are you fucking kidding me?
702,3194640,3196520,"Word gets out about Carrie,
cops are gonna be..."
703,3196600,3198170,They've done this before.
704,3198240,3199605,And they're gonna do it again.
705,3199720,3201290,This time I wanna hear about it.
706,3201920,3203126,What do I say?
707,3204080,3205525,You'll think of something.
708,3207120,3208281,I could have paid them.
709,3210440,3211851,I had the whole million.
710,3214080,3215161,It was our nest egg.
711,3215240,3217447,"You know, the money I was gonna use
to get out."
712,3217520,3220444,"And this guy I know,
he was gonna put me into some Internet startup,"
713,3220520,3222170,sell shoes online or some bullshit.
714,3222320,3224607,"It was our future
and I didn't want to give it to them."
715,3224680,3226444,Now how fucking stupid is that?
716,3226800,3228131,She was already dead.
717,3229160,3231811,"If she wasn't,
they would have killed her anyway."
718,3232480,3233845,Call your friends.
719,3287000,3288047,Gotteskind?
720,3289120,3290963,I just knew her as Marie.
721,3291680,3293728,Jacinto. My man.
722,3294880,3296530,You know where it is.
723,3299160,3300571,She lived around here?
724,3301560,3302641,She worked around here.
725,3302720,3303767,Where?
726,3303920,3305160,On the corner.
727,3306160,3308606,"No, no, your mama likes the one percent,
not the two."
728,3310520,3311601,She was a dealer?
729,3314400,3316482,"She worked out of a crib
not too far from here,"
730,3316560,3317891,if you know what I mean.
731,3326960,3328610,See that old building down the block
732,3328720,3330290,with the vacuum repair on the ground?
733,3405040,3406041,Hola.
734,3408480,3409925,"All right, tell me, cocksucker,"
735,3410000,3411411,what do you want with Marie G?
736,3415560,3416846,"You on the job, fucker?"
737,3417360,3418361,Retired.
738,3418440,3420124,"Who you working for, the family?"
739,3420760,3423570,"Shit. When are you guys
gonna leave it alone, huh?"
740,3423640,3424687,"We didn't do it, okay?"
741,3424760,3425761,Okay.
742,3425840,3427126,You think we'd just chop up a cop
743,3427200,3429089,and leave her on our own fucking doorstep?
744,3429160,3431640,"My son's a fucking moron
but he's not an idiot."
745,3433320,3434651,Wait. Marie was a cop?
746,3436160,3437161,Who are you?
747,3438120,3440521,"I'm not after you.
Or your son."
748,3442840,3444126,I want...
749,3446600,3449171,I want the guys that killed Marie.
750,3449240,3450844,Not if I kill 'em first.
751,3452480,3454289,You dealing outta the store?
752,3454360,3455361,Not anymore.
753,3456560,3458164,But she was working you?
754,3458880,3461406,Working him?
755,3461520,3462965,Fucking moron wanted to marry her.
756,3463840,3465285,That's how good she was.
757,3474560,3476369,"Hello, my name's Peter."
758,3476920,3480163,"I'm an alcoholic and still a drug addict,"
759,3480240,3481765,and I got one day back.
760,3481960,3483086,"Hi, Peter."
761,3483280,3485647,"It's good to see
all the friendly faces again."
762,3485720,3487961,"Still haven't managed
to turn your back on me."
763,3490600,3491681,"So I slipped, you know?"
764,3491800,3493006,It happens.
765,3493080,3495242,"The funny thing is I didn't start using
until I was 28."
766,3495320,3496321,Yeah?
767,3496400,3498209,"Up until then,
I never even smoked a joint."
768,3498280,3499770,"Even when I was overseas, you know,"
769,3499840,3501444,half my unit was on one thing or another.
770,3501560,3502846,You were in the army?
771,3502920,3504922,"Yeah, I was in Germany,
then Desert Storm."
772,3505600,3507682,"I come home, go back to school,"
773,3507760,3509000,"and me and Kenny, we start dealing."
774,3510160,3512527,"Just enough to get by.
It was more Kenny's thing."
775,3513920,3515126,He was dealing in college.
776,3515240,3516685,I do it to pay for art school.
777,3516760,3518364,Wind up getting hooked on the product.
778,3518440,3519646,Drop out.
779,3519720,3521449,"Meanwhile, Kenny, he stays in the business,"
780,3521520,3523124,starts making some real money
781,3523200,3526443,"while I'm eating garbage
and sleeping in abandoned buildings."
782,3526520,3529808,"Till one night I nearly blew
my fucking heart out of my mouth up in Harlem."
783,3529920,3531081,What are you gonna do now?
784,3531720,3534166,I got this job as a bread maker.
785,3534240,3536925,"Figure stay busy at night,
sleep during the day."
786,3537000,3538240,Get in less trouble.
787,3540520,3541806,All right. See you around.
788,3541880,3542881,Take it easy.
789,3543040,3546160,"The number you have reached
is not in service. Please check..."
790,3548280,3549327,Directory assistance.
791,3549480,3553201,"I'd like the number for the
East Village Plumbing, please."
792,3553320,3554320,What borough?
793,3554360,3555725,I assume it's the East Village.
794,3555800,3556881,One moment.
795,3557640,3559608,"- No listing in Manhattan.
- Try Brooklyn."
796,3560440,3561646,Nothing in Brooklyn either.
797,3561720,3562881,Try all the boroughs.
798,3564520,3565726,"I'm sorry, we have no listing."
799,3565800,3567006,Thanks.
800,3588720,3589960,What happened to you?
801,3590040,3591849,"I bumped into something.
You okay?"
802,3593000,3594001,I'm fine.
803,3594760,3596762,"- What you got there in your backpack?
- Nothing."
804,3597000,3599890,Just my notebook. Some Twizzlers.
805,3599960,3601640,"Unless you're talking
about my pencil case."
806,3601840,3604764,"No. I'm talking about the black Beretta
with the taped grip"
807,3604840,3606444,"you got tucked beside
your water bottle."
808,3608840,3609841,You mean this.
809,3610400,3611481,My new jammie.
810,3614400,3615526,It's a nice one.
811,3615600,3617284,What are you planning on doing with it?
812,3617360,3619886,"I don't know, man.
Right now it's just for protection."
813,3619960,3623328,"Figure, I'm gonna be a detective,
I need a piece."
814,3624080,3625403,Where'd you get it?
815,3625480,3627642,I was just taking a nap in some alley.
816,3628320,3630641,"Heard some footsteps.
I seen some dude who works"
817,3630720,3632245,as a lookout for some ballers.
818,3632320,3634891,"He just threw the bag
in a dumpster and split."
819,3635880,3637450,You stole someone's stash?
820,3638440,3641410,"I didn't steal it.
I left the money and the rock where it was."
821,3642720,3645007,"They're going to come back for the piece,
you know that."
822,3645120,3648203,"Naw. They're in the wind, Matthew.
Trust me."
823,3648880,3650344,Cops clipped their ass.
824,3652120,3653690,You know how to use that?
825,3654680,3655920,Shit.
826,3657200,3659328,"Point it at me.
Like you're gonna shoot me."
827,3660800,3661961,Go ahead.
828,3663240,3664241,Come on.
829,3667960,3669166,That the way you hold a gun?
830,3670080,3671570,"That's the way I hold it, yeah."
831,3672320,3675403,"You know how to jack the clip?
Empty it? Clean it?"
832,3680680,3683604,"But the gun's still not empty.
You know that, right?"
833,3684440,3686640,"You know there's still a round left
in the chamber here?"
834,3687400,3688640,Now. Put it back together.
835,3696800,3697801,Caress it.
836,3697960,3699803,"Rub it, like it's part of you."
837,3702320,3703890,"Feels good, doesn't it?"
838,3704640,3705687,Word.
839,3706040,3707385,It's all oily and whatnot.
840,3708120,3709281,Turn off the safety.
841,3712960,3713961,Now cock it.
842,3719360,3722330,"Now put it to your temple
and pull the fucking trigger."
843,3723760,3725091,"- What?
- You heard me."
844,3725720,3727051,Shoot yourself in the head.
845,3727320,3728890,Might as well get it over with now.
846,3729240,3730685,"Because you walk around with a gun,"
847,3730760,3733366,"sooner or later, it's gonna happen anyway."
848,3733440,3737286,"No rewind. No going out for popcorn
and coming back to the show."
849,3737920,3741686,"It's just you with that gun in your hand,
stupid look on your face,"
850,3741800,3743165,and your hash all over the wall.
851,3745920,3747331,"Take it easy now, TJ."
852,3797680,3798681,Fuck!
853,3804360,3806647,"Scudder, I'm assuming you're not"
854,3806720,3808160,dumb enough to shoot a federal agent.
855,3808320,3809651,Show me your badge. Right now.
856,3809720,3810721,Okay.
857,3810800,3812245,I'm reaching for my folder.
858,3814840,3817207,Stover. Drug Enforcement.
859,3817880,3818881,Put it down.
860,3819920,3821524,Great. It's broken.
861,3821600,3823125,Next time identify yourself.
862,3823200,3824531,"Hey, maybe we should pull over,"
863,3824600,3827206,"try again this time without the sucker punch,
see how well you do."
864,3827320,3828321,Why wait?
865,3828840,3829966,"Hey, that's enough."
866,3830960,3832450,Who you working for? Kenny Kristo?
867,3832920,3834843,"- I can't say.
- Cut it out, Scudder."
868,3835200,3837521,"You're not licensed
so you don't have privilege."
869,3837600,3838601,"And you're retired,"
870,3838680,3840887,"so this gives you about
as much legal authority"
871,3840960,3842121,as a fucking mailman.
872,3843240,3844605,"So the sooner you tell me
what you're doing"
873,3844680,3845966,"hanging with known drug dealers,"
874,3846040,3848486,"the sooner you can get to an AA meeting
and not talk about it."
875,3848800,3851406,"I'm trying to find Ray
and his buddy what's-his-name."
876,3851880,3854247,"You know, the two guys
that killed Marie Gotteskind?"
877,3854520,3855567,I don't know who you mean.
878,3855760,3857205,Really? They go around saying
879,3857280,3859248,they're on the DEA payroll.
880,3859320,3862085,"Usually right before they chop someone
into little pieces."
881,3862320,3864209,Was Gotteskind looking at Kenny Kristo?
882,3864280,3865281,I can't answer that.
883,3865600,3867284,Maybe Mrs. Kristo can.
884,3867720,3870485,"Although we haven't seen her around
for a while, have we, guys?"
885,3871160,3872366,"I know,"
886,3872440,3875091,"maybe you should talk to the brother, Peter."
887,3875160,3877561,"Seeing as he used to spend
a lot of time over there."
888,3878720,3879721,Know what?
889,3880400,3881606,I was wrong.
890,3881680,3884126,"This guy doesn't know a fucking thing.
Uncuff him."
891,3885760,3887364,We're done here.
892,3920280,3922408,"In the program, they have this saying."
893,3923320,3925766,"""Don't give up five minutes
before the miracle happens."""
894,3926040,3927041,Scudder.
895,3927520,3928760,"Of course the flip side of that one is,"
896,3928840,3930842,"if you do give up,
you'll never know."
897,3931040,3932041,What are you doing here?
898,3936440,3937922,I'm admiring your wallpaper.
899,3940040,3942771,"Those are the studies I was doing
for the painting."
900,3943040,3944041,You do them all here?
901,3944120,3945451,Yeah. We had to.
902,3945520,3948171,Wanted it to be a surprise for Kenny.
903,3948400,3950641,Was he? Surprised?
904,3952120,3953167,"What do you want, man?"
905,3954080,3955730,You and Carrie put the DEA
906,3955800,3957000,"onto your brother, didn't you?"
907,3957680,3958681,Hey.
908,3958840,3961161,"I wouldn't blame you
for hating the guy. I mean,"
909,3961240,3963288,"it's not just that he has
a beautiful wife,"
910,3963360,3965328,"it's not just that he's got
all that money,"
911,3965440,3969001,"while you work some
get-well job making donuts."
912,3969080,3971048,What would really get me
913,3971840,3973922,is how he can be around all that junk
914,3975040,3976246,and never use.
915,3979200,3981089,Carrie had nothing to do with it.
916,3985760,3989207,"About nine months ago,
they go to Bermuda for their anniversary."
917,3990520,3992727,Carrie asked me to watch the house.
918,3994160,3995446,I'm there maybe a day.
919,3996400,3998562,Found some cash Kenny hadn't locked up.
920,3998680,4000250,I don't even think about it.
921,4000320,4002971,"I go to Queens,
to this guy I know to score."
922,4003200,4004361,And you get busted?
923,4004720,4007724,"Yeah. I get put in a room
with this woman DEA agent."
924,4009800,4011529,"She's so nice to me, you know."
925,4012680,4014045,I give Kenny up like that.
926,4014360,4016800,"Of course, it didn't help
that you were in love with his wife."
927,4017760,4020650,"Sometimes I think Kenny left
that money out on purpose."
928,4021240,4023766,Yeah. I'm sure that's what he did.
929,4025680,4029287,"I'm sure this is all exactly
what he wanted to happen."
930,4029360,4030725,What are you talking about?
931,4030800,4033280,"That agent that busted you, the nice one,"
932,4034360,4036203,her name was Marie Gotteskind.
933,4038200,4040160,"She was killed by the same two men
who got Carrie."
934,4041120,4042201,How did they know about that...
935,4042280,4043281,They stole her files.
936,4043680,4045921,"And one of them, thanks to you,
had Kenny's name in it."
937,4051720,4053370,Tell your brother I'm done.
938,4054040,4055883,I'll return his money tomorrow.
939,4056560,4058164,Does Kenny know about me?
940,4058800,4060165,Not unless you tell him.
941,4071160,4072161,Yo.
942,4072240,4073680,There goes his bitch-ass right there.
943,4074240,4075605,"Roll up next to him, man."
944,4075680,4078729,"Yo, TJ! Feeling those new Timbs
you're rocking, man."
945,4079240,4081083,"I know you hear me talking to you, right?"
946,4081160,4082685,Let's go fuck this boy up.
947,4086440,4088966,"- Yo, slow your ass down!
- Whoa, whoa! What's up? What's up?"
948,4089480,4091209,"Yo, you got something
that belongs to me, man."
949,4091280,4092281,"What you all talking about, man?"
950,4092400,4094240,"Where my Gat at, man?
That's my favorite piece!"
951,4094280,4095520,"Man, I threw it in the fucking river, man. I..."
952,4095600,4096601,What?
953,4096680,4097806,"Serious, man?"
954,4097880,4099600,"The fuck you mean
you threw it in the river?"
955,4099640,4101449,"Where you going?
We just want to talk to you."
956,4101520,4102521,"Get back here, bitch."
957,4102600,4104204,"- Yo, run his fucking bag.
- Give me that!"
958,4106520,4107726,"Yo, what's this cartoon shit?"
959,4107880,4109006,"No, no, no!"
960,4109280,4110281,"- No, man, that's my...
- Shut up!"
961,4110360,4111407,"Yo, where you get this money from?"
962,4111560,4113005,"- It's my allowance!
- You sell my Gat?"
963,4113080,4114684,"- No!
- Yo, take his fucking Timbs off, man."
964,4115360,4116441,"No, man."
965,4116920,4118251,"What the fuck? Yo, motherfucker!"
966,4118320,4120243,"- Fuck, I'm going to kill his bitch ass!
- Fucking A!"
967,4120560,4123240,"- What's wrong with you?
- You crazy? You outta your mind?"
968,4125920,4126967,Any messages?
969,4129560,4130561,Yeah. JR called.
970,4130680,4131681,TJ?
971,4132480,4133811,"Yeah, whatever."
972,4133880,4134961,Did he leave a message?
973,4135680,4137648,Let me think. No.
974,4138440,4139441,"Well, yeah."
975,4139800,4140801,He's at Bellevue.
976,4143440,4144851,He got worked over pretty good.
977,4145200,4146770,But he was also out in the rain.
978,4147080,4148161,Either one could have triggered the crisis.
