Number,StartMilliseconds,EndMilliseconds,Text
1148,3537583,3539749,"- You're a sadist.
- You..."
1149,3539833,3543666,"Let me go!
I'll kill him. I'll kill him!"
1150,3543750,3546166,"You don't really mean
you'll kill me, do you?"
1151,3553459,3555791,"Is there anything wrong, gentlemen?
I heard some noise."
1152,3555875,3559874,"Oh, no. Everything's all right. We're just...
- You know, friendly little argument. It's..."
1153,3559958,3563249,"Um, listen, we're through with that diagram.
You can take it if you want."
1154,3564625,3566625,"Here you are.
Thank you."
1155,3571833,3573916,What are you lookin' at?
1156,3594667,3596707,"I suppose somebody
has to start it off again."
1157,3596792,3600500,"- I beg pardon.
- ""I beg pardon."" What are you so polite about?"
1158,3600583,3602666,For the same reason you're not.
1159,3602750,3604750,It's the way I was brought up.
1160,3606667,3608582,This fighting...
1161,3608667,3610707,"That's not why we are here, to fight."
1162,3610792,3613166,We have a responsibility.
1163,3614334,3618916,"This, I have always thought,
is a remarkable thing about democracy..."
1164,3619000,3621000,that we are...
1165,3622084,3624666,"Uh, what is the word?"
1166,3624750,3627832,"Notified.
That we are notified by mail..."
1167,3627917,3632249,"to come down to this place
to decide on the guilt or innocence..."
1168,3632334,3636375,of a man we have never heard of before.
1169,3636459,3640999,"We have nothing to gain or lose
by... by our verdict."
1170,3641917,3645041,"This is one of the reasons
why we are strong."
1171,3646334,3649166,We should not make it a personal thing.
1172,3650500,3652500,Thank you.
1173,3653376,3655666,"If nobody else has an idea,
I may have a cutie here."
1174,3655750,3658559,"I mean, I haven't given it much thought,
but let's throw it out on the stoop..."
1175,3658583,3660208,and see if the cat licks it up.
1176,3660292,3662624,"- The cat licks it up?
- Yeah. If the boy..."
1177,3667125,3669249,Look how dark it's getting out there.
1178,3669334,3671791,I'll bet we're gonna have a storm now.
1179,3673583,3676041,"Boy, oh, boy. It's really hot, huh?"
1180,3677541,3680333,"Pardon me, but don't you ever sweat?"
1181,3681750,3683916,"No, I don't."
1182,3684000,3686000,"Well, listen. I, uh..."
1183,3686084,3689249,"I was wondering if, uh, maybe..."
1184,3689334,3691624,maybe we should take another vote.
1185,3691708,3695999,"Oh, great. Maybe we can follow this one up
with a little dancing and refreshments, huh?"
1186,3696084,3698084,"- Hmm.
- Mr. Foreman?"
1187,3698667,3702208,"Well, that's okay with me.
Anyone doesn't want to vote?"
1188,3702292,3705500,"- Hey, come on. Come on.
- I'm sorry."
1189,3705583,3709083,"I think we ought to have an open ballot...
call out our votes, you know."
1190,3709167,3711375,Let's see who stands where.
1191,3711459,3713957,"That sounds fair to me.
Anyone object?"
1192,3716708,3719416,"Okay. I'll call off your jury numbers.
One."
1193,3720417,3723208,"Oh, that's me. I vote guilty."
1194,3723292,3725083,Two?
1195,3725167,3727167,Not guilty.
1196,3727209,3730041,"- Number three?
- Guilty."
1197,3731042,3733042,Number four?
1198,3734084,3735874,Guilty.
1199,3735958,3738707,"- Number five?
- Not guilty."
1200,3739792,3743083,"- Number six?
- Not guilty."
1201,3744084,3745749,Number seven?
1202,3745833,3747540,Guilty.
1203,3747625,3749666,Number eight?
1204,3749750,3751750,Not guilty.
1205,3752750,3755666,"- Number nine?
- Not guilty."
1206,3755750,3757916,"- Number 10?
- Guilty."
1207,3759708,3761749,Number 11?
1208,3761833,3763666,Not guilty.
1209,3763750,3765750,Number 12?
1210,3766167,3768500,Number 12.
1211,3768583,3770583,Guilty.
1212,3776000,3778083,The vote is now six to six.
1213,3778167,3781333,"Yeah, right.
And we go into extra innings here, huh?"
1214,3783750,3788249,"Six to six. I'm telling you, some of you
people in here must be out of your minds."
1215,3788334,3790166,A kid like that.
1216,3790250,3793500,"I don't think the kind of boy he is
has anything to do with it."
1217,3793583,3795666,"The facts are supposed
to determine the case."
1218,3795750,3797916,"Don't give me that!
I'm sick and tired of facts!"
1219,3798000,3800060,"You can twist them any way you like.
You know what I mean?"
1220,3800084,3802666,"That's exactly the point
this gentleman has been making."
1221,3802750,3803455,Oh!
1222,3803479,3805666,"I mean, you keep shouting
at the top of your lungs."
1223,3807334,3809249,"I'd like to be
a few years younger."
1224,3809334,3811334,That man gets on my...
1225,3814625,3817458,"- My, it's hot in here, isn't it?
- Do you want a drink of water?"
1226,3817541,3821249,"No. No, thanks. Thanks."
1227,3829084,3830874,It's gonna rain.
1228,3830958,3833208,"Well, how'd you figure that out, killer?"
1229,3834459,3836333,How come you changed your vote?
1230,3836417,3838832,"Well, it just seemed to me
there was room for doubt."
1231,3838917,3841158,"You haven't got a leg to stand on.
You know that, I hope."
1232,3841209,3844208,"I don't feel that way.
There were a lot of details that never came out."
1233,3844292,3847832,"- Yeah. Well, good luck.
- Oh, come on. You're like everybody else."
1234,3847917,3850124,"You think too much.
You get mixed up."
1235,3851376,3852565,You know what I mean?
1236,3852589,3855333,"Now, listen.
I don't think you have any right..."
1237,3855417,3857999,Loudmouth.
1238,3910667,3913166,"Look at that come down, will you?"
1239,3914334,3916208,You know...
1240,3916292,3918791,this reminds me of a storm we had last...
1241,3918875,3922333,"Oh, when was that? November..."
1242,3922417,3925500,"I don't know. Something.
It was quite a storm we had there."
1243,3925583,3927957,It was right in the middle of a game.
1244,3928042,3930666,"Uh, we were behind 7-6..."
1245,3930750,3933333,"but we just started to move the ball,
right off the tackle."
1246,3933417,3936208,"Started cutting right...
slash here and slash right in..."
1247,3936292,3938083,cut right through.
1248,3938167,3940666,"And, uh..."
1249,3940750,3942957,"We had this kid Slattery, you know?"
1250,3944125,3947500,"A real... He was an ox.
You know, a real ox."
1251,3947583,3950083,I wish I had another one just like him.
1252,3950167,3954666,"I forgot to tell you. I'm the assistant head
coach at the Andrew J. McCorkle High School."
1253,3954750,3956832,"- Oh, yeah?
- That's out in Queens."
1254,3956917,3959666,"And, uh, anyway..."
1255,3959750,3961832,we're starting to move along real nice.
1256,3961917,3965083,"Their whole line is just...
they're just coming apart."
1257,3966376,3970124,"And it starts to come down
cats and dogs, just like this."
1258,3970209,3972832,"Just whoosh... you know, right down."
1259,3974125,3977500,"Well, that was murder, you know?"
1260,3977583,3980166,"I swear, I... I nearly bawled."
1261,3980250,3982582,You just... You couldn't go nowhere.
1262,3983833,3985833,Well.
1263,4000792,4003291,"Hey, what is it with this fan here?
How come..."
1264,4011042,4012791,Hey! Ηuh?
1265,4012875,4016166,"Must have been
on the same switch with the lights."
1266,4017167,4020333,"Well, things are looking up here, huh?"
1267,4021000,4023000,"Yeah, huh?"
1268,4027334,4029334,Boy. That's better.
1269,4036000,4037500,Hey!
1270,4037583,4039583,Two points.
1271,4043250,4045250,Any of you guys ever go to the Garden?
1272,4047541,4050416,That's a damn stupid thing to do.
1273,4050500,4052666,"Oh, I'm sorry. I, uh..."
1274,4053708,4055708,You know?
1275,4056792,4058792,Pardon me.
1276,4059376,4061707,"Well, how do you like it?
Even Steven."
1277,4061792,4064166,"Pretty surprising, isn't it?"
1278,4064250,4066250,Yes.
1279,4067541,4071041,"Say, that business before,
when that tall guy... what's-his-name..."
1280,4071125,4073832,"was trying to bait me...
That doesn't prove anything."
1281,4073917,4076500,I'm a pretty excitable person.
1282,4076583,4080416,"I mean, where does he come off calling me
a public avenger, sadist and everything?"
1283,4080500,4083999,"Anyone in his right mind
would blow his stack, huh?"
1284,4084084,4086375,He was just trying to bait me.
1285,4086459,4088459,He did an excellent job.
1286,4091250,4093458,"I'll tell you what I think.
We're going nowhere here."
1287,4093541,4096083,"I'm ready to walk into court right now
and declare a hung jury."
1288,4096167,4097999,"There's no point in this thing
going on any more."
1289,4098084,4099416,Yeah. I go for that too.
1290,4099500,4100938,"Listen,
let's take it in to the judge and let"
1291,4100962,4102393,"the kid take his chances
with 12 other guys."
1292,4102417,4105310,"I don't think the judge will accept a hung jury.
We haven't been in here very long."
1293,4105334,4106999,"Well, let's find out."
1294,4107084,4108791,I'm not in favor of that.
1295,4108875,4112083,"Listen. This kid wouldn't stand a chance
with another jury, and you know it."
1296,4112167,4115060,"Come on! We're hung. Nobody's gonna
change his vote. Let's take it inside."
1297,4115084,4117291,"You still don't think there's room
for reasonable doubt?"
1298,4117376,4118666,"No, I don't."
1299,4118750,4120041,Pardon.
1300,4120125,4123375,"Maybe you don't fully understand
the term ""reasonable doubt."""
1301,4123459,4125999,What do you mean I don't understand?
1302,4127084,4129084,"Boy, how do ya like this guy?"
1303,4129125,4130791,"I'm tellin' ya, they're all alike."
1304,4130875,4133768,"They come over here, running for their life,
and before they can take a deep breath..."
1305,4133792,4136166,"they're telling us how
to run the show, huh?"
1306,4136250,4138041,"Boy, the arrogance of this guy."
1307,4138125,4142707,"Hey, all right. Let's stop
the arguing for about two minutes in here."
1308,4142792,4145166,"Now, who's got something
constructive to say?"
1309,4145250,4148791,"I'd like to go over something,
if you gentlemen don't mind."
1310,4148875,4151540,"An important point for the prosecution
was the fact..."
1311,4151625,4154375,"that after the boy claimed
he'd been at the movies..."
1312,4154459,4156459,"during the hours
that the killing took place..."
1313,4156541,4160416,"couldn't remember the names of the movies
or the stars who appeared in them."
1314,4160500,4163021,"This gentleman here has put up that point
in here several times."
1315,4163084,4164540,That's correct.
1316,4164625,4166500,It was the only alibi the boy offered...
1317,4166583,4169083,"and he himself couldn't back it up
with any details at all."
1318,4169167,4172416,"Putting yourself in the boy's place,
do you think you could remember details..."
1319,4172500,4175957,"after an upsetting experience such as
being slapped in the face by your father?"
1320,4176042,4179249,"I think so, if there were
any special details to remember."
1321,4179334,4180801,"The boy couldn't
remember the names of the"
1322,4180825,4182559,"movies he saw because
be wasn't there that night."
1323,4182583,4184624,"According to
the police testimony in court..."
1324,4184708,4187832,"the boy was questioned by the detectives
in the kitchen of his apartment..."
1325,4187917,4190832,"while the body of his father
was lying on the floor in the bedroom."
1326,4190917,4193517,"Do you think you could remember details
under those circumstances?"
1327,4193583,4195583,"- I do.
- Under great emotional stress?"
1328,4195667,4198226,"- Under great emotional stress.
- He remembered them correctly in court."
1329,4198250,4200268,"He named the pictures
and the stars who played in them."
1330,4200292,4203458,"Yes. His lawyer took great pains
to bring that out."
1331,4203541,4206143,"He had three months from the night
of the murder to the day of the trial..."
1332,4206167,4207791,in which to memorize them.
1333,4207875,4210601,"It's not difficult for a lawyer to find out
what played at a particular theater..."
1334,4210625,4212291,on a particular night.
1335,4212376,4214124,"I'll take the testimony
of the policemen who"
1336,4214148,4215999,"interrogated the boy
right after the murder..."
1337,4216084,4218500,"when he couldn't remember
a thing about the movies..."
1338,4218583,4220500,great emotional stress or not.
1339,4220583,4223874,"- I'd like to ask you a personal question.
- Go ahead."
1340,4223958,4227208,"- Where were you last night?
- I was home."
1341,4227292,4229832,"- How about the night before that?
- Come on! What is this?"
1342,4229917,4231249,"No, it's all right."
1343,4231334,4233874,"I left the office at 8:30
and went straight home and to bed."
1344,4233958,4235624,And the night before that?
1345,4235708,4238124,"That was, uh, Tuesday night?"
1346,4238209,4240250,"The night of the bridge tournament.
I played bridge."
1347,4240292,4241624,Monday night?
1348,4241708,4244916,"When you get down
to New Year's Eve, 1954, let me know, huh?"
1349,4246917,4248917,Monday night?
1350,4250125,4253124,"Monday night, uh,
my wife and I went to the movies."
1351,4253209,4254832,"- What did you see?
- The Scarlet Circle."
1352,4254917,4258166,"- It was a clever whodunit.
- What was the second feature?"
1353,4258250,4260874,"The, um..."
1354,4260958,4263624,"I'll tell you in a minute. The, uh..."
1355,4263708,4267874,"Remarkable Mrs., uh, something..."
1356,4267958,4270416,The...
1357,4270500,4273166,"Mrs. Bainbridge.
The Remarkable Mrs. Bainbridge."
1358,4273250,4275999,"I saw that.
It's called The Amazing Mrs. Bainbridge."
1359,4277292,4279666,"Uh, yes. The Amazing Mrs. Bainbridge.
I think that's right."
1360,4279750,4282249,Who was in The Amazing Mrs. Bainbridge?
1361,4282334,4285999,"Barbara... Long, I think it was."
1362,4286084,4288084,"A dark, very pretty girl."
1363,4289417,4291916,Ling or Long... something like that.
1364,4292000,4295208,"- Who else?
- I'd never heard of them before."
1365,4295292,4299707,"It was a very inexpensive second feature
with, uh, unknown..."
1366,4299792,4302916,"And you weren't under
an emotional stress, were you?"
1367,4305833,4307957,No.
1368,4308042,4310042,I wasn't.
1369,4311583,4313333,I think the point is made.
1370,4313417,4316166,Big point!
1371,4316250,4318416,"You can talk till your tongue
is draggin' on the floor."
1372,4318500,4322582,"The boy is guilty, period.
You know what I mean, my friend?"
1373,4322667,4325916,"- Who's got those cough drops?
- They're all gone, my friend."
1374,4327917,4330166,"Oh, boy. Look at that rain."
1375,4330250,4332624,There goes your ball game.
1376,4332708,4335124,It's only a shower.
1377,4335209,4337375,"Besides, they got the infield covered."
1378,4337459,4340624,"Right. Say, could I see that knife
a second, please?"
1379,4343417,4345749,"Well, we're still tied up six to six."
1380,4345833,4347833,Who's got a suggestion?
1381,4347917,4349917,"It's five after 6:00.
Let's get some dinner."
1382,4350000,4352458,"Why don't we wait till 7:00,
give it another hour, huh?"
1383,4352541,4354666,Okay with me.
1384,4354750,4356916,"Uh, there's something I'd like to say."
1385,4357000,4360540,"I mean, it's been bothering me a little,
and as long as we're stuck."
1386,4360625,4364500,"Well, there was this whole business
about the stab wound and how it was made..."
1387,4364583,4366208,"the downward angle of it, you know?"
1388,4366292,4368292,"Don't tell me we're gonna
start with that again."
1389,4368376,4369999,They've been over it and over it.
1390,4370084,4372375,"Well, I know they did,
but I don't go along with it."
1391,4372459,4376458,"Now, the boy was 5 feet 7 inches tall.
His father was 6'2..."
1392,4376541,4378707,That's a difference of seven inches.
1393,4378792,4381458,"It's a very awkward thing to stab down
into the chest of someone..."
1394,4381541,4383541,"who's more than half a foot
taller than you are."
1395,4383625,4385749,Give me that.
1396,4385833,4388624,"I'll give you a demonstration.
Somebody get up."
1397,4390000,4392000,You...
1398,4396417,4399124,"I want you to watch this 'cause
I don't want to have to do it again."
1399,4399209,4401957,"I'll make myself about six
or seven inches shorter, okay?"
1400,4402042,4405166,"- It's about right. Maybe a little more.
- Okay. A little more."
1401,4412958,4415375,That's not funny.
1402,4417459,4421291,"Now, nobody's hurt. Right?"
1403,4421958,4423958,Right. Nobody hurt.
1404,4427209,4431999,"Now, this is the way I'd stab a man
who was taller than I was."
1405,4432084,4434540,Look at the angle... down and in.
1406,4434625,4436707,And this is the way it was done.
1407,4436792,4438957,Now tell me I'm wrong.
1408,4441167,4444582,"- Down and in. I guess there's no argument.
- Hold it a minute, will ya?"
1409,4444667,4446667,Can you give me that?
1410,4447500,4449416,"Boy, I hate these things."
1411,4449500,4451166,"- Did you ever see a knife fight?
- No."
1412,4451250,4452832,"- You?
- No."
1413,4452917,4455707,Anybody here ever see a knife fight?
1414,4455792,4458582,"Well, I have.
You know, on my back stoop..."
1415,4458667,4460999,"the lot across the street, backyard."
1416,4461084,4463500,"Switchblades came
with the neighborhood where I lived."
1417,4463583,4466832,"It's funny I never thought of it before.
I guess you try to forget those things."
1418,4466917,4470291,"- How do you use a switchblade?
- Well, you'd never use it like this."
1419,4472042,4474333,"See, you use too much time
switching hands."
1420,4476084,4478582,Here's how... underhanded.
1421,4481292,4484333,"Anyone who's ever used a switch knife
wouldn't handle it any other way."
1422,4484417,4487041,"- Are you sure?
- I'm sure."
1423,4487125,4488957,That's why they're made to open like that.
1424,4489042,4490986,"You'd say the boy was
pretty handy with a knife?"
1425,4491010,4491666,Mm-hmm.
1426,4491750,4494916,"You think he could have made
the kind of wound that killed his father?"
1427,4495000,4498916,"No. Not with the experience he'd had
all his life handling these things."
1428,4499000,4501000,I feel he'd have gone for him underhanded.
1429,4501084,4504124,"How do you know? Were you
in the room when the father was killed?"
1430,4504209,4506209,No. Neither was anybody else.
1431,4506292,4509500,"So what are you giving us all this
mumbo jumbo for? I don't believe it."
1432,4509583,4511196,"I don't think you can
determine what type of"
1433,4511220,4512893,"wound the boy might
or might not have made..."
1434,4512917,4515540,"simply because he knew
how to handle a knife."
1435,4515625,4517957,What do you think?
1436,4518042,4520124,"- I don't know.
- What do you mean you don't know?"
1437,4520209,4522209,I don't know.
1438,4526250,4528250,How about you?
1439,4528334,4530226,"I don't know about the rest of them,
but I'm getting"
1440,4530250,4532143,"a little tired of this
yackety-yackin' back and forth."
1441,4532167,4535624,"It's gettin' us nowhere.
So I guess I'll have to break it up."
1442,4535708,4538249,I change my vote to not guilty.
1443,4538334,4541666,"- You what?
- You heard me. I've had enough."
1444,4541750,4544208,"What do you mean you've had enough?
That's no answer!"
1445,4544292,4548249,"Hey, listen. You just take care
of yourself, huh? You know?"
1446,4548334,4552291,He's right. That's not an answer.
1447,4552376,4555333,What kind of a man are you?
1448,4555417,4558540,"You have sat here and voted guilty
with everyone else..."
1449,4558625,4562874,"because there are some baseball tickets
burning a hole in your pocket."
1450,4562958,4567208,"And now you've changed your vote because you
say you're sick of all the talking here?"
1451,4568209,4569666,"Now listen, buddy!"
1452,4569750,4574416,"Who tells you that you have the right
to play like this with a man's life?"
1453,4574500,4576999,"- Don't you care...
- Now wait a minute!"
1454,4577084,4581083,"- You can't talk like that to me!
- I can talk like that to you."
1455,4581167,4583041,If you want to vote not guilty...
1456,4583125,4585525,"then do it because you are convinced
the man is not guilty..."
1457,4585583,4587375,not because you've had enough.
1458,4587459,4590041,"And if you think he is guilty,
then vote that way."
1459,4590125,4593333,"Or don't you have the guts
to do what you think is right?"
1460,4593417,4595666,"- Now listen.
- Guilty or not guilty?"
1461,4596459,4600041,"- I told you, not guilty.
- Why?"
1462,4601708,4603333,"Look, I don't have to..."
1463,4603417,4606540,You do have to! Say it! Why?
1464,4606625,4609083,"All right. I don't, uh, think he's guilty."
1465,4618583,4620208,I want another vote.
1466,4620292,4622791,Okay. There's another vote called for.
1467,4622875,4625749,"I guess the quickest way is a show of hands.
Anyone object?"
1468,4625833,4628749,"Okay. All those voting not guilty,
raise your hands."
1469,4629667,4634832,"One, two, three, four,
five, six, seven..."
1470,4637667,4639667,eight.
1471,4643250,4645375,"Um, nine."
1472,4646376,4651375,"Um, all those voting guilty,
raise your hands."
1473,4651459,4653832,"One, two, three."
1474,4653917,4656416,"Well, the vote's nine to three
in favor of acquittal."
1475,4657417,4659582,I don't understand you people!
1476,4659667,4661893,"I mean, all these picky little points
you keep bringing up."
1477,4661917,4665249,"They don't mean nothing!
You saw this kid just like I did."
1478,4665334,4668832,"You're not gonna tell me you believe
that phony story about losing the knife..."
1479,4668917,4670917,"and that business
about being at the movies."
1480,4671000,4673999,"Look, you know how these people lie.
It's born in them."
1481,4674084,4676124,"I mean, what the heck.
I don't have to tell you."
1482,4676209,4678209,They don't know what the truth is.
1483,4678250,4681957,"And let me tell you, they don't need
any real big reason to kill someone either."
1484,4682042,4683791,"No, sir."
1485,4683875,4686916,"They get drunk!
Oh, they're real big drinkers, all of 'em."
1486,4687000,4690166,"You know that.
And bang... someone's lying in the gutter."
1487,4690250,4693249,"Well, nobody's blaming them for it.
That's the way they are, by nature."
1488,4693334,4695416,You know what I mean? Violent!
1489,4695500,4696999,Where are you going?
1490,4697084,4700083,"Ηuman life don't mean
as much to them as it does to us."
1491,4701084,4704083,"Look! They're lushing it up
and fighting all the time..."
1492,4704167,4706226,"and if somebody gets killed,
so somebody gets killed!"
1493,4706250,4707624,They don't care!
1494,4707708,4709916,"Oh, sure, there's some good things
about 'em too."
1495,4710000,4712000,"Look, I'm the first one to say that."
1496,4712042,4715333,"I've known a couple who were okay, but
that's the exception, you know what I mean?"
1497,4715417,4719166,"Most of 'em, it's like they have no feelings.
They can do anything."
1498,4719250,4721832,What's going on here?
1499,4721917,4723957,I'm... I'm trying to tell ya...
1500,4724042,4726042,"you're making a big mistake, you people."
1501,4726125,4729124,"This kid is a liar!
I know it. I know all about them."
1502,4730833,4732999,"Listen to me.
They're no good."
1503,4733084,4735416,There's not a one of 'em who's any good.
1504,4737459,4739916,"I mean, what...
What's happening in here?"
1505,4740000,4742249,"I'm speaking my piece, and you..."
1506,4743459,4745459,Listen to me.
1507,4746209,4747666,I...
1508,4747750,4750208,"We're... This kid on trial here, his type..."
1509,4750292,4752292,"Well, don't you know about them?"
1510,4754250,4757707,Th-There's... There's a danger here.
1511,4757792,4759874,These people are dangerous.
1512,4759958,4762999,They're... wild.
1513,4763084,4764999,Listen to me.
1514,4765084,4767416,"- Listen.
- I have."
1515,4767500,4770500,"Now sit down
and don't open your mouth again."
1516,4774417,4777166,I was only trying to... tell you.
1517,4813625,4817916,"It's always difficult to keep personal
prejudice out of a thing like this."
1518,4819042,4823041,"Wherever you run into it,
prejudice always obscures the truth."
1519,4824625,4826999,I don't really know what the truth is.
1520,4827084,4829999,"I don't suppose anybody
will ever really know."
1521,4831292,4835249,"Nine of us now seem to feel
that the defendant is innocent."
1522,4835334,4838333,But we're just gambling on probabilities.
1523,4838417,4840417,We may be wrong.
1524,4840459,4842832,"We may be trying to let
a guilty man go free."
1525,4842917,4844375,I don't know.
1526,4844459,4846459,Nobody really can.
1527,4846541,4848916,But we have a reasonable doubt...
1528,4849000,4852500,"and that's something
that's very valuable in our system."
1529,4852583,4857124,"No jury can declare a man guilty
unless it's sure."
1530,4858583,4860957,We nine can't understand...
1531,4861042,4863749,how you three are still so sure.
1532,4864583,4866583,"- Maybe you can tell us.
- I'll try."
1533,4867958,4871458,"You've made some excellent points, but I
still believe the boy is guilty of murder..."
1534,4871541,4873249,and I have two reasons.
1535,4873334,4876458,"One, the evidence
given by the woman across the street..."
1536,4876541,4879166,who actually saw the murder committed.
1537,4879250,4881832,"As far as I'm concerned,
that's the most important testimony."
1538,4881917,4885166,"And two, the fact that she
described the stabbing by saying..."
1539,4885250,4890874,"she saw the boy raise his arm over his head
and stab down into the father's chest."
1540,4890958,4892999,She saw him do it the wrong way.
1541,4893084,4894999,That's absolutely right.
1542,4895084,4897666,Let's talk about this woman for a moment.
1543,4897750,4900832,"She said she went to bed
about 11:00 that night."
1544,4900917,4904500,"Her bed was next to the window,
and she could look out while lying down..."
1545,4904583,4908666,"and see directly into the boy's room
across the street."
1546,4908750,4911375,"She tossed and turned for over an hour,
unable to sleep."
1547,4911459,4915624,"Finally, she turned toward the window
at about 10 minutes after 12:00..."
1548,4915708,4920832,"and, as she looked out, she saw the killing
through the windows of a passing El train."
1549,4920917,4923624,"She said the lights went out
immediately after the killing..."
1550,4923708,4928500,"but that she got a good look at the boy
in the act of stabbing his father."
