Number,StartMilliseconds,EndMilliseconds,Text
798,2518958,2521707,"and a split second later
heard a body hit the floor."
799,2521792,2523375,"- One second later, right?
- That's right."
800,2523459,2529458,"Second. The woman across the street swore
positively she looked out of the window..."
801,2529541,2532874,"and saw the killing through the last two
cars of the passing elevated train, right?"
802,2532958,2535291,"- The last two cars.
- What are you giving us here?"
803,2535376,2536707,"Now, just a minute."
804,2536792,2541208,"We've agreed that it takes 10 seconds
for a train to pass a given point."
805,2542042,2545375,"Since the woman saw the killing
through the last two cars..."
806,2545459,2550416,"we can assume that the body
hit the floor just as the train went by."
807,2550500,2554957,"Therefore, the train had been roaring
by the old man's window..."
808,2555042,2558540,"a full 10 seconds
before the body hit the floor."
809,2558625,2560832,"The old man,
according to his own testimony..."
810,2560917,2563832,"""I'm gonna kill you,"" body hitting
the floor a split second later..."
811,2563917,2566375,"would have had to hear the boy
make this statement..."
812,2566459,2568333,with the El roaring past his nose.
813,2568417,2569957,It's not possible he could've heard it.
814,2570042,2572268,"- That's idiotic. Of course he heard it.
- Do you think he could've heard it?"
815,2572292,2574726,"He said he yelled at the top of his voice.
That's good enough for me."
816,2574750,2577060,"Even if he heard something, he still
couldn't have identified the voice."
817,2577084,2578208,With the El roaring by?
818,2578292,2580726,"You're talking about a matter of seconds!
Nobody can be that accurate."
819,2580750,2585375,"I think testimony that could put a boy into
the electric chair should be that accurate."
820,2587583,2589500,"You know something?
I don't think he could've heard it."
821,2589583,2591916,"Maybe he didn't hear it.
I mean, with all that El noise."
822,2592000,2593874,"Oh, what are you people talking about?"
823,2593958,2595999,"Well, it stands to reason
he couldn't have heard it."
824,2596084,2597999,"Why should he lie?
What's he got to gain?"
825,2598084,2600291,Attention maybe.
826,2600376,2602291,"You keep coming in
with these bright sayings!"
827,2602376,2605416,"Why don't you send 'em in to a paper?
They pay three dollars apiece."
828,2605500,2607707,"What are you talking to him
like that for?"
829,2608667,2612083,"Guy talks like that to an old man
really ought to get stepped on, you know?"
830,2612167,2614167,"You ought to have more respect, mister."
831,2615209,2619582,"If you say stuff like that to him again,
I'm gonna lay you out."
832,2629541,2632500,"Now you go ahead.
You... You say anything you like."
833,2632583,2636624,"Why do you think
the old man might lie?"
834,2636708,2640124,"It was just that I looked at him
for a very long time."
835,2640750,2643999,"The seams of his jacket was split,
under the shoulder."
836,2644084,2645666,Or did you notice that?
837,2645750,2648249,"I mean, to come to court like that."
838,2648334,2650334,Why...
839,2651125,2654999,"He was a very old man
in a torn jacket."
840,2655084,2657957,"And he walked very slowly
to the stand."
841,2658708,2662749,"He was dragging his left leg
and trying to hide it..."
842,2662833,2664833,because he was ashamed.
843,2665625,2669041,"I think I know this man
better than anyone here."
844,2669917,2675333,"This is a quiet, frightened,
insignificant old man who..."
845,2675417,2677791,who has been nothing all his life...
846,2677875,2680291,who has never had recognition...
847,2680376,2682458,or his name in the newspapers.
848,2683125,2685333,Nobody knows him.
849,2685417,2687458,Nobody quotes him.
850,2687541,2691500,Nobody seeks his advice after 75 years.
851,2692334,2696208,"Gentlemen, that's a very sad thing...
to be nothing."
852,2696917,2701249,"A man like this needs to be quoted,
to be listened to."
853,2701875,2703875,To be quoted just once.
854,2703917,2705917,Very important to him.
855,2706292,2708707,"It would be so hard for him
to recede into the background..."
856,2708792,2710500,"- Wait a minute.
- When there was a chance..."
857,2710583,2713517,"What are you trying to do... tell us he'd
lie just so he could be important once?"
858,2713541,2716166,No. He wouldn't really lie.
859,2716250,2719707,"But perhaps he made himself believe
he heard those words..."
860,2719792,2721999,and recognized the boy's face.
861,2722084,2724375,"That's the most fantastic story
I've ever heard."
862,2724459,2727500,"How can you make up a thing like that?
What do you know about it?"
863,2736541,2738582,"Oh, uh, does anybody
want a cough drop?"
864,2738667,2740916,"- No, thanks.
- I'll take one."
865,2741000,2744500,"You can say what you like. I still don't
see how anybody can think he's not guilty."
866,2744583,2747083,"There's something else
I'd like to talk about for a minute."
867,2747167,2748791,Thanks.
868,2748875,2750563,"I think we've proved
that the old man couldn't"
869,2750587,2752226,"have heard the boy
say ""I'm gonna kill you."""
870,2752250,2753832,"- But supposing...
- You didn't prove it at all."
871,2753917,2756707,"- What are you talking about?
- Supposing he really did hear it."
872,2756792,2759208,"This phrase, how many times
have all of us used it?"
873,2759292,2760791,Probably thousands.
874,2760875,2762500,"""I could kill you for that, darling."""
875,2762583,2764500,"""Junior, you do that once more,
and I'm gonna kill you."""
876,2764583,2765874,"""Get in there, Rocky, and kill him."""
877,2765958,2767832,"We say it every day. That doesn't mean
we're really gonna kill anybody."
878,2767917,2769707,"Wait a minute.
What are you trying to give us here?"
879,2769792,2773500,"The phrase was ""I'm gonna kill you.""
The kid yelled it at the top of his lungs."
880,2773583,2774916,Don't tell me he didn't mean it.
881,2775000,2777352,"Anybody says a thing like that
the way he said it, they mean it."
882,2777376,2778832,"Well, gee, now I don't know."
883,2778917,2783624,"I remember I was arguing with a guy I work
next to at the bank a couple weeks ago."
884,2783708,2785458,"He called me an idiot, so I yelled at him."
885,2785541,2788500,"Now listen! This guy's trying to make you
believe things that aren't so."
886,2788583,2790726,"The kid said he was gonna kill him,
and he did kill him."
887,2790750,2793768,"Let me ask you this. Do you really think the
boy would shout out a thing like that..."
888,2793792,2795582,so the whole neighborhood could hear him?
889,2795667,2797500,"I don't think so.
He's much too bright for that."
890,2797583,2802333,"Bright? He's a common ignorant slob.
He don't even speak good English."
891,2802417,2805249,"""He doesn't even speak good English."""
892,2807708,2811500,"Mr. Foreman, I'd like
to change my vote to not guilty."
893,2811583,2812999,You what?
894,2813084,2815500,"- You heard me.
- Are you sure?"
895,2816417,2817832,"Yeah, I'm sure."
896,2817917,2820375,"The vote is nine to three,
favor of guilty."
897,2820459,2823249,"Well, if this isn't the living end. Huh?"
898,2827292,2830041,"What are you basing it on
the stories this guy made up?"
899,2830667,2833060,"You ought to write for one of those
kooky detective magazines."
900,2833084,2834916,You'd make a fortune.
901,2835000,2838416,"For crying out loud. The kid's own lawyer
knew he didn't stand a chance."
902,2838917,2840500,"Right from the beginning,
his own lawyer knew it."
903,2840583,2842375,You could see it.
904,2842459,2846041,"Boy, oh, boy. I'm tellin' you,
this guy here is really something."
905,2846875,2848666,"Look, the kid had a lawyer, didn't he?"
906,2848750,2851582,"He presented his case, not you.
How come you got so much to say?"
907,2851667,2854500,"- Look, lawyers aren't infallible, you know.
- Baltimore, please. Huh?"
908,2854583,2856291,He was court-appointed.
909,2856376,2858208,"- What's that supposed to mean?
- It could mean a lot of things."
910,2858292,2861540,"It could mean he didn't want the case,
or he resented being appointed."
911,2861625,2863458,"It's the kind of case
that brings him nothing..."
912,2863541,2866500,"no money, no glory,
not even much chance of winning."
913,2866583,2869500,"That's not a very promising situation
for a young lawyer."
914,2869583,2872559,"He'd really have to believe in his client
to put up any kind of a good case..."
915,2872583,2874643,"and, as you pointed out a minute ago,
obviously he didn't."
916,2874667,2877500,Of course he didn't. Huh.
917,2877583,2879874,Who the heck could?
918,2879958,2882874,"Except maybe
some guy's mother or somebody. I..."
919,2882958,2885208,"Ah, look.
Will you look at the time, huh?"
920,2885292,2887832,"- Come on. For crying out...
- Pardon me."
921,2887917,2890249,"- I have made some notes here...
- Notes."
922,2890334,2892957,"And I would like to...
please, to say something."
923,2893042,2895291,"- Yeah.
- I have been listening very carefully."
924,2895376,2899791,"And, uh, it seems to me that this man
has some very good points to make."
925,2899875,2904500,"From what was presented at the trial,
the boy looks guilty on the surface."
926,2904583,2908666,"- But maybe if we go deeper?
- Oh, come on, will ya?"
927,2908750,2911041,There is a question I would like to ask.
928,2911125,2914416,"Let us assume that the boy
really did commit the murder."
929,2914500,2917832,"Now, this happened
at 10 minutes after 12:00."
930,2917917,2920375,"Now, how was he caught by the police?"
931,2920459,2924957,"He came back home, uh, at 3:00 or so..."
932,2925042,2928791,"and he was captured by two detectives
in the hallway of his house."
933,2928875,2933458,"Now, my question is,
if he really had killed his father..."
934,2933541,2936749,"why would he come back home
three hours later?"
935,2936833,2939707,Wouldn't he be afraid of being caught?
936,2939792,2941540,He came home to get his knife.
937,2941625,2944226,"It's not nice to go around leaving knives
sticking in people's chests."
938,2944250,2946999,"- Yeah, especially relatives.
- Yeah."
939,2947084,2949333,I don't see anything funny about it.
940,2949417,2952957,"The boy knew the knife could be identified
as the one he had just bought."
941,2953042,2955208,He had to get it before the police did.
942,2955292,2957496,"But if he knew the
knife could be identified,"
943,2957520,2959749,"why did he leave it
there in the first place?"
944,2960292,2963166,"Well, I think we can assume
the boy ran out in a state of panic..."
945,2963250,2965624,after having just killed his father.
946,2965708,2968666,"When he finally calmed down,
he realized he had left his knife there."
947,2968750,2971666,"Ah. This then depends
on your definition of panic."
948,2971750,2974124,"He would have had to be
calm enough to see to it..."
949,2974209,2976791,"that there were no fingerprints
left on the knife."
950,2976875,2980916,"Now, where did this panic start
and where did it end?"
951,2981000,2983375,"Look, you voted guilty.
What side are ya on?"
952,2983459,2986999,"I don't believe I have to be loyal
to one side or the other."
953,2987084,2988874,I'm simply asking questions.
954,2988958,2991957,"Well, this is just off the top of my head,
but, uh..."
955,2992042,2994601,"well, if I were the boy
and I'd done the stabbing and everything..."
956,2994625,2996749,"I'd take a chance
and go back for the knife."
957,2996833,2999333,"I'll bet he figured that nobody
had seen him running out..."
958,2999417,3001916,"and that the body wouldn't be discovered
till the next day."
959,3002000,3004041,"Well, after all,
it was the middle of the night."
960,3004125,3006684,"I'll bet he'd figured nobody
would find the body till the next day."
961,3006708,3008708,Pardon. This is my whole point.
962,3008792,3012500,"The woman across the street testified that
the moment after she saw the killing..."
963,3012583,3015166,"that is, a moment
after the train went by..."
964,3015250,3018249,"she screamed
and then went to telephone the police."
965,3018334,3021707,"Now, the boy certainly
must have heard the scream..."
966,3021792,3025291,"so he knew
that somebody saw something."
967,3025376,3028166,"I just don't think
that he would have gone back."
968,3028250,3031060,"Two things. One, in his state of panic,
he may not have heard the scream."
969,3031084,3032749,Perhaps it wasn't very loud.
970,3032833,3036208,"Two, if he did hear it, he may not
have connected it with his own act."
971,3036292,3039333,"Remember, he lived in a neighborhood
where screams were fairly commonplace."
972,3039417,3041874,"- There's your answer.
- Maybe."
973,3041958,3044832,"Maybe the boy did kill his father,
didn't hear the scream..."
974,3044917,3048624,"did run out in a panic,
did calm down three hours later..."
975,3048708,3051349,"and come back to get the knife,
risking being caught by the police."
976,3051417,3054333,"Maybe all of those things happened,
but maybe they didn't."
977,3054417,3057226,"I think there's enough doubt that we can
wonder whether he was there at all..."
978,3057250,3058916,during the time the killing took place.
979,3059000,3060749,"What do you mean doubt?
What are you talking about?"
980,3060833,3062540,"Didn't the old man see him
running out of the house?"
981,3062625,3064416,"He's twisting the facts, I'm telling you."
982,3064500,3067832,"Did or didn't the old man see the kid
running out of the house at 12:10?"
983,3067917,3069832,"Well, did or didn't he?"
984,3069917,3073124,"- He says he did.
- ""Says he did""? Boy! How do you like that?"
985,3073209,3076226,"- Now, look, witnesses can make mistakes.
- Sure, when you want them to, they do."
986,3076250,3078500,"Or when he wants them to, they do.
You know what I mean?"
987,3078583,3080416,"- Keep the yelling down!
- Oh, you keep saying that."
988,3080500,3082208,"Maybe what we need
is a little yelling in here."
989,3082292,3083999,"These guys
keep going off every which way."
990,3084084,3085999,"Did hear the scream.
Didn't hear the scream."
991,3086084,3089310,"What difference does it make? You people
are talking only about the little details."
992,3089334,3091893,"You're forgetting the important stuff.
I mean, all of a sudden, everybody here..."
993,3091917,3094291,"- I want to call for another vote.
- I'm talking here!"
994,3094376,3098041,"There's another vote called for.
Now let's take our seats."
995,3101917,3104458,"I never saw so much time
spent on nothing."
996,3104541,3106541,It only takes a second.
997,3107334,3110749,"Okay. I guess the fastest way
is to find out who's voting not guilty."
998,3110833,3113582,"Now, all those voting not guilty,
please raise your hands."
999,3114833,3118416,"Still the same.
One, two, three not guilty. Nine guilty."
1000,3118500,3120166,"So, now where are we?"
1001,3120250,3123666,"I'm telling you, we can yackety-yack until
next Tuesday. Where's it all getting us?"
1002,3123750,3126500,Pardon. I vote not guilty.
1003,3126583,3129582,Oh!
1004,3129667,3132957,"What are ya talking about? I mean,
we're all going crazy in here or something."
1005,3133042,3136832,"The kid is guilty.
Why don't you listen to the facts?"
1006,3136917,3139166,"Tell him, will ya?
Now this is getting to be a joke."
1007,3139250,3142458,"The vote is eight to four,
favor of guilty."
1008,3142541,3146208,"What is this, love your underprivileged
brother week or something?"
1009,3146292,3148791,"I want you to get up and tell me
why you changed your vote."
1010,3148875,3153166,"- Come on. Give me your reasons.
- I don't have to defend my decision to you."
1011,3153250,3154999,There is a reasonable doubt in my mind.
1012,3155084,3158083,"What reasonable doubt? That's nothing but words.
Here, look at this."
1013,3158167,3163083,"The kid you just decided isn't guilty
was seen ramming this into his father."
1014,3163167,3165167,"Now, what about this,
Mr. Reasonable Doubt?"
1015,3165250,3167916,"That's not the knife.
Don't you remember?"
1016,3168000,3170166,"Oh, brilliant."
1017,3170250,3172540,"I'm telling ya, this is the craziest."
1018,3172625,3174791,"I mean, what are we supposed to believe?"
1019,3174875,3177768,"I mean, you're sittin' here, you're pulling
stories out of thin air, you know?"
1020,3177792,3181500,"A guy like this, if he's, uh, sitting
ringside at the Dempsey-Firpo fight..."
1021,3181583,3184041,"he'd be trying to tell you that, uh..."
1022,3184125,3186500,"Look. Now, what about the old man?"
1023,3186583,3189226,"Are we supposed to believe that he
didn't get up and run to his door..."
1024,3189250,3192249,"and see the kid tearing down the steps
15 seconds after the killing?"
1025,3192334,3194791,"He's just saying so to be important, right?"
1026,3194875,3197726,"- I mean, what's the point of the whole thing?
- Wait. Hold it a second, will you?"
1027,3197750,3199957,"Oh, and the Baltimore rooter
is heard from again now..."
1028,3200042,3202060,"and pop-ups are fallin' for base hits
wherever we look."
1029,3202084,3205333,"Hold it a second. Now, look...
Did the old man say he ran to the door?"
1030,3205417,3206951,"Ran,
walked. What's the difference? He got on,"
1031,3206975,3208435,"didn't he? I mean,
he got there, didn't he?"
1032,3208459,3211060,"- No, now wait a second.
- He said he ran. At least I think he did."
1033,3211084,3214524,"Look, I don't remember what he said, but I
don't see how he could have run to the door."
1034,3214583,3216957,"Ηe said he went
from his bedroom to the front door."
1035,3217042,3218666,"- Now, isn't that enough?
- Where was the bedroom?"
1036,3218750,3221060,"- It was down the hall somewhere.
- I thought you remembered everything."
1037,3221084,3223333,"- Don't you remember that?
- No."
1038,3223417,3225624,"Mr. Foreman, I'd like to see
a diagram of the apartment."
1039,3225750,3228177,"Why don't we just have 'em run the trial all
over again so you can get everything straight?"
1040,3228201,3229018,Mr. Foreman.
1041,3229042,3231726,"How come you're the only one in this room
wants to see exhibits all the time?"
1042,3231750,3234458,"- I want to see this one too.
- And I'd like to stop wasting time."
1043,3234541,3237435,"If we're gonna start wading through all that
nonsense about where the body was found..."
1044,3237459,3239459,"We're not,
not unless somebody else wants to."
1045,3239500,3241208,But I'd like to find out if an old man...
1046,3241292,3243726,"who drags one foot when he walks
'cause he had a stroke last year..."
1047,3243750,3246166,"can get from his bedroom
to his front door in 15 seconds."
1048,3246250,3247916,"- He said 20 seconds.
- Ηe said 15."
1049,3248000,3250166,"He said 20 seconds.
What are you trying to distort..."
1050,3250250,3253500,"- He said 15.
- How does he know how long 15 seconds is?"
1051,3253583,3255249,You can't judge a thing like that.
1052,3255334,3257707,"- He said 15 seconds.
- He was very positive about it."
1053,3257792,3259999,"He was an old man.
Half the time he was confused."
1054,3260084,3262375,How could he be positive about anything?
1055,3270042,3274166,"I don't see what you're going to prove here.
The man said he saw the boy running out."
1056,3274250,3276416,"Well, let's see
if the details bear him out."
1057,3276500,3279381,"As soon as the body hit the floor,
he said he heard footsteps upstairs..."
1058,3279459,3281124,running toward the front door...
1059,3281209,3284291,"heard the upstairs door open,
the footsteps start down the stairs."
1060,3284376,3286559,"He said he got to his own front door
as fast as he could..."
1061,3286583,3288726,"and he swore it couldn't have been
more than 15 seconds."
1062,3288750,3290416,"Now, if the killer
began running immediately..."
1063,3290500,3292707,"- Maybe he didn't.
- The old man said he did."
1064,3292792,3295500,"You ought to be at Atlantic City
at that hairsplitters convention."
1065,3296792,3298976,"Hey, why don't you stop makin'
smart remarks all the time, huh?"
1066,3299000,3302185,"My friend, for your three dollars a day,
you have to listen to everything, you know?"
1067,3302209,3303916,"Now that you've got that thing in here,
what about it?"
1068,3304000,3306226,"All right. Here's the apartment
where the killing took place."
1069,3306250,3309291,"The old man's apartment
was directly beneath and exactly the same."
1070,3309376,3312582,"Here are the El tracks, the bedroom,
living room, kitchen, bathroom."
1071,3312667,3314667,Here's the hall. Here are the stairs.
1072,3314750,3316999,"Now, the old man
was in this bedroom right here."
1073,3317084,3319749,"He says he crossed to the door
and walked down the hall..."
1074,3319833,3322791,"opened the front door just in time
to see the boy running down the stairs."
1075,3322875,3326208,"- Am I right so far?
- That's the story, for the 19th time."
1076,3326292,3329832,"- Fifteen seconds after the body hit the floor.
- Correct."
1077,3329917,3331957,"Now, let's see. It was..."
1078,3332042,3336041,"It's 12 feet from the bed to the door.
The hall is 43 feet."
1079,3336125,3339333,"He would have had to walk 12 feet,
open the bedroom door..."
1080,3339417,3343041,"walk 43 feet down and open the front door
all in 15 seconds."
1081,3343125,3345832,"- Do you think he could have done it?
- Sure he could have done it."
1082,3345917,3348559,"He can walk only very slowly.
They had to help him into the witness chair."
1083,3348583,3350249,You make it sound like a long walk.
1084,3350334,3352666,"For an old man who had a stroke,
it is a long walk."
1085,3352750,3356166,"- Oh! What are you doing?
- I'm gonna try it, see how long it took him."
1086,3356292,3358058,"What do you mean,
you want to try it? Why didn't"
1087,3358082,3359726,"his lawyer bring it
up if it's so important?"
1088,3359750,3361003,"Maybe he just didn't think about it,
huh?"
1089,3361027,3363435,"What do you mean, didn't think of it?
You think the man's an idiot or something?"
1090,3363459,3364999,"- It's an obvious thing.
- Did you think of it?"
1091,3365084,3366749,"Listen, smart guy.
Don't matter whether I thought of it."
1092,3366833,3369143,"He didn't bring it up because he knew it would
hurt his case. What do you think of that?"
1093,3369167,3371102,"Maybe he didn't bring it
up because it would have"
1094,3371126,3373047,"meant bullying and
badgering a helpless old man."
1095,3373084,3376416,"You know that doesn't sit very well with a jury.
Most lawyers avoid it if they can."
1096,3376500,3379268,"- So, what kind of a bum is he then?
- That's what I've been asking, buddy."
1097,3379292,3382333,"Pass me that chair, will you?
Those two chairs are the old man's bed."
1098,3382417,3385291,"I just paced off 12 feet across the room.
This will be the bedroom door."
1099,3385376,3387999,"Oh, that's crazy.
You can't recreate a thing like that."
1100,3388084,3390291,"- I'd like to see it.
- The hall was 43 feet."
1101,3390376,3392376,I'll pace from that wall and back again.
1102,3393667,3397500,"Look, this is absolutely insane. What are
you wasting everybody's time in here for?"
1103,3397583,3400503,"According to you, it'll only take 15 seconds.
Now, we can spare that, see."
1104,3404417,3406083,Come on. Knock it off.
1105,3406167,3407666,Okay.
1106,3407750,3409791,"Okay. Okay, killer."
1107,3409875,3411875,Yeah.
1108,3413792,3415832,"Will you stand right there
and mark the front door?"
1109,3415917,3418416,"It was chain-locked according
to the testimony, remember?"
1110,3418500,3420666,"- Has anybody got a watch with a second hand?
- I have."
1111,3420750,3423226,"When you want me to start, stamp your foot.
That'll be the body falling."
1112,3423250,3425166,You can time me from there.
1113,3425250,3427333,"What are we gonna do, play charades now?"
1114,3427417,3429517,"- Come on! What are we waiting for?
- Okay, I'm ready."
1115,3429541,3431458,"Well, I want to wait
till the second hand reaches 60."
1116,3431541,3433541,"Oh, come on."
1117,3440167,3443166,"Come on. Speed it up.
He could walk twice as fast as that."
1118,3444625,3447083,"You want me to walk faster than that,
I will."
1119,3463958,3466416,Lock. Door. Stop.
1120,3466500,3468500,"- Right.
- What's the time?"
1121,3468583,3471832,"Uh, exactly 41 seconds."
1122,3471917,3474166,This is what I think happened.
1123,3474250,3477143,"The old man heard the fight between the boy
and his father a few hours earlier."
1124,3477167,3480060,"Then when he's lying in bed, he heard the
body hit the floor in the boy's apartment..."
1125,3480084,3481878,"heard the woman scream
from across the street,"
1126,3481902,3483643,"got to his front door
as fast as he could..."
1127,3483667,3486249,"heard somebody racing down the stairs
and assumed it was the boy."
1128,3486334,3488166,"- I think that's possible.
- Assumed?"
1129,3488250,3490749,Oh.
1130,3490833,3493725,"Brother, I've seen all kinds
of dishonesty in my day,"
1131,3493749,3496791,"but this little display
takes the cake."
1132,3496875,3499132,"You all come in here
with your hearts bleeding"
1133,3499156,3501582,"all over the floor about
slum kids and injustice."
1134,3501667,3503667,You listen to some fairy tales.
1135,3503750,3506101,"Suddenly you start getting through
to some of these old ladies."
1136,3506125,3509083,"Well, you're not getting through to me.
I've had enough."
1137,3509167,3511208,What's the matter with you guys?
1138,3511292,3513999,"You all know he's guilty!
He's got to burn!"
1139,3514084,3515874,"You're letting him slip
through our fingers."
1140,3515958,3518166,"""Slip through our fingers""?
Are you his executioner?"
1141,3518250,3520250,I'm one of 'em!
1142,3521084,3522916,Perhaps you'd like to pull the switch.
1143,3523000,3525000,"For this kid, you bet I would."
1144,3525084,3528333,"I feel sorry for you. What it must
feel like to want to pull the switch."
1145,3529209,3531039,"Ever since you walked
into this room, you've"
1146,3531063,3533124,"been acting like a
self-appointed public avenger."
1147,3533209,3537500,"You want to see this boy die because you
personally want it, not because of the facts."
