Number,StartMilliseconds,EndMilliseconds,Text
414,1366583,1368707,"Look, your turn down there.
Let's go."
415,1370042,1372934,"Oh, I didn't expect a turn. I thought
you were all gonna try to convince me."
416,1372958,1374707,"- Wasn't that the idea?
- Check. That was the idea."
417,1374792,1377060,"- Oh, I forgot about that. He's right.
- What difference does it make?"
418,1377084,1379476,"He's the one who's keeping us in here.
Let's hear what he's got to say."
419,1379500,1382208,"Oh, now wait a minute.
We decided to do this a certain way."
420,1382292,1383916,I think we ought to stick to that way.
421,1384000,1386000,"Oh, stop being a kid, will you?"
422,1386084,1388143,"- What do you mean ""a kid""?
- What do you think I mean?"
423,1388167,1390167,K-I-D. Kid.
424,1392376,1396041,"What? Listen, just because I'm trying
to keep this thing organized?"
425,1396125,1398249,"Here, you take it.
You take on the responsibility."
426,1398334,1400208,"I'll just... I'll keep my mouth shut.
That's all."
427,1400292,1402352,"What are you getting so hot about?
Calm down, will you?"
428,1402376,1403707,Don't tell me to calm down.
429,1403792,1405976,"Here. You wanna take the chair,
just take the chair. That's all."
430,1406000,1408517,"- Did you ever see such a thing?
- See if you can keep it running."
431,1408541,1410559,"- Listen, you think it's funny or something?
- Hey, forget it, fella."
432,1410583,1412166,"The whole thing's unimportant.
Come on."
433,1412250,1415375,"- Unimportant? Oh, here, you try it.
- No, nobody wants to change."
434,1415459,1417208,"You're doing a beautiful job.
Sit down."
435,1417292,1420124,"Yeah, you're doing great.
Just great, fella."
436,1420209,1422209,You stay in there and pitch. You know?
437,1423042,1425249,All right. Let's hear from somebody.
438,1426750,1430832,"Well, if you want me to tell you how I
feel about it, it's all right with me."
439,1430917,1433041,"Boy, I don't care what you do."
440,1433125,1435999,"All right, I don't have anything brilliant."
441,1436084,1438208,I only know as much as you do.
442,1438292,1442041,"According to the testimony,
the boy looks guilty. Maybe he is."
443,1442125,1446291,"I sat there in court for six days
listening while the evidence built up."
444,1446917,1448624,"Everybody sounded so positive, you know?"
445,1448708,1451166,"I... I began to get a peculiar feeling
about this trial."
446,1451250,1453333,"I mean, nothing is that positive."
447,1453417,1455540,"There are a lot of questions
I'd have liked to ask."
448,1455625,1458333,"I don't know. Maybe they wouldn't
have meant anything, but..."
449,1458417,1460435,"I began to get the feeling
that the defense counsel..."
450,1460459,1462957,"wasn't conducting a thorough-enough
cross-examination."
451,1463042,1466416,"I mean, he... he let too many things go by,
little things that..."
452,1466500,1469249,"What little things? Listen,
when these fellas don't ask questions..."
453,1469334,1471893,"it's because they know the answers already
and they figure they'll be hurt."
454,1471917,1475832,"Maybe it's also possible for a lawyer
to be just plain stupid, isn't it?"
455,1475917,1477208,I mean it's possible.
456,1477292,1479292,"You sound like you met
my brother-in-law once."
457,1482042,1484749,"I... I kept putting myself
in the kid's place."
458,1486583,1488707,"I'd have asked for another lawyer, I think."
459,1488792,1491333,"I mean, if I was on trial for my life..."
460,1491417,1496208,"I'd want my lawyer to tear the prosecution
witnesses to shreds, or at least try to."
461,1496292,1500249,"Look, there was one alleged eyewitness
to this killing."
462,1500792,1504166,"Someone else claims he heard the killing,
saw the boy run out afterwards."
463,1504250,1506375,"And there was a lot
of circumstantial evidence."
464,1506459,1509957,"But actually, those two witnesses
were the entire case for the prosecution."
465,1510042,1511832,Supposing they're wrong.
466,1511917,1513707,"What do you mean
supposing they're wrong?"
467,1513792,1515666,"What's the point
of having witnesses at all?"
468,1515750,1518375,"- Could they be wrong?
- What are you trying to say?"
469,1518459,1519999,Those people sat on the stand under oath.
470,1520084,1521624,"They're only people.
People make mistakes."
471,1521708,1523708,Could they be wrong?
472,1524209,1527124,"- Well, no, I don't think so.
- Do you know so?"
473,1527209,1529041,"Oh, come on.
Nobody can know a thing like that."
474,1529125,1530832,This isn't an exact science.
475,1530917,1532917,That's right. It isn't.
476,1537417,1540166,"Okay, let... Let's get to the point."
477,1540250,1542832,"What about the switch knife
they found in the old man's chest?"
478,1542917,1545393,"Uh, wait-wait a minute.
There's some people who haven't talked yet."
479,1545417,1547476,"- Shouldn't we go in order?
- They'll get a chance to talk."
480,1547500,1549832,"Be quiet a second, will you?"
481,1549917,1551208,"What about it, this..."
482,1551292,1554749,"the knife this fine upright boy
admitted buying the night of the killing?"
483,1554833,1556166,Let's talk about it.
484,1556250,1558559,"All right, let's talk about it.
Let's get it in here and look at it."
485,1558583,1560333,"I'd like to see it again.
Mr. Foreman?"
486,1560417,1563500,"- We all saw what it looks like.
- Why do we have to see it again?"
487,1563583,1565704,"The gentleman has a right
to see exhibits in evidence."
488,1567750,1569208,"Say, could you bring us the knife?"
489,1569292,1571292,"- Knife?
- Yeah. Thank you."
490,1572750,1575999,"The knife and the way it was bought
is pretty strong evidence, don't you think?"
491,1576084,1577749,"- I do.
- Good."
492,1577833,1580333,"Now, suppose we take these facts
one at a time."
493,1580417,1583666,"One. The boy admitted going out of the house
at 8:00 on the night of the murder..."
494,1583750,1585666,"after being slapped several times
by his father."
495,1585750,1588500,"No, no. No, he didn't say ""slapped.""
He said ""punched."""
496,1588583,1590999,"There's a difference
between a slap and a punch."
497,1591084,1593666,"After being hit several times
by his father."
498,1593750,1595999,"Two. He went directly
to a neighborhood junk shop..."
499,1596084,1598208,"...where he bought one of those...
- Switch knives."
500,1598292,1600292,Switchblade knives.
501,1600376,1602166,"This wasn't what you'd call
an ordinary knife."
502,1602250,1604749,"It had a very unusual carved handle
and blade."
503,1604833,1606333,The storekeeper who sold it to him...
504,1606417,1609540,"said it was the only one of its kind
he had ever had in stock."
505,1609625,1613375,"Three. He met some friends of his
in front of a tavern about 8:45."
506,1613459,1614957,Am I right so far?
507,1615042,1617166,"- Yes, you are.
- You bet he is."
508,1617250,1620416,"He talked with his friends for about
an hour, leaving them at 9:45."
509,1620500,1623458,"During this time,
they saw the switch knife."
510,1623541,1625333,Four.
511,1625417,1627832,"They identified the death weapon
in court..."
512,1627917,1630416,as that very same knife.
513,1630500,1633291,Five. Ηe arrived home at about 10:00.
514,1633376,1635768,"Now this is where the stories
offered by the State and the boy..."
515,1635792,1637707,begin to diverge slightly.
516,1637792,1640375,"He claims that he went to a movie
at about 11:30..."
517,1640459,1644500,"returning home at 3:10 to find his
father dead and himself arrested."
518,1644583,1646684,"He also claims that
the two detectives who arrested him..."
519,1646708,1648999,threw him down a half a flight of stairs.
520,1649084,1650916,"Now, what happened to the switch knife?"
521,1651000,1653684,"He claims that it fell through a hole
in his pocket on the way to the movies..."
522,1653708,1658375,"sometime between 11:30 and 3:10
and that he never saw it again."
523,1658459,1660459,"Now there's a tale, gentlemen."
524,1660500,1663999,"I think it's quite clear that the boy
never went to the movies that night."
525,1664084,1666084,"No one in the house
saw him go out at 11:30."
526,1666125,1667624,No one at the theater identified him.
527,1667708,1670029,"He couldn't even remember
the names of the pictures he saw."
528,1672875,1674582,"- What actually happened is this.
- Thank you."
529,1674667,1677874,"The boy stayed home,
had another fight with his father..."
530,1677958,1681666,"stabbed him to death and left the
house at 10 minutes after 12:00."
531,1681750,1684500,"He even remembered to wipe the knife
clean of fingerprints."
532,1684583,1687208,"Now are you trying to tell me
that this knife..."
533,1687292,1689208,"really fell through a hole
in the boy's pocket..."
534,1689292,1691726,"someone picked it up off the street,
went to the boy's house..."
535,1691750,1694416,"and stabbed his father with it
just to test its sharpness?"
536,1694500,1696559,"No. I'm just saying it's possible
the boy lost his knife..."
537,1696583,1698851,"and that somebody else stabbed his father
with a similar knife."
538,1698875,1700083,It's just possible.
539,1700167,1702167,Take a look at this knife.
540,1703667,1705874,It's a very unusual knife.
541,1705958,1707500,I've never seen one like it.
542,1707583,1710375,"Neither had the storekeeper
who sold it to the boy."
543,1710459,1713416,"Aren't you asking us to accept
a pretty incredible coincidence?"
544,1713500,1715832,I'm just saying a coincidence is possible.
545,1715917,1717917,And I say it's not possible.
546,1724042,1725749,Where did that come from?
547,1725833,1727208,"- Where'd you get that?
- It's the same knife."
548,1727292,1728791,What do you think you're doing?
549,1728875,1730500,Where did you get it?
550,1730583,1732832,"I went out walking
for a couple of hours last night."
551,1732917,1734917,I walked through the boy's neighborhood.
552,1735000,1737999,"I bought that at a little pawnshop
just two blocks from the boy's house."
553,1738084,1739540,It cost six dollars.
554,1739625,1742749,"It's against the law
to buy or sell switchblade knives."
555,1742833,1745083,That's right. I broke the law.
556,1745167,1749166,"Listen, you pulled a real bright trick.
Now, supposing you tell me what it proves."
557,1749250,1751333,"Maybe there are 10 knives like that.
So what?"
558,1751417,1754208,"- Maybe there are.
- Well, what does it mean?"
559,1754292,1757612,"You found another knife like it. What's that,
the discovery of the age or something?"
560,1757667,1760060,"You mean you're asking us to believe
that somebody else did the stabbing..."
561,1760084,1761874,with exactly the same kind of knife?
562,1761958,1763208,The odds are a million-to-one.
563,1763292,1765999,"- It's possible.
- But not very probable."
564,1767209,1769209,"Okay, fellas, let's take our seats."
565,1769292,1771453,"There's no point in standing around
all over the place."
566,1772958,1776375,"You know, it's interesting that he'd find a
knife exactly like the one the boy bought."
567,1776459,1779208,"What's interesting about it?
""Interesting."""
568,1779292,1781166,"Well, I don't know.
I just thought it was interesting."
569,1781250,1783041,"There are still 11 of us here
who think he's guilty."
570,1783125,1785416,"- Right.
- What do you think you're gonna accomplish?"
571,1785500,1787333,You're not gonna change anybody's mind.
572,1787417,1789791,"So if you wanna be stubborn
and hang this jury, go ahead."
573,1789875,1792916,"The kid will be tried again
and found guilty sure as he's born."
574,1794459,1796333,That's probably right.
575,1796417,1799624,"So what are you gonna do?
You know, we could be here all night."
576,1799708,1802957,It's only one night. A boy may die.
577,1803042,1805582,"Well, why don't we just
set up house here, huh?"
578,1805667,1808148,"Someone send for Potsy the policeman
and get a pinochle deck..."
579,1808209,1810707,"and, uh, we'll just
sweat the whole thing out right here."
580,1812209,1815310,"- I don't think he ought to joke about it.
- What do you want me to do about it?"
581,1815334,1818999,"Oh, listen! I don't see what all this stuff
about the knife's got to do with anything."
582,1819084,1821999,"Somebody saw the kid stab his father.
What more do we need?"
583,1822084,1824874,"You guys can talk the ears right off my head.
You know what I mean?"
584,1824958,1827666,"I got three garages of mine goin' to pot
while you're talking."
585,1827750,1829416,So let's get done and get outta here.
586,1829500,1832916,"The knife was very important to the
district attorney. He spent a whole day..."
587,1833000,1835481,"He's a 15th assistant or something.
What does he know about it?"
588,1835541,1836999,"Hey, let's hold it down."
589,1837084,1839416,"These side arguments
are only slowing us up."
590,1842292,1843666,"Well, what about it?"
591,1843750,1845750,You're the only one.
592,1853167,1855208,"I have a proposition
to make to all of you."
593,1856292,1858292,I'm gonna call for another vote.
594,1859500,1864707,"I want you 11 men to vote
by secret written ballot."
595,1864792,1866832,I'll abstain.
596,1866917,1869707,"If there are 11 votes for guilty,
I won't stand alone."
597,1869792,1873582,"We'll take in a guilty verdict
to the judge right now."
598,1875042,1878749,"But if anyone votes not guilty,
we stay here and talk it out."
599,1882084,1884999,"Well, that's it.
If you want to try it, I'm ready."
600,1885084,1886540,All right. Let's do it the hard way.
601,1886625,1888540,"Okay, that sounds fair.
Everyone agreed?"
602,1888625,1890707,"- Anyone doesn't agree?
- Fine, fine. Let's go."
603,1890792,1891832,"Here, pass these along."
604,1891917,1893917,Is that the right time?
605,1925708,1933700,"""Guilty."""
606,1955583,1958208,"""Not guilty."""
607,1958292,1959707,"""Guilty."""
608,1959792,1961458,"Boy, how do you like that?"
609,1961541,1963999,"Oh, and another chap flaps his wings."
610,1964084,1966832,"All right, who was it?
Come on. I want to know."
611,1966917,1969166,Excuse me. This was a secret ballot.
612,1969250,1970791,"We all agreed on that, no?"
613,1970875,1972999,"If the gentleman wanted
to remain secret..."
614,1973084,1974957,Secret? What do you mean secret?
615,1975042,1978249,"There are no secrets in a jury room.
I know who it was."
616,1979000,1980916,"Brother, you really are something."
617,1981000,1983000,"You sit here, vote guilty
like the rest of us..."
618,1983084,1986375,"and then some golden-voiced preacher
starts tearin' your poor heart out..."
619,1986459,1989749,"about some underprivileged kid
just couldn't help becomin' a murderer..."
620,1989833,1991333,and you change your vote.
621,1991417,1993540,If that isn't the most sick...
622,1993625,1997291,"Why don't you drop a quarter
in his collection box?"
623,1997376,1999376,"Oh, now just wait a minute."
624,1999417,2000999,"Listen, you can't talk to me like that."
625,2001084,2002916,"- No. Who do you think you are?
- Calm down. Calm down."
626,2003000,2005333,"No. Who does he think he is?
Did you hear him?"
627,2005417,2007436,"It doesn't matter. He's
very excitable. Sit down."
628,2007460,2008874,"Excitable? You
bet I'm excitable!"
629,2008958,2011791,"We're trying to put a guilty man
in the chair where he belongs!"
630,2011875,2014540,"Someone starts telling us fairy tales,
and we're listenin'!"
631,2014625,2016375,"Hey, uh, come on, huh?"
632,2016459,2018375,What made you change your vote?
633,2018459,2020083,He didn't change his vote.
634,2020167,2021333,I did.
635,2021417,2023417,"- Oh, fine.
- I knew it."
636,2023459,2025459,Would you like me to tell you why?
637,2025500,2027375,"No, I wouldn't like you to tell me why."
638,2027459,2029999,"I'd like to make it clear anyway,
if you don't mind."
639,2030084,2031582,Do we have to listen to this?
640,2031667,2033416,The man wants to talk.
641,2033500,2035083,Thank you.
642,2035167,2038500,"This gentleman has been
standing alone against us."
643,2038583,2040832,"Now, he doesn't say
the boy is not guilty."
644,2040917,2042917,He just isn't sure.
645,2042958,2045791,"Well, it's not easy to stand alone
against the ridicule of others."
646,2045875,2048999,"So he gambled for support,
and I gave it to him."
647,2049084,2050791,I respect his motives.
648,2050875,2055416,"The boy on trial is probably guilty,
but, uh, I want to hear more."
649,2055500,2057291,"Right now, the vote is 10 to two."
650,2057376,2059624,"I'm talking here!
You have no right to leave this room!"
651,2059708,2061582,He can't hear you. He never will.
652,2061667,2063667,Let's sit down.
653,2067417,2069624,Shall we continue?
654,2069708,2071916,"Well, I... I think we ought
to take a break."
655,2072000,2076124,"You know, one man's inside,
and I think we ought to wait for him."
656,2076209,2079166,Okay.
657,2079250,2081250,"Looks like we're really
hung up here, huh?"
658,2082376,2084736,"And that thing with the old man,
that was pretty unexpected."
659,2086792,2089249,"I wish I could figure out some way
we could break it up."
660,2092376,2095832,"You know, in advertising...
I told you I worked in an agency."
661,2095917,2096916,Mm-hmm.
662,2097000,2099060,"Well, there's some pretty strange people
working there."
663,2099084,2101166,"Well, they're not strange really, I guess."
664,2101250,2103874,"It's just that they have peculiar ways
of expressing themselves."
665,2103958,2105208,You know what I mean.
666,2105292,2107692,"Of course, I suppose it's the same
in your business too, huh?"
667,2108250,2109749,What do you do?
668,2109833,2111999,"- I'm a watchmaker.
- Oh, really?"
669,2112084,2115291,"Well, I imagine the finest watchmakers
in the world come from Europe, huh?"
670,2115376,2118435,"Anyway, as I was telling you, in an
agency, when we reach a point like this..."
671,2118459,2121979,"I'm telling him about, in an ad agency, when
a point like this is reached in a meeting..."
672,2122042,2124666,"there's always some character
ready with an idea, see."
673,2124750,2126750,And it kills me.
674,2126792,2128291,It's the weirdest thing in the world...
675,2128376,2131707,"the way they sometimes precede their idea
with a little phrase, see, like..."
676,2131792,2134707,"Some account exec will get up,
and he'll say, uh..."
677,2134792,2136624,"""Okay, here's an idea."
678,2136708,2140333,"Let's, uh, run it up the flagpole
and see if anyone salutes it."""
679,2140417,2143540,"I mean, it's idiotic, but it's funny, huh?"
680,2143625,2148124,"I, uh
- I got a little excited back there. I..."
681,2149125,2151125,didn't mean to get nasty.
682,2151750,2155540,"I'm glad you're not one of those
lets these emotional appeals influence him."
683,2156708,2158957,Uh...
684,2172209,2175209,"I don't know what's the matter with that fan.
Can't seem to get it to start."
685,2176292,2178832,"♪ Be, be, be ♪"
686,2178917,2180999,"♪ Ba, ba, ba, ba, bum ♪♪"
687,2181583,2183583,Eh!
688,2184625,2186832,"Hey, you a salesman?"
689,2186917,2188917,I'm an architect.
690,2189250,2190582,Hmm.
691,2190667,2192916,You know what the soft sell is?
692,2195833,2197833,"Boy, you got it. Believe me."
693,2199417,2201417,I got a different technique.
694,2201917,2203707,"Laughs, drinks, jokes."
695,2203792,2206041,Tricks. You know?
696,2206875,2208875,Yeah.
697,2209541,2211749,"""Hit 'em where they live.""
That's my motto."
698,2213167,2215916,"I made 27 grand last year
sellin' marmalade."
699,2216750,2219249,"That's not bad. I mean,
you know, considering marmalade."
700,2222459,2224459,"Hey, what are you
gettin' outta this... kicks?"
701,2226417,2229060,"Or did somebody bump you on the head
one time and you haven't gotten over it?"
702,2229084,2231084,Maybe.
703,2231792,2234333,"You know, you do-gooders are all alike."
704,2234417,2237083,"You're always blowing your stacks
over some guy that fanned."
705,2240167,2242167,But what are you wasting our time for?
706,2242750,2246791,"Why don't you donate five dollars to the
cause, and maybe it'll make you feel better."
707,2250084,2252333,"This kid is guilty, pal."
708,2252417,2254832,It's as plain as the nose on your face.
709,2254917,2257166,"So why don't we stop
wasting our time here?"
710,2257250,2260166,"We're gonna all get sore throats
if we keep it up, you know?"
711,2260250,2262930,"What difference does it make
if you get it here or at the ball game?"
712,2263583,2266500,"Oh, no difference, pal."
713,2266583,2268583,No difference at all.
714,2280292,2282166,"Nice bunch of guys, huh?"
715,2282250,2284540,"Oh, they're about the same
as anyone else."
716,2284625,2287416,"Phew! Boy, what a murderous day."
717,2288417,2290458,You think we'll be much longer?
718,2290541,2292166,I don't know.
719,2292250,2294166,"Aw, he's guilty for sure."
720,2294250,2295791,Not a doubt in the whole world.
721,2295875,2298416,"We should...
Should've been done already."
722,2300667,2301916,"Oh, I don't mind, you know."
723,2302000,2304416,Hmm. Beats workin'.
724,2308084,2310084,Uh...
725,2311625,2313707,"You think he's not guilty, huh?"
726,2313792,2315792,I don't know. It's possible.
727,2316376,2320166,"Well, I don't know you, but I'm bettin'
you never been wronger in your life."
728,2320250,2322666,"You're wasting your time.
You ought to wrap it up."
729,2322750,2324916,"Supposing you were the one
who was on trial."
730,2325750,2327624,"Well, I'm not used to supposing."
731,2327708,2332208,"I'm just a workingman.
My boss does the supposing. But..."
732,2332292,2334292,"Well, I'll try one."
733,2335000,2340666,"Supposing you talk us all out of this, and,
uh, the kid really did knife his father. Huh?"
734,2349583,2350874,Are you ready?
735,2350958,2352166,Hup.
736,2352250,2353166,That one.
737,2353250,2355250,"Sorry, blue eyes."
738,2355833,2359249,"- Well, where else...
- Okay, fellas, let's take our seats."
739,2359334,2361249,"Looks like we'll be here
for dinner, huh?"
740,2361334,2363707,"Okay, now let's...
Let's get down to business."
741,2363792,2365166,"Now, who wants to start it off?"
742,2365250,2366666,"- I would.
- Okay, go."
743,2366750,2368832,You down there.
744,2368917,2372791,"The old man who lived downstairs says he
heard the kid yell out, ""I'm gonna kill ya."""
745,2372875,2375500,"A second later,
he heard the body hit the floor."
746,2375583,2379458,"Now, he ran to the door and he saw the kid
running down the stairs and out of the house."
747,2379541,2380916,What does that mean to you?
748,2381000,2382657,"I was wondering how
clearly the old man could"
749,2382681,2384435,"have heard the boy's
voice through the ceiling."
750,2384459,2386559,"He didn't hear it through the ceiling.
The window was open."
751,2386583,2388416,"So was the one upstairs.
It was a hot night, remember?"
752,2388500,2389832,"Well, it was another apartment."
753,2389917,2392559,"It's not that easy to identify a voice,
particularly a shouting voice."
754,2392583,2394166,"- He identified it in court.
- That's right."
755,2394250,2395707,"And don't forget the lady
across the street."
756,2395792,2398582,"She looked right in the open window
and saw the boy stab his father."
757,2398667,2401124,"- Now, I mean, isn't that enough for you?
- No, it isn't."
758,2401209,2403209,"Boy, how do you like this guy, huh?"
759,2403250,2405083,It's like talking into a dead phone.
760,2405167,2408333,"She said she saw the killing through the
windows of a moving elevated train."
761,2408417,2411916,"There were six cars on the train.
She saw the killing through the last two cars."
762,2412000,2413832,"She remembered
the most insignificant details."
763,2413917,2415957,I don't see how you can argue with that.
764,2416042,2420582,"Has anybody here any idea
how long it would take an el..."
765,2429250,2430832,Hey!
766,2430917,2432917,This isn't a game.
767,2436708,2438957,"- Did you see him?
- Hey."
768,2439042,2440791,"- The nerve.
- All right, listen..."
769,2440875,2444124,"- The absolute nerve.
- Forget it. It's not important."
770,2444209,2446209,"- ""This isn't a game""?
- Calm down."
771,2446250,2449582,"- Who does he think he is?
- I'm telling you, forget it now."
772,2449667,2452999,"Has anybody any idea how long
it takes an elevated train..."
773,2453084,2454916,"going at medium speed
to pass a given point?"
774,2455000,2456874,"- What has that to do with anything?
- How long? Take a guess."
775,2456958,2459624,"- I wouldn't have the slightest idea.
- What do you think?"
776,2459708,2461708,"I don't know. Maybe 10, 12 seconds?"
777,2462583,2464249,"I think that's a pretty good guess.
Anyone else?"
778,2464334,2467124,"- That sounds right to me.
- Come on. What's the guessing game for?"
779,2467209,2469041,"- What do you say?
- Ten seconds is about right."
780,2469125,2471041,"All right. Say 10 seconds.
What are you getting at?"
781,2471125,2476166,"This. It takes a six-car El train
10 seconds to pass a given point."
782,2476250,2478187,"Now let's say the
given point is the open"
783,2478211,2480500,"window of the room
where the killing took place."
784,2480583,2483874,"You can reach out of that window
and almost touch the El tracks, right?"
785,2483958,2485458,Now let me ask you this.
786,2485541,2487791,"Has anyone here
ever lived near the El tracks?"
787,2487875,2491500,"Well, uh, I just finished painting an
apartment that overlooked an El line."
788,2491583,2493249,"- I was there for three days.
- What was it like?"
789,2493334,2494500,"- What do you mean?
- Noisy?"
790,2494583,2497124,"Oh, brother. Don't matter though.
We were all punchy."
791,2497209,2499791,"I lived in a second-floor apartment
near the El line once."
792,2499875,2502996,"When the window was open and the train
goes by, the noise is almost unbearable."
793,2503042,2505893,"- You can hardly hear yourself think.
- All right, you can't hear yourself think."
794,2505917,2508333,"- Will you get to the point?
- I will. Now just a minute."
795,2508417,2512041,"Let's take two pieces of testimony
and try to put them together."
796,2512125,2516208,"First. The old man in the
apartment downstairs."
797,2516292,2518874,"He says he heard the boy say
""I'm gonna kill you""..."
