Number,StartMilliseconds,EndMilliseconds,Text
1,93975,94975,Talk.
2,95176,96176,Talk.
3,99414,100574,"For the last time,"
4,101928,104829,"release Abdel Salman Al-Arkan
from his prison in Paris."
5,106115,109949,"This is Lucas Graves, IDP News,
signing off."
6,110961,113575,Please. They're gonna kill us all!
7,120535,124733,"Release him, or the execution plays live
in 45 minutes."
8,131045,132342,They're gonna kill us.
9,135783,136875,Stay strong.
10,142023,143888,Destination confirmed.
11,145092,147185,You should kill them.
12,148629,152292,"A powerful statement, a
Westerner killing his own people."
13,158639,160732,Recalculating route.
14,167381,169440,They should have called.
15,170918,172787,They should have called already!
16,191806,193637,"No. No. No, please!"
17,205253,206253,Please don't kill me!
18,249063,250063,Go. Go!
19,252033,253523,Come on. Move. Go!
20,256304,258864,They're getting away! Let's go! Let's go!
21,266547,267673,Go.
22,285600,286999,I'll take the north side.
23,287368,288392,OK!
24,328409,329876,Keep searching the southside.
25,330111,331544,Lock down the perimeter.
26,342790,345088,Shit. He's not here.
27,362076,363771,Get them on the truck now.
28,366614,368013,Let's go! Let's go!
29,374622,376954,Kimbral's not here. He's got the keys.
30,385433,386491,Come on!
31,391472,392530,What the fuck was that?
32,393708,394766,"We got to go, Shu."
33,394842,396139,"Come on, come on, come on."
34,398379,400176,Where the hell's Kimbral?
35,405386,407684,"You are 40 seconds late, Kimbral."
36,411192,412192,"Go, go!"
37,412993,413993,Where the hell were you?
38,430478,433140,"- She's been shot.
- Give me room. Give me room!"
39,434415,436406,Alice. Alice!
40,438152,439210,Come on.
41,442223,443223,Damn it.
42,449730,450730,Abby!
43,451365,453663,"Move, move, move, move, move.
What happened?"
44,454101,455329,She's shot in the chest.
45,456003,457868,What the hell took you guys so long?
46,458272,460001,Shit. Fuck.
47,461108,462108,Okay.
48,464779,465779,"Oh, God."
49,470351,471579,She's gone.
50,472086,473086,Shit.
51,474355,475379,This is on you.
52,477424,478516,What the hell happened?
53,483397,484397,Goddamn it.
54,491438,492803,What happened?
55,499747,502545,"I had a chance to blow their weapons load,
and I took it."
56,502616,505278,"- It wasn't part of the fucking plan!
- I factored it in."
57,505386,507278,"- Oh, you factored it in?
- The route I took, the speed..."
58,507288,510553,"- Where were you?
- Did you use your computer program?"
59,511592,513992,"Shu, there was less than point zero zero..."
60,514962,517726,"Shu, the algorithm was solid."
61,529977,531103,You lost a hostage?
62,531745,533406,Bossman's gonna be pissed.
63,536584,538347,"Get us the fuck out of here, Hush."
64,569383,572147,"- You wanted to see me?
- Yeah. Come on in and sit down."
65,580728,581888,I'm letting you go.
66,583230,584720,"- What?
- I'm letting you go."
67,585799,587824,I won't be needing your services anymore.
68,590537,592630,"You know,
the most important thing in this job"
69,592706,594469,"is knowing you can trust the guy
next to you."
70,596176,600044,"I told you before.
This program of yours, it wasn't ready,"
71,600147,601978,and you defied the team.
72,602049,604210,"My program's not ready,
or you just don't like it?"
73,605085,606085,A woman died.
74,606153,609145,"Could've happened without the algorithm.
Don't you put that on me."
75,609223,611748,"You want to make all these excuses up
in your head: Algorithm."
76,611859,613690,"Whatever it is, someone died"
77,613761,616662,"because you trusted a computer
more than your own team."
78,616730,617730,You got to go.
79,632713,633941,Told you we expanded too fast.
80,634048,636329,"You gonna sit there and bust my balls
or get back to work?"
81,638085,640519,"Next time, I'll listen to you... maybe."
82,647728,650128,"How do you say, quote, ""I am stupid""?"
83,651699,654190,I'm stupid...
84,654768,656429,Why do you want to learn Qingdao?
85,657404,660703,"It's almost impossible
for a Western ear to decipher."
86,660774,661774,I like the impossible.
87,663477,666412,"This game, Go, is interesting."
88,666814,668406,Why do you think you win all the time?
89,669583,671813,"Because I've been playing Go
since I was four,"
90,672586,674884,and you started two years ago.
91,675622,677146,You move everything together.
92,677925,680086,You take the territory as one.
93,680160,684256,"You take my pieces as one.
Everything flows as one."
94,685099,688626,"When you were at the factory,
none of your guys moved together."
95,688736,690328,You didn't flow as one.
96,690437,692234,Kimbral was trying to upstage you.
97,694174,695402,Maybe I should work alone.
98,697244,698438,No one does it alone.
99,699413,703349,"I guess that's why I hear your voice
in my head when I am on the job."
100,703984,707317,"It may sound like me,
but I think that voice is your intuition."
101,708689,710782,"Take all the time you need,"
102,710858,714259,"but when you come back,
I need you to be a team player."
103,717631,718757,Don't be like Kimbral.
104,719600,721864,Don't confuse intuition with ego.
105,722870,727102,"Trust me on this one, Shu.
Always listen to your intuition."
106,727841,728865,Always.
107,743457,745857,The original communication satellite
108,745959,748860,set out to solve one problem...
109,749897,753993,"how to send a signal successfully
around the bend in the Earth"
110,754501,756128,and reach the receiver.
111,756203,760230,"Today, we at Yusheng Technology
are proud to present to you"
112,760340,762535,the future of satellite tech.
113,762643,764975,"We do it faster, with smaller units..."
114,765045,767536,"Now this is where the graphics
are gonna change?"
115,767648,770208,I don't need graphics!
116,770317,772251,This isn't Cirque de Soleil.
117,772352,775219,"Maybe a tiger can jump out when
I get to the cubesats."
118,775355,776515,Chin!
119,776590,777716,A little help here please.
120,778225,780989,What? I like tigers.
121,782029,785055,"Okay, everyone,
let's reset and go again in five."
122,787201,788259,"- Yusheng?
- Huh?"
123,791772,793899,"Don't worry, little bro. You'll be great."
124,796076,797076,Thank you.
125,811959,813517,I didn't expect to see you here.
126,814628,816596,Your job keeps you busier than I am.
127,817865,820891,"Who knew being a security specialist
was so time-consuming?"
128,820968,822868,I have a job next week in Macao.
129,822936,824460,So you were in the neighborhood.
130,832246,833645,"It's great to see you, Chin."
131,833747,836238,"I wish I could say
the same thing about your brother."
132,836817,838284,What can I help you with?
133,838785,840252,Yusheng is in trouble.
134,840888,843254,"Genius or not, he's careless."
135,843323,845553,"- Lot of people want to see him die.
- Who?"
136,845626,848754,"A company called Ruscho
is who I'm most worried about."
137,848829,850990,"They're a tech giant
headquartered in Geneva,"
138,851098,854727,"and they tried to buy Yusheng out
three times already, and he's refused."
139,855335,858304,"These are not the kind of guys
who take no for an answer."
140,858805,861603,"He's going to Bangkok this weekend
for a bachelor party,"
141,862342,863900,and he won't take a bodyguard.
142,868482,869506,I'll pay you.
143,874788,877951,We are family. Not necessary.
144,896710,899679,Party's over. Let's go. It's not safe here.
145,900314,901941,I'm glad you're here.
146,902482,903676,"OK, cousin."
147,904184,905208,I'm taking you home.
148,991471,995271,I am Galileo. You are inmate 1764.
149,996143,999271,"I repeat, you are inmate 1764."
150,1000247,1001441,Welcome to Hades.
151,1035015,1037449,"Attention, inmate 1764."
152,1037517,1039417,"You have been reported to battle
in the zoo."
153,1047294,1048352,Begin battle.
154,1081828,1083125,The battle is over.
155,1084498,1089197,"Inmate 1764, you have earned
two hours of sanctuary time."
156,1090203,1093195,"All remaining inmates
return to your spoke."
157,1093306,1094466,You okay?
158,1095075,1097236,All prisoners return to your spoke.
159,1107154,1109145,There must be someone we could talk to...
160,1110690,1113250,"to get us out of here.
I didn't do anything wrong."
161,1113360,1114725,I didn't do anything wrong.
162,1126273,1129572,"Inmate 1764, report to the sanctuary."
163,1132245,1133576,What is this?
164,1135382,1136747,Must be where the winners go.
165,1176890,1178790,"Shu's gone. This is legit.
What do you got?"
166,1179759,1183160,"His cousin says she's been
trying them both for 18 hours. No luck."
167,1183263,1185925,"- Party happened Saturday night.
- What'd you get from the party?"
168,1185999,1187591,"No security tapes, nothing."
169,1187667,1188895,"All right, I'll look into it."
170,1191805,1193796,All prisoners return to your spoke.
171,1195108,1197235,All prisoners return to your spoke.
172,1219799,1222825,"The first thing they try to do in lockup
is break your spirit."
173,1225272,1228332,"Can't allow that to happen.
You have to stay mentally strong."
174,1230677,1234613,"You have to focus on three key things
to a successful breakout."
175,1234681,1235875,What are they?
176,1236883,1238851,"One, know the layout."
177,1240220,1242711,"Two, understand the routine."
178,1243857,1247623,"Three, have help from the inside or out."
179,1247694,1250959,"Teamwork. Exactly.
Your favorite one, I can tell."
180,1251665,1256364,"Remember, Shu, you move together.
Everything flows as one."
181,1295742,1297835,"One, seven, six, four."
182,1304401,1305838,Are you the warden?
183,1307045,1309104,Your cousin is a brilliant man.
184,1309648,1314950,"He gave me the details of his patent,
number 34ACJL."
185,1314961,1319728,But not number 36BBBCK.
186,1320300,1323929,"I need you to convince him
to give that to me."
187,1326272,1327739,Why would I do that?
188,1329047,1330241,You grew up together.
189,1331386,1332819,Like brothers.
190,1333013,1334640,But you weren't brothers.
191,1335416,1337714,"A family tragedy forced you
to live with him."
192,1338251,1339650,You hated Yusheng.
193,1339986,1342454,"How he was always smarter
than everyone else."
194,1342555,1345888,"He could've helped a lot of people,
but he went for himself instead,"
195,1345959,1346983,and he got rich.
196,1347820,1349651,"And now, his love of money..."
197,1350915,1352246,his precious patent...
198,1353312,1355007,is going to get you killed.
199,1358405,1361670,I know everything about my animals.
200,1363330,1364695,You want to know who I am?
201,1366398,1367660,I'm the zookeeper.
202,1370483,1372678,All prisoners report to the zoo.
203,1373486,1376421,"- All prisoners report to the zoo.
- What did you tell him?"
204,1377357,1378357,What?
205,1378758,1380692,You gave up the first patent.
206,1380794,1383456,"So? They were torturing me.
That one's nothing."
207,1384097,1387328,"- He knew things about our background.
- I didn't tell him."
208,1391471,1393769,"The second patent, what is it?"
209,1396976,1400673,"Advanced cube satellite tech.
It's a game changer."
210,1400780,1404113,"It can override and control
any computer system in the world."
211,1404184,1407119,"Like a cyber skeleton key.
And it's not what you think."
212,1407187,1410486,"This isn't about money.
I patented it so I could bury it."
213,1410557,1412548,"In the wrong hands, game over."
214,1412659,1415992,"Defense systems, nuclear codes.
No one will be safe."
215,1428374,1429374,Kimbral.
216,1436850,1439819,"No, no. Not every day is a fight day."
217,1445859,1447383,What are we doing here?
218,1449262,1450923,I'm his cousin.
219,1453933,1456093,"I don't think it's a coincidence
that we both are here."
220,1456903,1458393,I think they're after Breslin.
221,1458505,1460096,"You know, after spending
a lot of time with this,"
222,1460106,1461164,"I put my ear to the ground,"
223,1461174,1463404,"I just didn't like what I saw,
didn't like what I heard."
224,1463510,1464909,How long have you been here?
225,1465512,1466570,It's hard to say.
226,1467213,1470376,My best guess is... couple of months.
227,1471117,1472948,What is this place?
228,1473052,1474883,"There's a lot of rumors, like mythology."
229,1474954,1476714,"It's called
the High Asset Detention Service."
230,1477223,1478223,Hades.
231,1478892,1479950,Greek mythology?
232,1480460,1482052,Land of the dead.
233,1482128,1484254,"Whoever goes in just doesn't come out.
It's that simple."
234,1484264,1486232,"- Sounds familiar.
- Yeah."
235,1486299,1490201,"The word is the people behind the Tomb
took a beating, did some adjustments,"
236,1490270,1492390,"- and then came back strong.
- Who are these assholes?"
237,1492972,1496931,"Spies, criminals,
businessmen, elected officials."
238,1497043,1498043,Profit. Big profit.
239,1498478,1499602,What makes you think he's there?
240,1499612,1504709,"His cousin Yusheng was put on
some kind of hit list by his competition,"
241,1505151,1507483,a satellite tech company called Ruscho.
242,1508087,1510078,"There's battle days
and there's truce days."
243,1510390,1512290,"If you win a battle, you get benefits."
244,1512766,1514859,If you lose or refuse to fight...
245,1516162,1518062,your time in here is very uncomfortable.
246,1518598,1521795,"That's why they call it ""the zoo.""
We're all animals here."
247,1521901,1523163,Survival of the fittest.
248,1523269,1526796,"If you want someone to disappear so bad,
why not just kill them?"
249,1526906,1529272,"Because then the world
will know they are dead."
250,1530233,1532997,"Here, they are just gone."
251,1533580,1536014,"Then we got to go in, get them out."
252,1536115,1537841,"Can't go in there blind.
We don't know a layout."
253,1537851,1540285,"- We don't have anything.
- You broke the Tomb totally blind."
254,1540353,1541353,"Yeah, well, I got lucky."
255,1541454,1543134,"We don't even know for sure
if Shu's there."
256,1543156,1545281,"- And what if he is?
- Look, if he's there, we'll get him."
257,1545291,1547418,"We go in there blind,
we get trapped ourselves."
258,1548094,1549459,You don't think I can handle it.
259,1550029,1551997,This is bigger than any one of us.
260,1554133,1555133,All right.
261,1568147,1571139,"Sir, we've got a data breach.
Someone's in our system."
262,1571684,1574209,What? Shut it down. Shut it down now.
263,1587166,1589225,"- Uh-huh.
- Just cleaning up for the night."
264,1589335,1590335,Uh-huh.
265,1591638,1593469,Here's the only contact I got at Ruscho.
266,1593840,1596280,"Not sure if he'll talk to you,
but it's a good place to start."
267,1597010,1598034,A sticky note?
268,1605251,1607845,"- So what do you got?
- All right."
269,1608171,1611163,"Two things. A dark bank account,
code-named Sparrow,"
270,1611230,1612822,Ruscho's been sending money to.
271,1613026,1615256,"And they also sent ten million
to Leon Grassi,"
272,1615361,1617261,"a lobbyist
for the private prison industry."
273,1618097,1619689,I know this Leon Grassi.
274,1620566,1623694,"He used to work for the prison board
for about 13 years,"
275,1623770,1625261,and then he started taking a lot of heat
276,1625271,1627171,"every time I broke out
of one of his places,"
277,1627240,1630107,"so he decided to jump into
the private sector."
278,1630209,1631369,Haven't heard from him since.
279,1631444,1633275,"You look very nice today,
but you know that."
280,1654930,1655954,Get you a drink?
281,1656731,1658130,"Not what you got, Tiny."
282,1658304,1661137,"I know you didn't go straight
and get an honest job pouring drinks,"
283,1661240,1664368,"so tell me, DeRosa,
what are you doing here?"
284,1664444,1666036,Could easily ask you the same question.
285,1666112,1667579,"Yeah, well, that's personal."
286,1669983,1673264,"Got a call from Abigail,
this being the first time"
287,1673319,1676288,"you're back in the field
after being a desk jockey for so long."
288,1677865,1679526,She thought you might be a little rusty.
289,1680137,1681502,"Oh, that hurts."
290,1684097,1685121,He's here.
291,1686332,1689597,"- Know that guy as well?
- You mean the wannabe gangster? No."
292,1689669,1690795,You recognize him?
293,1692405,1693667,Want me to introduce you?
294,1694841,1697071,Since when are you so tight with Abigail?
295,1697143,1699509,"Like you said, it's personal."
296,1700580,1701638,"How you doing, Leon?"
297,1702782,1703782,Leon.
298,1705351,1706943,"You know, one of my men is missing,"
299,1707020,1709989,"and I think he's in
a black-site prison called Hades."
300,1710089,1711420,Ring a bell anywhere?
301,1712125,1716186,"And there's this company called Ruscho.
European satellite tech company."
302,1716295,1720095,"They gave you about ten million bucks.
How about that?"
303,1720166,1721531,Ten million dollars.
304,1721868,1724359,"Lot of money.
But I think it's all bullshit."
305,1724871,1726805,"Because you don't lobby
for satellite tech."
306,1726873,1727703,"Look, Ray..."
307,1727807,1730469,"You lobby for black-site prison profit,
am I right?"
308,1730543,1733376,"- Look, Ray...
- You're gonna tell me what you know."
309,1754367,1755367,Move!
310,1764544,1766307,"Hey, Breslin..."
311,1768214,1769408,Good to be back?
312,1770249,1771978,"No, it's bad to be back."
313,1774921,1777515,"- Leon, who you working for?
- I'm sorry, Ray. I can't..."
314,1783162,1785357,"Come on. Want a job, DeRosa?"
315,1786332,1787332,"Fuck, yeah."
316,1787400,1790597,"There's this private bank account,
and I need it identified."
317,1790703,1793228,"With him dead, it's our only lead."
318,1793739,1796503,"All right.
Give me a day, I'll figure it out."
319,1831944,1832944,Hey.
320,1834447,1836039,Where are you coming from?
321,1836115,1839035,I work for the prison. I'm the cook.
322,1840273,1841638,Tell me about the kitchen.
323,1843422,1844422,What do you mean?
324,1844490,1846390,How do I get there from your cell?
325,1847627,1848627,I got to go.
326,1856402,1857426,Yes.
327,1864076,1866408,"You are on the wrong side
of the zoo, my friend."
328,1866479,1869107,"- I need you to kick my ass.
- What? It's a truce day."
329,1886499,1887499,Come on.
330,1956235,1957600,What the hell are you up to?
331,1959872,1962500,"Thought I could work the doctor,
get us some benefits."
332,1963509,1966740,Turns out the doctor is a lamp stand.
333,1968748,1970181,My name is Akala.
334,1970249,1971249,Shu.
335,1982595,1984529,"- What?
- He connected the dots."
336,1984597,1986758,"Your inside man at Ruscho
sent me down a rabbit hole."
337,1989468,1992528,"But it looks like I found a guy
who can lead us to Shu."
338,1992605,1993765,Where is this guy?
339,1994607,1996700,Right now? Driving the car I'm chasing.
340,1998744,2000234,Sure hope you know what you're doing.
341,2000913,2002107,Call you back.
342,2044990,2046014,Where you hiding?
343,2064310,2065310,Damn it!
344,2070316,2071476,Fuck me.
345,2072485,2077513,"Inmates 1764 and 1765, report to the zoo."
346,2077623,2079853,"I repeat, report to the zoo."
347,2081994,2083894,They tortured me again last night.
348,2091003,2094063,"You were always
mentally tougher than me as a kid."
349,2094173,2095401,Remember?
350,2096375,2098400,You need to be now.
351,2146091,2147251,Begin battle.
352,2154233,2155393,Battle is over.
353,2155468,2161236,"Inmates 1764, 1765, you've earned
two hours of sanctuary time."
354,2164376,2166241,Negative skeleton theory.
355,2166912,2170404,"Use what they let you see
to map out what you can't see."
356,2172318,2175446,"That's how the layout begins
to reveal itself to you."
357,2183162,2187258,"Train your mind to look beyond
the physical wall that confines you."
358,2198310,2201746,"There's a whole separate world
on the other side of the cells."
359,2202615,2207484,"Hallways, interrogation,
infirmary, kitchen, HQ."
360,2208420,2211116,"Right now, it's all negative space."
361,2212525,2214083,But not for long.
362,2216962,2218623,I'm gonna get us out of here.
363,2227473,2228633,Fuck.
364,2228707,2230470,"Come on, Luke. Where are you?"
365,2231377,2233811,"This is the last number
Luke called on his cell."
366,2237616,2238776,Ruscho Geneva?
367,2239718,2241208,Should I get Hush in here?
368,2244690,2245782,No.
369,2247993,2249460,"You know, someone once told me..."
370,2250963,2253557,"the single most important thing
to remember"
371,2253666,2256066,in solving the hardest riddles
372,2256635,2258155,is that they're designed to trick you.
373,2258971,2260495,Subvert against your own assumptions.
374,2261907,2265172,"And my assumptions are telling me
that there's no way"
375,2265244,2267974,"that you would let Luke
go directly against company order."
376,2268747,2271238,"Look, he just wanted to do the legwork."
377,2271350,2273990,"Thought it was a good chance for him
to take the lead on something."
378,2274253,2276016,And now Luke and Shu are missing.
379,2281527,2287227,"You are prisoner 1924.
I repeat, you are prisoner 1924."
380,2287333,2288698,Welcome to Hades.
381,2302781,2305443,"Sir, I felt something was going on.
I hacked into the system,"
382,2305551,2307951,"and basically, Luke tried to meet up
with Ruscho Geneva."
383,2309054,2310054,Are you serious?
384,2310122,2313002,"I told him to stay away from these guys.
How'd he get involved with that?"
385,2314560,2317688,It was me. I gave him one of my contacts.
386,2321533,2322533,Come on.
387,2331910,2334242,"After you went missing,
Breslin started digging."
388,2334313,2337282,"He thinks this place was started
by the same people behind the Tomb,"
389,2337750,2338750,so I...
390,2341253,2344416,I screwed up. Ended up in here.
391,2344490,2348051,"Doesn't matter.
I'm close to getting the layout."
392,2349662,2351994,"- What do you want me to do?
- Nothing yet."
393,2352097,2355089,"The less contact we have, the better."
394,2357069,2359629,"Shu, it can't be a coincidence"
395,2359738,2362673,"that all three of Breslin's specialists
are locked up here now."
396,2362775,2364174,"No, it can't."
397,2365177,2366667,Assume they are watching us.
398,2383962,2385122,Please.
399,2386031,2388022,He's close to giving it to you.
400,2388600,2389794,Close?
401,2390536,2391696,He won't last.
402,2391804,2393704,Then he needs to give me what I want.
403,2395207,2397038,"Or I'll feed him
to the rest of the animals."
404,2410489,2413481,"I've tried to make soup dumplings
since I was a kid,"
405,2413559,2416790,"but every time, the dough is too stiff."
406,2419665,2422634,"Look, I don't know what your deal is,"
407,2423335,2426304,but... I don't want to die.
408,2426371,2428362,What they are doing to you is wrong.
409,2432044,2433568,Then let me help you get home.
410,2437883,2440750,"They blindfold me
when I go from my cell to the kitchen."
411,2443155,2445180,That's not the only way to see.
412,2446692,2451254,"Sixteen, 17, 18, 19, 20..."
413,2451697,2452994,How many steps?
414,2453766,2454858,Twenty-four.
415,2455400,2458062,"The one gift
every prison gives you is time."
416,2458170,2459535,Don't waste it.
417,2459605,2461937,"Visualize the layout
every chance you have."
418,2466178,2467543,It was 45 this morning.
419,2468347,2469541,What?
420,2469615,2471173,Steps to the kitchen.
421,2471250,2472581,The distance doubled?
422,2477189,2478189,Come on!
423,2489601,2491626,I need to get in the sanctuary.
424,2491737,2493398,"Yeah, and I need a Coke."
425,2493472,2494632,Sweet dreams.
426,2507386,2509479,All prisoners return to your spoke.
427,2510322,2514122,"I repeat,
all prisoners return to your spoke."
428,2562841,2566834,"Even the most complex of narratives
are often based on one simple idea."
429,2568380,2570473,"The answer is most likely
right in front of you."
430,2577456,2578684,The prison is moving.
431,2579391,2582724,"The cell spokes
change entry points to the zoo."
432,2582828,2583954,Like a Rubik's Cube?
433,2584630,2588122,We got no routine. We got no layout.
434,2588667,2590157,And we have no help.
435,2590836,2591962,Maybe we do.
436,2597042,2598236,Neo-Nazis?
437,2598343,2601312,"Computer nerds.
They brought them in some time back."
438,2602314,2605010,"They rounded them up
in some random basement in Iceland."
439,2605584,2607575,The call themselves The Legion.
440,2609221,2611155,The leader's handle is Count Zero.
441,2612391,2614655,"He's screwed with
more Fortune 500 companies"
442,2614726,2616216,than you and I can name.
443,2616328,2618023,But our zookeeper's got a problem
444,2618096,2620394,"'cause he doesn't know
which one is actually Count Zero."
445,2621033,2623194,He's interrogated them day and night.
446,2624202,2626670,No sanctuary time ever.
447,2627406,2629101,Why does the prison care?
448,2630208,2633700,"Because Count Zero
has acquired the specs to the prison."
449,2634513,2637778,"They need to know who he is
and where his servers are."
450,2637883,2639544,"- Specs of the prison?
- Yes."
451,2640018,2642953,"If you can find out which one
is Count Zero before the prison..."
452,2644122,2645521,maybe he can help us.
453,2674419,2675579,I need to see Bug.
454,2685397,2687627,I need to see... Bug.
455,2688166,2690327,"If you want a book on insects,
they're upstairs."
456,2697342,2699173,Okay. Right this way.
457,2737783,2738783,Bug.
458,2744656,2745656,DeRosa?
459,2747526,2748526,Sparrow.
460,2750295,2753025,"- Who is he?
- Come on. I can't give that to you."
461,2753131,2755065,The Insect Society
462,2755167,2757465,"- clients remain anonymous.
- Clients remain anonymous."
463,2757536,2759026,"- Above all else...
- Shut up, Bug."
464,2763542,2765510,We've been boys for a long time.
465,2769714,2771147,I love what you guys do here.
466,2773018,2774018,"Now, Bug..."
467,2779357,2781049,"But I'm gonna have to
kick the shit out of you"
468,2781059,2782526,if you don't start talking to me.
469,2783228,2784661,I'll get you a name.
470,2784729,2785821,Thank you.
471,2787866,2789426,I'm gonna need one more thing from you.
472,2818864,2820195,Yusheng's close.
473,2821099,2822123,Time is up.
474,2822234,2824964,"You're asking him to give up
his life's work."
475,2825070,2827197,"We both know that
that's not what this is about."
