Number,StartMilliseconds,EndMilliseconds,Text
1,78184,81620,"A hundred years ago,
all was right with our world."
2,81754,84723,Prosperity and peace filled our days.
3,84857,86381,The Four Nations:
4,86526,92362,"Water, Earth, Fire and Air Nomads
lived amongst each other in harmony."
5,92498,97231,"Great respect was afforded to all those
who could bend their natural element."
6,97370,101363,"The Avatar was the only person
born amongst all the nations"
7,101507,104237,who could master all four elements.
8,104377,108313,"He was the only one who could
communicate with the Spirit world."
9,108448,112976,"With the Spirits'guidance,
the Avatar kept balance in the world."
10,113786,117722,"And then, a hundred years ago,
he just disappeared."
11,154427,156361,I'm sorry. I'm sorry!
12,156496,158464,"Hey, I'm sorry.
I'm sorry, I'm sorry, I'm sorry!"
13,158598,162557,"I'm sorry! I'm sorry! Hey!
It worked better that time."
14,162702,166160,I thought about Mom. Isn't that strange?
15,167440,170432,Yeah. I guess so.
16,170776,175042,"Just stop doing that stuff around me.
I always get wet."
17,178618,181644,"My brother and I live
in the Southern water Tribe,"
18,181787,186383,"which was once a big city.
Our father is off fighting in The war."
19,186726,189854,"My mother was taken prisoner
and killed when I was young."
20,190530,193988,"In this time of war, food is scarce."
21,194133,196294,"My brother and I often
go hunting for food,"
22,196435,200633,"but, unfortunately, my brother
isn't the best hunter in the world."
23,205311,207472,"- Tiger seal.
- Are you sure?"
24,231237,232829,I did everything Dad said to do.
25,232972,235338,"I watched which side of the fin tracks
are more indented."
26,235474,236941,"That shows which
direction they're going."
27,237076,240773,"I saw how long the drag skids are.
That shows you how fast they're going."
28,249155,250782,There's something under there.
29,265204,268537,"It's a cave-in!
Move away from the cracks!"
30,296168,301265,"Katara, don't go near it.
This is probably some Fire Nation trick."
31,302074,305066,Just back away really slow.
32,311083,313244,Katara! Do not hit that sphere!
33,328467,329957,"Uncle, look!"
34,370476,371909,Is he breathing?
35,375181,377741,"Did you see that light
shoot into the sky?"
36,378384,379578,What's your name?
37,380653,384646,"How did you get here?
How did you get in the ice?"
38,385491,387152,He's exhausted.
39,388494,390655,We need to get him back to the village.
40,397737,398726,What is this thing?
41,403743,405404,It's trying to eat me!
42,413385,415285,Look. See?
43,426799,428426,How'd you get all the way out here?
44,429201,430600,I ran away from home.
45,431137,434732,"We got in a storm. We were forced
under the water of the ocean."
46,434874,436603,I see.
47,436742,439438,It wasn't very smart. I was just upset.
48,440446,442380,"- Thanks for saving me.
- Lucky."
49,442982,445951,"I probably should get home.
They'll all be worried."
50,446085,449213,"- You're not still upset?
- Not as much as I was."
51,467072,468198,The Fire Nation is here.
52,468340,470205,"- What?
- And they brought their machines."
53,472378,474744,"Don't come out
till I tell you it's safe."
54,476549,480508,"- Is something wrong?
- No. Please wait here."
55,480653,484145,"- Hurry, now!
- Secure the area!"
56,495968,498061,"It can't be coincidence
that we break him out of the ice,"
57,498204,501765,"light shoots into the sky and now the
Fire Nation is here with their machines."
58,513152,515120,"Sokka, don't."
59,524263,526197,I am Prince Zuko...
60,526765,530963,"...son of Fire Lord Ozai
and heir to the throne!"
61,532705,535265,Bring me all your elderly!
62,535407,537238,"- Papa!
- Move!"
63,537376,538434,Yeah?
64,542381,543643,Grandma!
65,548387,550981,Please don't... don't harm him!
66,552291,553656,Come on!
67,558330,559991,"Katara, don't."
68,560566,563228,"- Form a line!
- Come on!"
69,567506,568700,Here.
70,569575,570769,Hey.
71,584423,586118,Grammy!
72,588594,589925,You're scaring these people.
73,597803,599862,Who are you? what's your name?!
74,600005,603031,"- I don't need to tell you anything.
- Firebenders!"
75,608180,610045,I'm taking you to my ship.
76,610549,614383,"If you don't come,
I'll burn down this village."
77,615020,618478,"I'll go with you.
Don't hurt anyone."
78,633906,636500,"They were looking for someone old
and they were looking for someone"
79,636642,638337,With the same markings the boy had.
80,638477,641742,"They dragged Mom away
the same way when we were babies."
81,641880,645213,"She wouldn't have watched us being
taken away. She would have fought."
82,645351,648878,"We found that boy. He's our
responsibility. We should fight."
83,650089,652785,"What would you do
if they tried to take me away?"
84,652925,654415,I'd kill them all.
85,655894,658522,"- Why?
- Because you're my sister."
86,659198,661860,"Because Dad told me
to protect you with my life."
87,663769,668968,"Because I'm your responsibility.
And this boy is our responsibility."
88,672511,676504,"What do you want us to do, Katara?
How are we supposed to save him?"
89,676648,679048,"They're on a ship.
We'd need a miracle to catch them."
90,679184,682176,"I know you think everything's
going to work out, but I don't."
91,697636,700127,His bison creature thing floats.
92,720926,722052,What do you want with me?
93,723495,726828,"My nephew wants me to perform
a little test on you."
94,729168,732296,"- What kind of test?
- I assure you, it won't hurt."
95,732438,735930,"I've performed it hundreds of times.
It only takes a few moments."
96,736075,737599,And then you're free to go.
97,739678,742545,"Would you mind if I put a few things
in front of you at the table?"
98,743182,745173,It will only take a moment.
99,746118,747745,That's all you want?
100,747886,751083,"My name is Iroh,
and you have my word."
101,752891,754825,"Grandma, I know
you're gonna try to stop us,"
102,754960,757758,"- but this is just something I need...
- Sit down."
103,759364,763460,"I knew from the first time
We discovered you were a Bender,"
104,763602,766537,"that one day,
I would realize your destiny."
105,767439,772206,"There hasn't been a waterbender
in the Southern water Tribe"
106,772344,775245,since my friend Hama was taken away.
107,776882,780545,"Today, I found out that destiny."
108,781587,783214,Did you see that boy's tattoos?
109,784156,787557,"Tattoos like that haven't
been seen in over a century."
110,788560,792155,I believe they are Airbending tattoos.
111,792531,794396,How can that be?
112,794533,799561,"I believe that little boy
might be the Avatar."
113,802407,807936,"Once, a long time ago,
the Spirit world kept balance over us."
114,808080,810105,"What is the Spirit world, Grandma?"
115,810249,813275,"It's not a place made up
of things you can touch."
116,813418,816148,"But it exists, nonetheless."
117,817389,822258,"It is filled with the most amazing forms
of dazzling creatures..."
118,822761,828358,"...that exist in the most
exotic valleys, mountains and forests."
119,829268,833034,Each of these creatures is a Spirit.
120,833172,835697,"They've watched over us
since the beginning."
121,835841,840505,"They have guided us. And only
the Avatar can go speak to them."
122,840646,842375,Aren't there Spirits here?
123,842614,846448,"Yes, there are some Spirits
that live hidden among us,"
124,846585,849850,"sure they're watching us
With great sadness..."
125,851456,856018,"The Fire Nation doesn't wish
to live by the Spirits."
126,856161,859619,"That's why they're so frightened
by the existence of the Avatar."
127,860132,863590,"- What can he do?
- With his mastery of the four elements,"
128,863735,867637,he will begin to change hearts.
129,868640,872974,"And it is in the heart
that all wars are won."
130,875814,878806,"Now, go help this boy."
131,880219,881880,He will need you tWo.
132,883488,886150,And we all need him.
133,948754,951621,You are my prisoner...
134,952724,954385,...Airbender.
135,956662,958220,I'm taking you back to the Fire Nation.
136,958630,961098,"- You said...
- I apologize."
137,961233,963167,I should have explained further.
138,963302,968239,"If you failed the test, as all others
did, you were free to leave."
139,968373,973333,"But, as it turns out, you are
the only one in the entire world"
140,973478,975378,Who could pass this test.
141,976748,978978,"It is truly an honor
to be in your presence."
142,980852,983582,"Don't even try to escape.
This is a warship!"
143,988694,990093,Stop! There's no way you can...
144,1029201,1031465,Don't move! You have nowhere to run!
145,1031770,1032759,Halt!
146,1033372,1034862,Don't let him escape!
147,1035307,1036296,Get him!
148,1058730,1060493,Thanks for bringing Appa to me.
149,1060632,1063658,"The Fire Nation is up to something.
I have to go back now."
150,1063802,1066896,"- We'll come with you.
- I can take you back to the village."
151,1069007,1070167,We're going with you.
152,1073278,1075405,You found the Avatar.
153,1077249,1080582,"For a moment, I had my honor back."
154,1082087,1087423,"Your destinies are tied, Zuko.
That, you can be sure of."
155,1093365,1097358,"Aang flew us to his home. He told us
how he left there in a storm on Appa,"
156,1097602,1100435,"and got forced into the ocean
where they almost drowned."
157,1100572,1103336,"Aang Airbended a sphere around them,
and ice formed."
158,1103475,1105943,"And he couldn't remember
anything after that."
159,1106111,1109444,"Hey, Chinto! Monae! I'm back!"
160,1109781,1112875,"Hey, guys! I want you to meet someone!"
161,1113785,1115446,This is where you live?
162,1115587,1117782,"They must be playing some trick
or something."
163,1117923,1120790,"Monk Gyatso is gonna try and jump out
and scare me at any moment."
164,1121259,1123193,He's the teacher responsible for me.
165,1125764,1127391,He's kind of like my father.
166,1128300,1131463,"- Is it OK if you tell me your name?
- The monks named me Aang."
167,1133472,1136134,"OK, guys! Enough!"
168,1138477,1141310,"Spider-rat!
They're poisonous! Get behind me."
169,1142481,1145143,"He's a flying lemur-bat.
We keep them as pets."
170,1145417,1146975,Weren't they extinct a long time ago?
171,1147986,1151422,"Extinct? No, there must be thousands
of them on this mountain."
172,1154226,1156160,Your friends were monks?
173,1156294,1159127,"I know where they are right now.
They're at the prayer field!"
174,1163168,1166501,"Aang, wait! I have to talk to you!"
175,1177182,1178513,Aang...
176,1179518,1184353,"...I think you were in that ice
for almost a hundred years."
177,1186691,1191651,"- The Firebenders started a war.
- I left a few days ago."
178,1192497,1197366,"Aang, the Fire Nation knew the Avatar
Would be born into the Air Nomads..."
179,1198870,1201202,"...so they exterminated
all the Air Nomads."
180,1211716,1212705,You're Iying!
181,1213218,1214879,You're Iying!
182,1226298,1228289,This is Monk Gyatso's.
183,1229234,1230895,I made it for him.
184,1243915,1247316,No!
185,1263768,1266532,Katara! Stay away from him!
186,1270609,1271598,Katara!
187,1271876,1273537,Stay away from him!
188,1278216,1279808,Your friends were monks?
189,1309714,1311045,The Avatar?
190,1312484,1315351,Where have you been?
191,1315487,1316818,Aang!
192,1317155,1319783,"You can't bring Monk Gyatso back,"
193,1319924,1323587,"but Sokka and I can be with you
as long as you need!"
194,1323928,1327728,Don't give up! we can do this together!
195,1328833,1330323,Aang!
196,1366304,1368033,The banished prince.
197,1370875,1372536,Let's offer him lunch.
198,1375680,1379275,"I wanted to thank
the great General Iroh"
199,1379417,1382682,"and young Prince Zuko
for dining with us."
200,1385356,1389918,"As you know, the Fire Lord
has banished his son, the Prince,"
201,1390061,1393224,"and renounced his love of him, and will
not let him return to the throne"
202,1393364,1395059,unless he finds the Avatar.
203,1396134,1399399,"The Fire Lord believes his son
is too soft,"
204,1399537,1402438,"and by doing this,
he will become strong"
205,1402574,1405566,"and become a worthy heir
to the throne."
206,1406911,1409436,I commend the Fire Lord's discipline.
207,1409581,1413574,"For example, it seems
I need to remind Prince Zuko"
208,1413718,1418087,"that, during his banishment,
he is an enemy of the Fire Nation"
209,1418223,1421351,"and is not allowed
to wear the Fire Nation uniform."
210,1422927,1425327,"But we will let him wear it today,"
211,1425463,1427693,like a child wearing a costume.
212,1435774,1440609,"One day, my father will take me back
and you will bow before me."
213,1513518,1514576,You OK?
214,1516187,1517711,I'll be fine.
215,1517856,1521690,"You know, my grandma thinks
because you're an Airbender,"
216,1521826,1523191,that you could be the Avatar.
217,1526064,1528191,"How much does
the Fire Nation control?"
218,1529367,1532336,"A lot of villages in the Earth Kingdom,
like around here."
219,1532470,1535735,"They haven't been able to conquer
big cities, like Ba Sing Se,"
220,1535874,1538035,"but they're making plans, I'm sure."
221,1539377,1540708,So...
222,1541546,1543810,"...are you the Avatar, Aang?"
223,1550555,1551886,What is this?
224,1553157,1554283,Stay hidden.
225,1561399,1563697,"- That child is being arrested.
- For what?"
226,1563835,1568169,"He was bending tiny stones at us
from behind a tree. It really hurt."
227,1568306,1569534,He can bend earth?
228,1570408,1573002,"Earthbending is forbidden
in this village."
229,1573745,1577579,"Leave him alone.
You're not taking him anywhere."
230,1578116,1581483,No one is taking anybody away!
231,1584989,1586047,She's a bender!
232,1591930,1593261,Katara!
233,1616120,1617280,Move.
234,1618122,1619282,"You, too."
235,1619424,1620413,Dad!
236,1624462,1627226,"- This is my father.
- Hello."
237,1627365,1631131,"That's the Fire Nation's plan,
suppress all other bending."
238,1633304,1635636,How did this happen to your village?
239,1637141,1641475,"Fire Nation sent soldiers.
We fought them and defeated them."
240,1642647,1647516,"Then they sent their machines,
huge machines made of metal."
241,1647652,1649643,There was nothing we could do.
242,1651222,1654248,"Those who could not bend were
allowed to live in peace,"
243,1654392,1655984,if we were imprisoned.
244,1668172,1669332,Earthbenders!
245,1672844,1678180,"Why are you acting this way?
You are powerful and amazing people!"
246,1678316,1682685,"You don't need to live like this!
There is earth right beneath your feet."
247,1684322,1687519,"The ground is an extension
of who you are!"
248,1690762,1692696,If the Avatar had returned...
249,1694532,1696056,...Would that mean anything to you?
250,1696200,1701137,"The Avatar is dead.
If he was here, he would protect us."
251,1702940,1704373,My name is Aang...
252,1705977,1707376,...and I am the Avatar.
253,1709213,1712046,"I ran away, but I'm back now."
254,1715553,1718044,It's time for you to stop doing this!
255,1718723,1723717,"The Avatar would have to be an
Airbender. Are you an Airbender, boy?"
256,1726564,1728225,Leave him alone!
257,1734572,1736437,How is he doing that?
258,1736574,1738633,I don't want to hurt anyone.
259,1738776,1742803,"AII Airbenders should be dead.
Kill him! Firebenders, positions!"
260,1746584,1750247,OK! Everybody can help us now!
261,1773377,1775436,Don't be afraid!
262,1813151,1814641,Just leave them!
263,1815653,1817086,Fall back!
264,1818089,1820148,Go! He's an Airbender!
265,1840011,1844277,"They took away any tools
related to bending."
266,1857929,1861797,"The Fire Nation took this scroll
from a member of your water Tribe."
267,1863534,1865525,A waterbending scroll.
268,1870208,1873939,"This is rare.
My mom told me about these."
269,1875813,1879271,"This was you when
you were born an Earthbender,"
270,1879417,1881885,tWo lifetimes ago.
271,1882019,1883418,You came to our village.
272,1884355,1888655,Avatar Kyoshi loved games.
273,1888793,1892194,"I do, too.
I mean, I still do."
274,1893197,1895995,"A lot of the villages in this part
of the Earth Kingdom are occupied"
275,1896133,1898226,"by the Fire Nation,
like this village was."
276,1898836,1902397,"They prey on the weakest towns
and villages."
277,1902540,1904508,"We should go visit
some of these towns, Aang."
278,1904642,1907202,"- I need to tell you something.
- What is it, Aang?"
279,1908746,1912204,"I ran away before they trained me
to be the Avatar."
280,1912350,1914341,"I don't know how
to bend the other elements."
281,1915853,1917480,Why did you run away?
282,1917989,1921254,"The day they told me I was the Avatar,
they said I could never"
283,1921392,1924327,"have a normal life,
that I could never have a family."
284,1924762,1927856,"They said it cannot work with
the responsibilities of the Avatar."
285,1927999,1931196,"- Why can't the Avatar have a family?
- I asked that!"
286,1931335,1934702,"They said that's the sacrifice
the Avatar always has to make."
287,1934839,1938366,"OK. So, what if we found you teachers.
Teachers to teach you bending?"
288,1938509,1940374,"Which element would you
have to learn first?"
289,1940511,1943776,"Water. Water comes
after Air in the cycle."
290,1943914,1946474,"Air, water, Earth, Fire."
291,1946617,1949677,"But there are really powerful benders
in the Northern water Tribe."
292,1949920,1951615,My dad told me about it before he left.
293,1951756,1954122,"It's led by a princess because
her father died."
294,1954258,1957318,"There are teachers there, but all
the way on the other side of the world."
295,1957461,1960123,"- We can get there on Appa.
- That's what I was thinking."
296,1960264,1962357,"And maybe we can stop
in the villages on the way,"
297,1962500,1965025,"start a change in The war
in these small villages."
298,1965870,1968395,"- Should we try it?
- Yes, we should."
299,2022660,2025720,"The scroll we had
was proving to be helpful."
300,2025863,2029526,"Aang was practicing,
but for some reason,"
301,2029667,2032101,"he was having trouble
with waterbending."
302,2039343,2042471,"We moved from town to town
in the Earth Kingdom."
303,2042613,2044137,"We tried to stay out of sight,"
304,2044281,2048877,"but Sokka became concerned
we were being followed."
305,2081485,2083851,"Sire, I have good news."
306,2083988,2086354,"As you know, I conducted a raid
on the Great Library,"
307,2086490,2088720,"- Which most said didn't exist.
- Get on with it."
308,2088926,2093920,"I found scrolls in the library.
We are deciphering them."
309,2094064,2096055,"But I believe they may
contain information"
310,2096200,2099431,"as to where the Ocean and Moon
Spirits live in this world."
311,2099570,2101265,"With this information,"
312,2101405,2103930,"We could bring down
the Northern water Tribe city,"
313,2104074,2107771,"We could show the world
the true strength of fire."
314,2107912,2109573,I am pleased.
315,2110247,2114980,"Well, Commander Zhao,
are the rumors true or not?"
316,2115119,2119180,"Our spies have discovered someone
claiming to be the Avatar."
317,2120424,2122358,They describe him as just a boy.
318,2123861,2125920,We should set a trap for this person.
319,2126063,2128657,"We have many Earth Kingdom people
under our control."
320,2128799,2131996,"I can leave soldiers
hidden in certain locations."
321,2132136,2136903,"- And my son?
- He had his chance. He missed it."
322,2138209,2140200,"Let's hope, for your sake,"
323,2140344,2145213,"my son doesn't find this person first
and he turns out to be the Avatar."
324,2146250,2150243,"He would return as a hero and,
for all purposes, be your superior."
325,2152022,2156083,"Well, I suppose it's a race, then."
326,2176580,2178241,"We're close, Uncle."
327,2178883,2181750,"They've been moving
farther and farther north."
328,2183554,2184919,We're catching them.
329,2189627,2192095,"There are a lot of pretty girls
in this town, Zuko."
330,2193097,2195190,You could fall in love here.
331,2195332,2199769,"We could settle down here,
and you could have a blessed life."
332,2202573,2204939,"We don't have to continue this, Zuko."
333,2207111,2209602,"I'll show you why we must, Uncle."
334,2212049,2216179,"Hey. Hey. Little one, come here."
335,2221292,2223624,You look like a very smart boy.
336,2225729,2229927,"Tell me what you know about the
Prince, the Fire Lord's son."
337,2230067,2234936,"- He did something wrong.
- He spoke out of turn to a general,"
338,2235072,2237063,in defense of some of his friends
339,2237207,2241143,"Who were going to be sacrificed
in a battle."
340,2241278,2245806,"Then Prince Zuko
Was sentenced to an Agni Kai duel,"
341,2245950,2247417,"but when he showed up,"
342,2247551,2251419,"- it was his father he was to fight.
- That's right."
343,2251655,2254180,He would not fight his father.
344,2254325,2258352,"Then his father mocked him and said,"
345,2258495,2261157,"""I should bring your sister
up here to beat you. """
346,2262533,2265229,Then the father burnt his son...
347,2266337,2267827,...to teach him a lesson.
348,2278349,2280180,"We'll catch him soon, Uncle."
349,2281285,2283845,"Then we can think
about the pretty girls."
350,2294365,2295662,Aang...
351,2295799,2298029,"Try to keep your wrist bent,
like it's showing."
352,2301872,2305899,"What's wrong?
You've really been distracted today."
353,2306043,2309911,"I saw Sokka's maps.
We're near the Northern Air Temple."
354,2310047,2313813,"Do you think it would be OK
if I just visited there and came back?"
355,2313951,2316715,"- I'd be back in less than a day.
- Why?"
356,2316854,2319721,"He had a vision
at the Southern Air Temple prayer field."
357,2319857,2322849,"He talked to a Dragon Spirit
Who he thinks can help us."
358,2322993,2325518,"He thinks if he goes
to another spiritual place,"
359,2325663,2327392,he can get back to the Spirit world.
360,2327531,2331297,"I don't think that's a good idea.
We started a rebellion."
361,2332069,2333900,Try to talk him out of it.
362,2386724,2388453,I can't do this.
363,2389093,2390219,I need help.
364,2401472,2404373,"- I guess your talk didn't work.
- He'll be back in a day."
365,2404942,2408571,"The Fire Nation is following us. If we
make a wrong move, they'll catch him."
366,2447284,2448751,Who are you?
367,2451688,2454020,"Why, it cannot be!"
368,2454858,2458191,I've heard stories. Are you...?
369,2458996,2460588,My name is Aang.
370,2461198,2465191,"I cannot believe
I've lived to see your return."
371,2466103,2470199,"I'm an Earth villager,
but I visit these temple remains often."
372,2470340,2474436,"The Fire Nation destroyed this temple.
They have ruined everything."
373,2474578,2477741,"No, no, no, not everything."
374,2477881,2481749,"You know, there's
a hidden chamber of statues"
375,2481885,2484649,"I think you, of all people, should see."
376,2485255,2487883,These are all the Avatars.
377,2488892,2492885,"These are the reincarnations
of you over the years."
378,2495799,2499565,The Avatar Roku was your last life.
379,2502472,2507068,"Now, how did the Airbenders know
you were the Avatar, little one?"
380,2509112,2510909,They gave me a test.
381,2511849,2515751,"They put 1,000 toys in front of me
and asked me to choose four."
382,2516587,2520489,"They said I chose the same four objects
that belonged to the previous Avatars."
383,2523694,2526026,"That's when they told me
I could have no family."
384,2527898,2531163,"Told me I had a responsibility
to the Four Nations."
385,2535739,2538503,"There's a ceremony
When everyone bows to me."
386,2540744,2543110,"That's when I accept my role
as the Avatar."
387,2545282,2547045,But when everyone bowed...
388,2550687,2552678,...I didn't bow back.
389,2553123,2555455,You seem like a nice young man.
390,2556727,2562666,"You really do.
You will forgive me, won't you?"
391,2564067,2566797,"- For what?
- For luring you down here."
392,2570207,2574303,"I have lived in poverty
because of your absence, Avatar."
393,2574444,2577880,"So you will understand
my actions today."
394,2599002,2603336,"I have lived in poverty
because of your absence, Avatar."
395,2609179,2613616,"I have seen a vision
of the moon turning red."
396,2614418,2619549,"The Fire Nation has stolen knowledge
of us from the Great Library."
397,2619690,2622989,"They are planning
to misuse this knowledge."
398,2623126,2624457,I will stop them.
399,2624594,2628655,"You must go
to the Northern water Tribe."
400,2628799,2632394,"If they take that city,
more will suffer and die,"
401,2632536,2634766,as your Airbenders have.
402,2635339,2637739,You must go now!
403,2637874,2639136,Will I stop them?
404,2639276,2640607,"Wake up, young man!"
405,2643547,2647608,"My name is Commander Zhao.
I set this trap for you."
406,2649820,2652721,"Don't worry, I'm not gonna kill you."
407,2653924,2658418,"Besides, you'd just be reborn again,"
408,2658562,2660723,and then the search would continue.
409,2664201,2667898,So where have you been all this time?
410,2669573,2671905,And how is it that you're still a boy?
411,2675145,2677477,"I understand that when you freed
that handful of towns,"
412,2677614,2679912,"you were very impressive, but..."
413,2681618,2685247,"...you only used Airbending
against my soldiers."
414,2687257,2689248,"Now, why is that?"
415,2702105,2704573,The Fire Lord and I have a plan
416,2704708,2709236,"to ensure our reign
and the downfall of our enemies."
417,2709379,2712439,"I am sending a personal message
to the Fire Lord,"
418,2712682,2715480,"informing him
that the once feared Avatar"
419,2715619,2719817,"is our prisoner
and no threat to our might."
420,2756626,2757923,Who are you?
421,2760797,2761889,Wait! Don't!
422,2762999,2764330,Stop!
423,2791695,2793026,Fools.
424,2794631,2798294,"Close the inner gates!
The Avatar has escaped!"
425,2807043,2808806,Lock down the gate!
426,2810046,2812378,Lock down all the gates!
427,2826930,2829330,To the main post!
428,2830000,2831160,This was their practice area.
429,2831301,2833895,Go again!
430,2956159,2958457,Do not kill the Avatar!
431,2958595,2960290,He will just be reborn again!
432,2961931,2963523,Why are you doing this? who are you?
433,2975078,2976136,Open the gates.
