Number,StartMilliseconds,EndMilliseconds,Text
455,2219468,2223180,I was upset about our session today.
456,2223431,2226350,I felt I owed you an apology.
457,2226767,2228728,That's why I came.
458,2230396,2232481,We can go into that tomorrow.
459,2233024,2234942,I've got a better idea.
460,2235192,2239238,"How about I ditch everybody
and we go somewhere for a drink."
461,2239697,2243284,"I told you, I don't socialize with my
patients."
462,2243784,2246078,Another one of your rules?
463,2246329,2248664,Don't you get kind of tired of them?
464,2248915,2252168,Ni
465,2252418,2255004,"Too many answers,
too many questions..."
466,2255254,2256714,nobody gets laid.
467,2262178,2264931,"Okay, forget getting laid."
468,2267183,2268601,We'll just talk.
469,2270019,2271979,We'll talk tomorrow.
470,2290915,2293417,Michael. There you are.
471,2293668,2298047,"Oh, my God. Did you see that woman
that Gerst brought with him?"
472,2298297,2299507,No.
473,2299757,2302385,"Actually, I was just looking for you."
474,2303678,2304804,"What, in there?"
475,2305054,2308015,"I was looking for your coat.
I thought we could go for a drink."
476,2308265,2309265,If that's all right?
477,2312353,2314105,Yeah. Great.
478,2355521,2357148,What's wrong?
479,2357398,2358524,Turn around.
480,2358774,2359774,What?
481,2359942,2361235,Turn around.
482,2403194,2404320,"Oh, God!"
483,2405571,2409617,"Michael, it's Denise!
Please pick up the phone! Please!"
484,2409867,2412286,"Michael, please pick up the phone!"
485,2412536,2413913,Denise?
486,2414413,2416624,"Hey, hey, hey. What's happened?"
487,2431764,2433516,"Thanks, guv."
488,2437853,2439772,"Come in, Michael."
489,2440022,2441607,"Hey, you okay?"
490,2444235,2445986,"HEY, What's going on?"
491,2446237,2448697,"It's okay, I'm here now. Okay?"
492,2448906,2450324,Who lives here?
493,2450574,2452326,It's Adam's place.
494,2489363,2490531,Jesus.
495,2491115,2492783,What happened?
496,2493033,2497663,"I don't know. The door was unlocked
and I just came in."
497,2497913,2499832,I just saw him lying there.
498,2502293,2504211,Have you called the police?
499,2504461,2506297,No. I was afraid.
500,2555095,2556847,"Hello, Michael."
501,2557097,2558891,What are you doing here?
502,2559141,2561393,"It's my wife. Well, my ex-wife."
503,2561602,2564313,"She found him like that,
then she called me."
504,2570778,2571946,I see.
505,2572196,2576200,"And how did she happen to
find him like that?"
506,2577284,2579995,They'd been seeing each other and...
507,2582414,2583832,"Oh, really?"
508,2584041,2585542,Since when?
509,2587002,2588712,It's why I moved out.
510,2590256,2593926,"So I assume you weren't
the best of friends?"
511,2594176,2595177,No.
512,2597638,2600683,"Yet I saw you talking to him
after the Tramell hearing."
513,2600933,2602559,It was just journalist stuff.
514,2602810,2605604,"He was asking me questions about
Tramell."
515,2605854,2607648,Do you think she killed him?
516,2609358,2610359,Who?
517,2613612,2615322,Denise? No.
518,2615572,2617658,"No, not a chance."
519,2617908,2621328,"I've known her for a long time.
She could never do anything like that."
520,2623539,2627501,"Listen, Roy, I've told my story twice
over. Is it all right if I go home?"
521,2629295,2630337,All right.
522,2632923,2634383,"Oh, by the way..."
523,2637303,2638429,this yours?
524,2642016,2644977,"No, I just found it on the floor."
525,2646478,2648772,How did it end up in the rubbish?
526,2649189,2653444,"I stepped on it. It was leaking.
I just threw it away."
527,2656947,2658407,Can I go?
528,2662077,2663787,"Yes, by all means."
529,2727935,2730562,"I assume you know Adam Towers
was killed."
530,2732064,2733690,Why would I know?
531,2734149,2736610,Because of Denise.
532,2736860,2738112,Denise?
533,2738362,2739822,Your wife. Your ex-wife.
534,2740072,2742449,"I know who she is.
How do you know her?"
535,2743033,2746161,Adam introduced us a couple of times.
536,2746412,2750416,"It was all very open. I knew about her,
she knew about me."
537,2750666,2752042,Knew what about you?
538,2755254,2757381,That I was seeing him too.
539,2758590,2761135,"The Masters and Johnson guy.
That was him."
540,2761385,2764430,"So... You were sleeping
with Adam Towers?"
541,2765013,2766807,Occasionally.
542,2770185,2772604,"So, of course,
Washburn thinks I killed him."
543,2772855,2774356,Why would he think that?
544,2775774,2780737,"I kill because I'm addicted to risk.
Or to prove that I exist."
545,2780946,2782406,I'm not sure which one it is.
546,2782656,2784575,I never said you killed anybody.
547,2784825,2786034,But you think I did.
548,2786285,2791081,"You think I killed Kevin, and now
you're wondering if I killed Adam."
549,2791290,2794918,"Why don't you just ask me?
Or is that too direct for you?"
550,2797463,2798922,Did you kill him?
551,2799923,2803218,"If I said I didn't,
would you believe me?"
552,2806889,2807889,Depends.
553,2808348,2812102,"On what?
The quality of my performance?"
554,2812352,2816106,"You know what?
I'm glad Adam Towers is dead."
555,2816356,2817983,And you should be glad too.
556,2818233,2820986,"If you're too uptight,
I'll be glad for you."
557,2821236,2823322,Whoever killed him did you a favor.
558,2823572,2824698,Favor?
559,2824990,2829244,"If he'd written that article on Cheslav,
it would've ruined your career."
560,2829703,2832706,"You haven't told me if you killed him.
Can you put that out?"
561,2835792,2838712,"Put it out now or you can leave,
okay?!"
562,2846053,2847304,Is that better?
563,2886426,2890222,When you think about fucking me...
564,2890472,2892849,and I know you do...
565,2893100,2896728,"how do you picture it, doctor?"
566,2899356,2903485,"Oh, I know you can't answer me,
so just think it."
567,2904695,2906446,Do you want it straight up?
568,2906697,2908156,You on top?
569,2908365,2909783,Me on tOD?
570,2911577,2914329,Do you want it from behind...
571,2917207,2921003,"on your knees,
my face in the pillow?"
572,2922379,2925132,Do you want to beat me up...
573,2925716,2927843,just a little?
574,2928135,2930053,Not too hard.
575,2931847,2934725,"Oh, a little harder than that."
576,2937936,2940564,Do you want to come in my mouth?
577,2943400,2948614,"What if I told you that I masturbate
thinking about you?"
578,2950032,2952117,That I make myself come...
579,2952367,2956455,"thinking about you
making yourself come."
580,2967007,2969384,I guess we're out of time for today.
581,2980103,2982022,I'm terminating therapy.
582,2982230,2983774,Send me the bill.
583,3028276,3030612,Are you feeling all right?
584,3059933,3061727,"Miss Tramell, it's Dr. Glass here."
585,3062519,3065689,"Listen, I'm concerned about how our
session ended today."
586,3065939,3068567,"I'd like to talk through
any misunderstandings..."
587,3068817,3070819,there might be between us.
588,3071069,3074114,"As soon as you get this message,
please give me a..."
589,3075532,3077659,Just call me when you can.
590,3077909,3079703,"Evening, Dr. Glass."
591,3080787,3082330,Could I have a word?
592,3082581,3084499,Sure. Upstairs.
593,3089421,3091047,Is that German?
594,3091298,3092716,Can I get you anything?
595,3092966,3094134,No.
596,3094384,3096261,So here's a surprise.
597,3096511,3100849,"Adam Towers had a girlfriend
besides Denise."
598,3101099,3102350,Guess who.
599,3103810,3105520,Catherine Tramell.
600,3107022,3108315,You don't look surprised.
601,3108523,3110442,She's a private patient of mine.
602,3110692,3112110,I see. Since when?
603,3112360,3113361,Not long.
604,3114654,3119326,"So your ex and your private patient
were both screwing Adam Towers."
605,3119576,3122662,"That's quite a coincidence.
Did they know each other?"
606,3122913,3125373,"I don't know. I don't think so.
Did you...?"
607,3127959,3133131,"Tramell's prints were all over Towers'
apartment, along with others."
608,3133381,3137511,"But what's interesting is the last call
he made was to her mobile phone..."
609,3137761,3139805,90 minutes before he died.
610,3140055,3142307,"Her story is she was out walking all
that time."
611,3142557,3146311,"Two hours strolling around Clerkenwell
and nobody saw her, so..."
612,3146561,3149523,"Come on, Michael. Talk to me."
613,3150607,3154444,"I can't tell you anything. Even if I
knew something, which I don't."
614,3156029,3160033,"Franks was first. Towers second.
There's bound to be a third."
615,3160283,3161993,This goes beyond confidentiality.
616,3162244,3165747,"You've got a legal obligation to protect
a potential victim."
617,3165997,3169918,"You can't lock somebody up because
you think they might do something."
618,3170168,3173547,"Why don't you tell me what you know
about this article..."
619,3173797,3177217,"Towers was writing about you
and our old friend George Cheslav."
620,3179678,3181847,"Who told you
he was writing an article?"
621,3182222,3183348,His editor.
622,3183598,3186643,"He'd been very busy.
He had a lot of information on you."
623,3188478,3190146,"What, and you think I killed him..."
624,3190397,3192607,"to stop him writing
some stupid article?"
625,3193316,3198697,"No. But just for the record, why don't
you tell me how you spent last night."
626,3198947,3201783,"Between, say,
7 p.m. and 2 in the morning."
627,3202033,3204494,"You know, broad strokes."
628,3207080,3209374,I had patients until 8 p.m.
629,3209624,3211668,"Then went to a party
in Collingham Gardens."
630,3211918,3213628,I left there about 11 with a woman.
631,3213879,3217591,"We came here and I was on my knees
fucking her when Denise called."
632,3221970,3223680,"On your knees, eh?"
633,3224931,3227934,"Sounds like your evening
was better than mine."
634,3228184,3232230,"Could I get her name?
So there are no loose ends."
635,3234566,3238278,"Look, Michael, Adam Towers
was fucking your ex-wife..."
636,3238528,3242824,"and about to do the same
to your career. I've got to ask."
637,3247704,3249205,Michelle Broadwin.
638,3250832,3255211,"She's a psycho-pharmacologist at
Victoria Psychiatric Hospital."
639,3258590,3259674,Thank you.
640,3262093,3263511,I'll be in touch.
641,3268767,3269893,What does that mean?
642,3273772,3275315,I smell blood.
643,3290455,3295377,"Yeah, not all of them, of course, but,
you know, some of them."
644,3295627,3299464,They're all so sanctimonious...
645,3299714,3301800,so judgmental.
646,3302050,3307514,"All my friends, they drink too much.
They snort too much coke."
647,3307764,3310141,"Miss Tramell,
it's Dr. Glass here again."
648,3310392,3313144,"I'm a little concerned
I haven't heard from you."
649,3313395,3315647,I was wondering whether you're okay.
650,3315897,3319901,"Look, let me give you
my home number. It's 0207..."
651,3320151,3324364,"Sorry, it really got to me and I don't
know why it seems to be doing that."
652,3324614,3328743,"Why it's getting worse.
I mean, I was really excited."
653,3328994,3331913,You have no new messages.
654,3359274,3361109,The thing about Gerst is this:
655,3361359,3364112,"The selection committee
is just a formality."
656,3364362,3366281,This is the real interview.
657,3368033,3369784,Relax.
658,3369993,3372912,"Be direct, candid."
659,3373204,3375582,But not too candid.
660,3377709,3381546,"Very good time. They always get lost
on the way. Come in."
661,3381796,3383590,Meet my new Mughal painting.
662,3383840,3385550,Not another one.
663,3385800,3389971,"An Indian goddess at peace. It has a
tranquility to it, don't you think?"
664,3390638,3394517,"I wonder what the males are doing,
loitering so close to her?"
665,3394768,3398188,It's obvious. They're worshiping her.
666,3398480,3399606,As they should.
667,3400065,3403568,"Perhaps that's why she has eight arms
to fend them off."
668,3403818,3408114,"Why don't you girls go outside
while Dr. Glass and I have our chat."
669,3409574,3411785,Come. Come.
670,3412410,3415371,Come with me. You'll enjoy it.
671,3419751,3422754,"So, Dr. Glass, I have a question:"
672,3423213,3424923,Do you think I'm insane?
673,3426758,3427758,Pardon?
674,3428259,3430386,Nuts? Bonkers? Off my trolley?
675,3431262,3432889,"No, not at all."
676,3433515,3436768,"But I might be if I recommended you
for the Douglas Chair."
677,3439229,3440480,"I'm sorry, I don't understand."
678,3441189,3443108,George Cheslav.
679,3443775,3448822,"A major drug dealer, under your care,
brutally murders his girlfriend."
680,3449072,3451199,An inquiry is held...
681,3451449,3455161,where Detective Roy Washburn...
682,3455411,3458706,"testifies that you acted
professionally at all times."
683,3458957,3459957,You're blameless.
684,3460083,3461167,"That's right, I was."
685,3462168,3465880,"However, after the trial..."
686,3466131,3469843,"you experienced what we might term
an emotional meltdown:"
687,3470135,3471344,Depression...
688,3471594,3473721,occupational underachievement...
689,3473930,3475598,marital problems...
690,3475849,3479227,"and questionable professional
conduct..."
691,3479477,3483356,"much discussed at dinner parties
around our great city."
692,3485775,3486818,I'm sorry?
693,3488153,3490864,"Now you want my support
for the Douglas Chair."
694,3495994,3498204,"No more Cheslavs, Michael."
695,3501166,3502292,No.
696,3508590,3510300,No more Cheslavs.
697,3610483,3611483,Catherine!
698,3625540,3628835,"Sorry. All right.
Sorry, I'm just looking for someone."
699,3704744,3706913,"God, Michael, how dramatic."
700,3707205,3708205,I know.
701,3708373,3712043,"I thought she was in danger,
but I know that's not the point."
702,3712293,3714295,She could be a murderer twice over...
703,3714545,3718091,"and you're acting like she's a
princess you have to rescue."
704,3718383,3720551,"Don't patronize me, please."
705,3722387,3724347,It's driving me crazy.
706,3726641,3728893,"You're in love with her, aren't you?"
707,3730478,3732271,Not love. It's...
708,3734565,3735942,I don't know.
709,3740613,3743741,"You have to terminate this therapy,
right away."
710,3745034,3748162,"Well, it's already done.
She terminated it herself."
711,3748413,3749413,Good.
712,3750415,3753459,"If she calls again, give her my number."
713,3757672,3759632,I'm a woman.
714,3759882,3762677,She'll relate to me differently.
715,3805928,3807847,What are you doing here?
716,3808097,3810266,"Where she goes, I go."
717,3810516,3811601,Since when?
718,3811851,3815480,"Since she started coming
to your office five days a week."
719,3818232,3823029,"So, Adam Towers.
Seems his research has gone missing."
720,3823279,3826240,"All his notebooks, audiotapes,
even his hard drive."
721,3826491,3829202,"Everything on George Cheslav
and Michael Glass."
722,3829452,3831996,"- You think Catherine has it?
- I know she does."
723,3832246,3835583,"She ever tell you about them
when she's chatting on the couch?"
724,3835791,3837001,You know I can't discuss that.
725,3837251,3840463,"Come on. I've been very good to you
these past few years."
726,3840713,3843466,"I'm practically a psychopath
delivery service."
727,3843716,3845259,I can't break privilege.
728,3845510,3848804,"Pity. I have something
you might like to know about."
729,3849055,3852433,"Someone says you'd been lying
at the Cheslav inquest."
730,3852683,3854101,Who?
731,3854352,3856896,You want me to break privilege?
732,3858397,3861817,"Since you're a friend,
it was your ex-wife."
733,3862068,3863528,Denise?
734,3863819,3865571,You want to sort her out.
735,3865821,3869742,"Who knows, she might tell you
where Towers' notes went."
736,3892098,3896394,"Someone's here.
Do you want us to say?"
737,3896644,3898980,I'll be all right. Don't worry.
738,3899230,3900731,We'll see you later.
739,3904151,3905236,How you doing?
740,3906946,3908114,Okay.
741,3909865,3911117,Do you want a drink?
742,3911367,3913578,"No, I have to go."
743,3913828,3916497,"I'm meeting someone
at the Atlantic Bar."
744,3917582,3922420,"Denise, did you tell Towers that
I lied at the Cheslav inquiry?"
745,3923921,3926966,"Of course, there's always an agenda."
746,3927216,3931095,"No. I said you knew he was going
to kill his girlfriend."
747,3931345,3932555,I didn't. That's a lie.
748,3932805,3934015,"Yes, you did."
749,3934265,3938728,"You kept saying how you knew
and should have gone to the police."
750,3939020,3943566,"I didn't know. I sensed. And I told you
that as my wife in confidence."
751,3943816,3947778,"I didn't think you'd go and repeat it
in bed to some moron reporter."
752,3950239,3953826,"Do you want to ruin my life, is that it?
You want to ruin my practice?"
753,3955161,3958539,Your life? Your practice?
754,3958789,3962001,"Catherine was right,
everything's always about you."
755,3962251,3965296,"What about me? Adam's dead
and I'm a murder suspect."
756,3965546,3969967,"Washburn keeps going on about me
not cooperating, like I'm a liar."
757,3970217,3972136,I don't know where Adam's notes are.
758,3972386,3975723,"I'm scared to go home. I'm scared
to go out. I'm going out of my mind."
759,3975931,3977224,Be careful about Catherine.
760,3977475,3978809,Don't tell me what to do!
761,3979018,3980018,Just calm down.
762,3980227,3982188,Don't tell me to fucking calm down!
763,3982438,3983438,"Hey, come on."
764,3983606,3986692,"That's my wife, okay?
This is a private conversation."
765,3986942,3988903,Get out of my way! Out of my way!
766,4114028,4116489,"Denise. Oh, Denise!"
767,4116739,4118032,Come on.
768,4119116,4121118,"Come on, come on."
769,4128125,4130711,"Come on, Denise. Look at me."
770,4131962,4133380,Call an ambulance!
771,4133923,4135508,Do it now!
772,4136592,4138469,Come on. Let's go.
773,4139929,4143057,Stay with me. Come on. Stay with me.
774,4144391,4146227,Come on. Stay with me.
775,4179260,4181470,"You have a problem, Michael."
776,4183347,4187142,"Witnesses say they saw you arguing.
She was crying."
777,4187393,4190354,"You grabbed her.
She almost fell down."
778,4190604,4194149,"Five minutes later,
somebody slits her throat."
779,4196026,4199989,"Also, there are people here who think
you killed Towers."
780,4200239,4203576,Towers? Didn't you speak to Michelle?
781,4203826,4207538,"Yes. But now I'm hearing about this
cigarette lighter with your prints on it."
782,4207788,4208831,I just picked that up.
783,4209039,4213836,"And your ex is in a coma just as she's
to say something inconvenient for you."
784,4214086,4216005,I was trying to save her life.
785,4220467,4224388,"Look, I spoke to Towers' assistant
at Urbane magazine."
786,4224597,4228475,"He expected Denise to say that you
perjured yourself at Cheslav's inquiry."
787,4228726,4230185,She wasn't going to say that.
788,4230436,4232187,What was she going to say?
789,4238402,4239612,"Sorry, guv."
790,4249663,4251165,You wait there.
791,4308806,4309974,So...
792,4311558,4316689,"Your ex and Catherine Tramell
were girl buddies. Did you know that?"
793,4318065,4320067,"What do you mean ""girl buddies""?"
794,4320317,4324822,"According to Catherine,
they met through Towers and hit it off."
795,4328409,4331495,"Denise told Catherine that Towers had
been pressuring her..."
796,4331745,4334456,"into saying that you'd perjured
yourself."
797,4334707,4338585,"But Denise wasn't having it.
She was going to say you were clean."
798,4340212,4343465,"You didn't know Cheslav was going to
kill his girlfriend, did you?"
799,4343716,4346468,"In fact, it came
as a complete surprise, didn't it?"
800,4351557,4353767,"- Of course she's lying.
- How do you know?"
801,4354018,4358147,"Everything that comes out of her is a
lie. Even the truth's a lie with her."
802,4358397,4361358,"It's her way of getting you to think
what she wants you to think."
803,4361608,4363777,That's her art. The art of mind-fucking.
804,4364028,4365738,She might be a talented writer.
805,4365946,4369199,"When it comes to mind-fucking,
she's the all-time genius."
806,4372661,4374705,"She really got to you, didn't she?"
807,4378042,4381128,"What do you mean?
What did she tell you about me?"
808,4381712,4384214,"Well, what is there to tell?"
809,4384465,4388343,"Don't play games with me.
She can pull it off, you can't."
810,4392765,4393932,Where are you going?
811,4394183,4398103,"Someplace else. Unless
you have evidence to charge me."
812,4399438,4400606,Do you?
813,4402649,4404234,I didn't think so.
814,4442940,4445067,"He let you go, finally."
815,4445317,4446777,I was worried.
816,4447861,4450989,You lied to Washburn for me. Why?
817,4451406,4454076,I knew you hadn't hurt Denise.
818,4454326,4456787,How could you know that?
819,4457037,4459873,Because I know you.
820,4460124,4463752,"And I know the cops were keeping you
just to play some kind of game."
821,4464002,4466380,"What, like getting me
to talk about you?"
822,4466630,4471468,"Yeah, but you wouldn't do that,
because you're into confidentiality."
823,4474763,4476723,Why were you meeting with Denise?
824,4477266,4479852,Research for my novel.
825,4480310,4481603,Research.
826,4481854,4482896,About what?
827,4483188,4484857,About you.
828,4485107,4488026,"And Cheslav, the masked psychotic."
829,4491113,4494616,"The analyst in my book is obsessed
with that sort of thing."
830,4496660,4499621,"Washburn thinks
that you slit Denise's throat."
831,4501248,4504668,Me? You're the one that hated her.
832,4504918,4507880,"Maybe I'm acting out
your unconscious impulses."
833,4508213,4509423,Stop it!
834,4512551,4516680,"Do you think it's possible that
you want me to be the killer?"
835,4516930,4521268,"You know, how some guys
are into blonds..."
836,4521518,4523854,and some guys are into killers.
837,4525522,4527191,Isn't that what you're into?
838,4530485,4532988,Isn't that what turns you on?
839,4535407,4536742,Turns me on?
840,4541413,4543707,Isn't that why you're over here?
841,4586792,4587793,Okay.
842,4589044,4590587,I trust you.
843,4591964,4593382,You trust me.
844,4675505,4677841,Is there somewhere we can talk?
845,4678091,4679468,Over there.
846,4694858,4696360,Can I guess where you got it?
847,4696610,4698403,Let's find out what it is first.
848,4698653,4703200,"It would be highly improper of me to
accept any evidence in this fashion."
849,4703450,4704618,Fine.
850,4704826,4708163,"It'll take me a few days
to get it analyzed."
851,4708413,4711249,"You'd have made a good cop, Michael."
852,4711500,4713710,You like the smell of blood.
853,4722302,4724304,Dr. Glass.
854,4724554,4726306,Hold on.
855,4726556,4729226,I was just thinking about you.
856,4729476,4732854,"I might have more
psychiatric evaluations for you."
857,4733105,4735190,"That's nice, but I'm busy
at the moment."
858,4735857,4740362,"Oh, that's a pity.
You were so good with Catherine."
859,4740612,4743865,She tells me you're very perceptive.
860,4744116,4746493,She's very perceptive herself.
861,4749955,4754709,"I hope Detective Washburn isn't giving
you cause for..."
862,4754960,4756169,concern?
863,4757587,4759047,What do you mean?
864,4759297,4761842,"Well, given his past record."
865,4764928,4766471,What past record?
866,4829159,4830660,I want to talk to you.
867,4830911,4832662,"Oh, so now you want to talk."
868,4832913,4836791,"Look, this ""Dirtiest Cop in London,""
it doesn't mention him by name."
869,4837042,4840545,"But this ""Detective X,""
is that Roy Washburn?"
870,4843548,4845133,Is it Washburn?
871,4846259,4847552,Excuse me?
872,4851640,4853433,"Yeah, it's him."
873,4856937,4858021,Are you sure?
874,4858271,4862317,"Adam may have been a sloppy writer,
but he had excellent sources."
875,4862567,4866905,"What about perjury, intimidation,
falsifying evidence. Is that true?"
876,4867155,4868740,A policeman fabricating evidence.
877,4868990,4870033,But you have proof?
878,4870283,4873370,"How about Kevin Franks
and the Case of the Killer Orgasm?"
879,4873620,4876706,"When I did Catherine Tramell's
assessment, I read that report."
880,4876915,4879626,In
881,4879834,4882963,"Yeah, well, who found
the syringes in the car?"
882,4883213,4885215,But why would Washburn do that?
883,4885465,4887759,"Adam thought he did it to set up
Catherine Tramell."
884,4888009,4889719,Why didn't he write about it?
885,4892764,4894391,That's the whole point.
886,4895475,4897227,He was going to.
887,4898395,4900063,Then he got killed.
888,4923378,4926923,"I owe you an apology.
About Roy Washburn. L..."
889,4927173,4928550,I don't like apologies.
890,4931553,4936474,"I also don't like people stealing things
from my apartment."
891,4939185,4943607,"The insulin? In case you haven't had it
analyzed yet."
892,4944941,4945941,Insuhn?
893,4946109,4947986,My friend's diabetic.
894,4948236,4950822,"Let yourself out, doctor."
895,5006336,5007796,"Hello, Michael."
896,5011341,5012384,What do you want?
897,5012634,5014511,I got the lab analysis back.
898,5014761,5018264,D-Tubocurarine. Funny that.
899,5020100,5021851,You're sure it's not insulin?
900,5022435,5023895,Insuhn?
901,5024145,5025230,No.
902,5025480,5027524,Can I see the report?
903,5029275,5033863,"You've got some trust issues there.
You might want to work on that."
904,5043081,5046793,"This isn't an official
Forensic Services report."
905,5047001,5051756,R ..
906,5052006,5057262,"Will be deemed inadmissible
in a future trial, Inspector Clouseau."
907,5058596,5061057,"So do you want to tell me
where you found it?"
908,5066938,5068273,She's not worth it.
909,5068481,5071276,"People are dying
and I will have her for it."
910,5071484,5073987,"If you stand in my way,
I'll have you as well."
911,5074237,5076156,I can fucking promise you that.
912,5081119,5083872,"I've got something to show you.
Get in the car."
913,5087375,5088626,Get in!
914,5104392,5106728,Medical examiner's on his way.
915,5120992,5122368,"HeHo, guv."
916,5130627,5133713,Were you working that night?
917,5133963,5135882,"No, I don't know."
918,5137133,5140762,"Did you see or hear
anything suspicious yesterday?"
919,5141012,5142639,Not yesterday. No.
920,5142889,5145225,"- Nothing?
- No."
921,5145475,5146893,How long have you worked here?
922,5147185,5148520,Four months.
923,5148770,5149979,Four months?
924,5151231,5153107,Where were you before that?
925,5158279,5159279,Ted.
926,5159447,5160532,"Hi, guv."
