Number,StartMilliseconds,EndMilliseconds,Text
927,5160782,5163618,"- Remember I talked to Vice earlier and
they said..."
928,5163868,5165578,"Fergie, give me a minute."
929,5165829,5166871,Let's go.
930,5187642,5189143,Who is he?
931,5189394,5194065,"Richard Pepovic.
Known to his friends as Dickie Pep."
932,5197610,5198987,You know him?
933,5199237,5200613,No.
934,5200864,5202407,Look at this.
935,5210748,5215587,"Now, we'll have to wait for the lab
results, of course..."
936,5215837,5220216,"but what's the betting he's oozing
Tubocurarine?"
937,5222427,5225305,"Now do you want to tell me
who gave you the sample?"
938,5231477,5233271,You don't know she did it.
939,5234522,5235565,No.
940,5237650,5241279,"But then again, maybe I killed him."
941,5242363,5244324,Isn't that what she's gonna tell you?
942,5244532,5246618,"He had something on me,
so I killed him."
943,5246868,5249787,"Then I jerked him off
even though he was dead..."
944,5250038,5252290,"to make it look like
there was come everywhere..."
945,5252540,5254125,to make it look like it was her.
946,5257337,5262342,"Look, Towers was right about me,
I put them away whatever it takes."
947,5262592,5264886,"So, fine, don't trust me."
948,5265136,5267096,You know Catherine better than me.
949,5267347,5269599,"If you have five seconds
when you're not dizzy..."
950,5269807,5273227,"with the smell of her pussy,
ask yourself: Do you trust her?"
951,5274812,5275897,Do you?
952,5281527,5285406,"She's George Cheslav, times three.
We both know it."
953,5285657,5287825,"The question is:
How do we put her away?"
954,5288076,5292372,"If you tell the courts that she's made a
direct threat against someone..."
955,5292580,5293665,But she hasn't.
956,5293915,5297043,"If you say she did, and that got her put
on a psych ward..."
957,5297293,5300421,"stopped her from killing again,
wouldn't that be worth it?"
958,5300672,5304300,"Some kind of redemption
for Cheslav at last?"
959,5308012,5310932,"Look, I'm prejudiced."
960,5311182,5313476,Don't take my word for it.
961,5314852,5316604,Talk to this guy.
962,5321234,5322860,Listen to him.
963,5348678,5351222,Lieutenant Walker. It's Michael.
964,5351472,5353474,"Look, thanks for talking to me."
965,5353725,5356978,"It's just that I did an evaluation
of Miss Tramell..."
966,5365236,5369407,"Darkness had fallen and even before
the buzzer sounded..."
967,5369657,5372869,Kelly knew it would be the doctor.
968,5373119,5376164,"He'd come to accuse her
of more crimes."
969,5376414,5378875,"They'd fight about that
and then have sex..."
970,5379125,5381586,"and everything would be
all right again."
971,5381836,5383379,Except it wouldn't be...
972,5383629,5385590,if he didn't trust her.
973,5421542,5422668,"Hi, handsome."
974,5423127,5424545,My new novel.
975,5424796,5427381,"I'm anxious to hear
what you think about it."
976,5428758,5431385,"I've been speaking
to Lieutenant Phil Walker..."
977,5431636,5434388,"the San Francisco
Police Department."
978,5434639,5439393,"Paranoid Phil.
Now there's a blast from the past."
979,5439644,5444107,In
980,5444357,5446567,I was never even charged.
981,5446818,5450363,"Grand jury said that Nick Curran's
girlfriend did it."
982,5452824,5456828,"I'm going to take a Jacuzzi.
Care to join me?"
983,5462792,5467088,"All right, all right.
I killed Johnny Boz."
984,5467338,5468506,Why?
985,5468756,5470883,I didn't like him.
986,5471134,5473010,For the money.
987,5473261,5475805,To see if I could get away with it.
988,5477515,5481310,"To show that death
really isn't very important."
989,5481519,5482895,Because I was bored.
990,5483187,5485648,And you know how I hate being bored.
991,5485898,5487650,"What about Denise, huh?"
992,5487900,5489026,Adam Towers?
993,5489277,5491487,Adam was insufferable.
994,5491737,5493781,And you are something special.
995,5495074,5499745,"Adam was trying to ruin you just
out of spite, and I couldn't bear it."
996,5501581,5503249,This is wonderful.
997,5509338,5510548,Denise.
998,5511132,5514802,Denise... Denise was good in bed.
999,5515052,5518472,"Denise would have spoiled
everything I'd accomplished..."
1000,5518723,5520683,by killing Adam Towers.
1001,5521893,5525021,"God, you can't tell the truth
about anything, can you?"
1002,5527190,5529734,"You don't believe me
when I say I did it."
1003,5529984,5532904,"You don't believe me
when I say I didn't do it."
1004,5533154,5536157,"What is the point
of talking to you, anyway?"
1005,5539827,5541537,"Oh, come on."
1006,5543998,5547001,"Why don't you take your clothes off
and get in, huh?"
1007,5559180,5562767,"This is worse than Cheslav, isn't it?"
1008,5563017,5566687,"This time you knew
right from the start what I was."
1009,5568814,5572109,"And you let it happen again,
didn't you?"
1010,5573694,5577114,"It's almost like you
killed them yourself."
1011,5585915,5588751,"Who do you think
I'm going to kill next?"
1012,5594131,5595841,Come on.
1013,5596092,5598761,You can figure it out.
1014,5710456,5714168,"Kelly met the analyst during her little
stay at Holloway Prison."
1015,5715544,5718839,"His eyes were
a beautiful shade of blue."
1016,5719048,5721509,Did Kelly trust the doctor?
1017,5721717,5724887,"Did she mean it
when she told him she wanted help?"
1018,5725137,5727098,Even she wasn't sure.
1019,5727348,5729892,"If things went well,
then she meant it."
1020,5730142,5731560,"If not, she didn't."
1021,5731811,5733562,"That way, she'd be protected."
1022,5733813,5735773,"She remembered the first time
she met Irena..."
1023,5736023,5737358,at the party in Bloomsbury.
1024,5737608,5739652,"She felt a deep affinity
for the older woman."
1025,5739902,5743030,"As if the two of them leaning against
the wall, silently smoking..."
1026,5743280,5745157,The next time they saw each other...
1027,5745366,5747660,"only brought
the two women even closer."
1028,5747910,5750204,"Even as Dr. Green watched them
through the window..."
1029,5750454,5752623,looking for any sign of conspiracy.
1030,5752873,5756127,"Kelly found herself opening up,
trusting the older woman..."
1031,5756377,5758462,revealing things about herself...
1032,5758712,5761048,"Yes, Kelly thought. She liked Irena."
1033,5761298,5765803,"She was trustworthy, intelligent,
beautiful, dignified."
1034,5766053,5770433,"It was a pity
Kelly was going to have to kill her."
1035,5785364,5787199,She dressed carefully.
1036,5787408,5790911,"She liked to be well-dressed
when she killed."
1037,5791162,5794874,"Killing Irena and telling Dr. Green
she was planning to do it..."
1038,5795124,5798085,"that was the riskiest thing
she could do."
1039,5800421,5801964,"Come on, Milena."
1040,5806177,5808345,"Come on, Milena, answer the phone"
1041,5810181,5814351,"It's Michael Glass here. Can you call
me as soon as you get this message?"
1042,5815853,5818314,As much as Kelly hated her shrink...
1043,5818564,5821358,she also loved him.
1044,5821567,5825404,"She took a last glance at herself
in the mirror."
1045,5825654,5830451,"Irena deserved a good death.
And Kelly would give it to her."
1046,5830701,5833746,"Hello, this is Roy Washburn,
please leave a message."
1047,5833954,5837333,"Roy. It's Michael Glass.
Come as soon as you can."
1048,5837583,5841045,Hi
1049,5841295,5845424,"I think Catherine is going to kill
Milena Gardosh."
1050,5852264,5857394,"It was almost midnight by the time
Dr. Green got to Hampstead."
1051,5873744,5874744,What is it?
1052,5874912,5877831,"Thank God.
Listen, we don't have much time."
1053,5878082,5880793,"You're in danger.
She's going to try and kill you."
1054,5881001,5883087,What? Who's trying to kill me?
1055,5883546,5884672,Catherine.
1056,5889051,5891512,"I thought I could help her
but I was wrong."
1057,5891762,5895474,"I'll try and get her sectioned.
It's the only thing that'll stop her."
1058,5896725,5898769,I've already spoken to Catherine.
1059,5902940,5905609,She's very upset. You terrified her.
1060,5907194,5911282,"I terrified her? She's a murderer.
She's already admitted it."
1061,5911532,5914159,Fr r
1062,5914410,5916662,"You assaulted her.
She nearly drowned."
1063,5918914,5922876,"You've broken the law, not to mention
the ethical canon of our profession."
1064,5923168,5924169,It wasn't like that.
1065,5924420,5926505,"Michael, listen to me, please."
1066,5926755,5928549,You're not well.
1067,5929842,5931552,You're the one who needs help.
1068,5936140,5937891,...
1069,5938142,5942730,"and he thinks that if you volunteer
for a 28-day observation..."
1070,5942938,5945899,"you might be able to avoid
criminal charges."
1071,5947192,5951655,"However, they will have to
revoke your license."
1072,5952740,5953741,I'm sorry.
1073,5954908,5956243,She's right.
1074,5956744,5959204,"It's for your own good, Michael."
1075,5964752,5967379,"She asked me
to take over her treatment."
1076,5968797,5970716,She's my patient now.
1077,5973177,5974511,"Please, don't."
1078,5978390,5980809,"You've no idea what
you're getting into."
1079,5982645,5984021,Tell her the truth.
1080,5986649,5988025,Tell her the truth.
1081,5990235,5991654,I'll make you tell her the truth.
1082,5997284,5998284,God.
1083,5999870,6000870,Come on.
1084,6007503,6009838,"She's right, you know."
1085,6010089,6012800,You really do need help.
1086,6018931,6019973,Bitch.
1087,6025604,6027272,"So, what's this about?"
1088,6029566,6030693,Protection.
1089,6031151,6032986,"Oh, yeah? From who?"
1090,6035781,6037116,Washburn.
1091,6041495,6042746,Go ahead.
1092,6047710,6051296,"Kelly Lash kills Irena,
Dr. Green's colleague."
1093,6051547,6053507,"No, I read your book."
1094,6053716,6057344,"So you just rushed right over here
to save her?"
1095,6057594,6061849,"It's just a story, doctor.
Or maybe I really am omnipotent."
1096,6064184,6069440,"Congratulations,
the control freak finally lets go."
1097,6069690,6073569,"This is what you wanted from the start,
wasn't it? To ruin me, to fuck me up!"
1098,6074903,6076905,"Feels good, doesn't it?"
1099,6079116,6084538,"No more ""I should've stopped Cheslav
from killing his girlfriend."""
1100,6084788,6088000,No more whining over nothing.
1101,6088417,6091086,"- It wasn't over nothing.
- Yes, it was."
1102,6091336,6094423,Cheslav did not kill his girlfriend.
1103,6095549,6097217,Washburn did.
1104,6099136,6100304,Washburn?
1105,6100554,6104516,"What do you think Adam Towers was
writing about when he was killed?"
1106,6105058,6109313,"You're lying.
You're a lying fucking bitch."
1107,6109563,6113066,"Sure I am,
if it makes it easier for you."
1108,6114693,6118614,"Why? Why would he kill
the girlfriend?"
1109,6121074,6123076,T nail
1110,6133962,6135506,That's right.
1111,6136924,6138801,Your seven years of hell.
1112,6140093,6141845,Your meltdown.
1113,6142095,6143764,Your divorce.
1114,6145349,6150145,"Just so your good friend Roy
could nail a drug dealer."
1115,6160781,6162449,Don't take it so hard.
1116,6162699,6166161,"Even Oedipus
didn't see his mother coming."
1117,6173627,6175754,It's Roy Washburn.
1118,6177673,6180092,Give me the gun. Give me the gun!
1119,6180509,6181760,Fuck off!
1120,6182010,6186473,"Give me the gun! He knows I've got
Towers' notes. He wants me dead."
1121,6186723,6188600,Open the door!
1122,6188851,6191270,"He's going to kill me
and say you did it."
1123,6191895,6195399,"No. No, this is all fucked up."
1124,6195649,6199695,"You don't know what you're doing.
Give me the gun. He's going to kill me."
1125,6199945,6201238,You...!
1126,6205284,6206952,"Go ahead, then, baby."
1127,6223051,6225846,"Whatever she told you, she's lying."
1128,6228932,6230350,Kill her!
1129,6230601,6233061,It's the only chance you've got.
1130,6269473,6271058,Let go of the gun!
1131,6271308,6272684,Clear the weapon!
1132,6272935,6275228,"- Stay still!
- Get off me!"
1133,6275479,6278023,Stop struggling! Stop struggling!
1134,6278273,6282277,"Stay down! I'm telling you
to stay down. Okay?! Stay down!"
1135,6282736,6284196,Get the cuffs on him.
1136,6285614,6287324,"- Call an ambulance!
- Keep still!"
1137,6287574,6289576,Call an ambulance!
1138,6300587,6302089,Stay down!
1139,6330617,6333078,Calm down! Calm down!
1140,6333328,6335038,Nighttime! Nighttime!
1141,6335288,6336915,You'll be home soon.
1142,6363650,6365068,"Hello, Michael."
1143,6371074,6372909,I brought you a present.
1144,6375537,6379875,"I know you read an earlier draft.
But you gave me a better ending."
1145,6381877,6382878,"So, thank you."
1146,6395265,6397768,Would you like me to tell you the plot?
1147,6403023,6404941,It's about an American.
1148,6406234,6407527,A blond.
1149,6407778,6409404,A novelist.
1150,6409654,6412657,People around her just keep dying.
1151,6412908,6414493,But the question is:
1152,6414743,6416286,Who's killing them?
1153,6417913,6422542,"Is the beautiful blond novelist
a serial killer?"
1154,6424294,6426546,Or is it the crooked cop?
1155,6427923,6429549,Her analyst isn't sure.
1156,6429966,6433386,But he goes crazy trying to find out.
1157,6434638,6436723,But that's just half the story.
1158,6436973,6438266,There's a twist.
1159,6440477,6445315,"You see, the novelist
never really killed anybody."
1160,6445565,6447901,And neither did the cop.
1161,6448151,6451154,The real killer all along...
1162,6451404,6453115,was the shrink.
1163,6469005,6472092,"Yeah, from the moment he saw her..."
1164,6472342,6476680,"he knew she was the smoke screen
he was looking for."
1165,6480600,6483395,His best opportunity to get even.
1166,6486398,6487524,First...
1167,6488775,6492904,"he'd deal with that scumbag
journalist."
1168,6495073,6499244,"You see, you don't just go around
stealing another man's wife."
1169,6502622,6504040,It's humiliating.
1170,6511131,6514092,Not that she was a complete innocent.
1171,6514342,6516178,That weekend slut.
1172,6518430,6523518,"Jesus, how could she
let that sleazebag touch her?"
1173,6529774,6531067,It's hurtful.
1174,6533028,6536281,"And there's some hurts
you don't just get over."
1175,6541536,6542787,Jealousy.
1176,6546833,6550003,Jealousy can make us do crazy things.
1177,6559930,6561973,But getting away with it...
1178,6565727,6567854,that was genius.
1179,6570148,6572651,"""Unfit to stand trial."""
1180,6574110,6577113,"No prison for him,
just a happy ending..."
1181,6577530,6582869,"in a quiet, sunlit, peaceful
psychiatric institute."
1182,6590669,6594589,"Of course, that could all be a fiction."
1183,6597217,6599803,He might really be insane.
1184,6633420,6635255,"Come back soon, baby."
1185,6637716,6639259,I miss you.
